id,title,abstract,year,field,author,inCitation,outCitation,journalName,journalVolume,journalPages
69863707865edba2b67c093a49d309b0f9108db9,Foresight of Macro Environment in Agribusiness: Dynamic Relationships of Food Consumption and Agricultural Production (Analysis of the Relations between Agricultural Production and Domestic Consumption),"The article is devoted to an important economic element agribusinessforesight the analysis of general economic conditions, and specifically the search for links in the production of agricultural products in general and domestic consumption of basic food products. As the main research methods for the current research there were used LASSO Regression method with a regularizer and Gradient Boosting Machine algorithm. The time series from 1991 to 2018, transformed into the form of annual percentage changes, were used as the initial data. At the beginning, a preliminary selection of features was made, and further two corresponding models were formed on the basis of the selected hyperparameters. As an additional target variable, a series of production was created with a time lag of one period in relation to the rest of the series. The degrees of the linear and nonlinear relationships for various types of food are determined, as well as differences in aggregates of crop production and animal husbandry are revealed. General recommendations are given within the framework of the policy for the development of the institutional environment of agribusiness and its foresight systems.",2020,Economics,"list(name = ""Roman Borisovich Shestakov"", ids = ""114042788""); list(name = ""Nikolay A. Yakovlev"", ids = ""147721481""); list(name = ""G. P. Zvereva"", ids = ""98375027""); list(name = ""A. S. Volchenkova"", ids = ""121946701"")",,e914d431520f4cb60b9d80b123f7d43782c1aba8; d3c6a86aa83091ffeadf62e793dee0f75966d1f1; 76a8c1842acd23fea0bf07f9d0e7bbbc89c23252,,,
981e5a6c563874b4d501a7e3f74b2998207682d2,Selection of Academic Influence Evaluation Index of Network Science and Technology Articles,"The influence evaluation effect of network science and technology articles depends on the selection of evaluation index variable.Firstly,this paper associates influence evaluation of science and technology articles with their ranking in popular open-access journal databases.It takes mathematics articles from the WOS database as sample,and respectively selects ten articles from the top six ranking groups which are 0.01% ã€0.01%-0.1% ã€0.1%-1% ã€1%-10% ã€ 10%-20% and 20%-50%.With literature information method,28 different features are extracted from each of these articles from three aspects of the article content,the journal publishing articles,and the authors.Then it takes the ranking level of 324 articles and 28 academic link indexes as the sample,to study the ""ordinal regression model"".Secondly,with Lasso method,based on the variable selection and parameter estimation of 28 academic link indexes,it obtains 9 features that are considered to be the basic characteristics indexes to evaluate academic influence of network science and technology articles.Thirdly,based on the ranking level of 418 OA articles,and the selection of 20 network influence measurement indexes and its derivative variable,this paper gets 5 evaluation indexes of network transmission and utilization of impact.Finally,this paper generalizes 14 academic influence evaluation indexes of network science and technology articles.",2013,Computer Science,"list(name = ""Ge Global"", ids = ""72705096"")",,,,,
5f0d051ffcbde45f92daee6395883cd476777ad9,Adaptive Lasso for Sparse High-dimensional Regression Models,"We study the asymptotic properties of the adaptive Lasso estimators in sparse, high-dimensional, linear regression models when the number of covariates may increase with the sample size. We consider variable selection using the adap- tive Lasso, where the L1 norms in the penalty are re-weighted by data-dependent weights. We show that, if a reasonable initial estimator is available, under ap- propriate conditions, the adaptive Lasso correctly selects covariates with nonzero coefficients with probability converging to one, and that theestimators of nonzero coefficients have the same asymptotic distribution they would have if the zero co- efficients were known in advance. Thus, the adaptive Lasso hasan oracle property in the sense of Fan and Li (2001) and Fan and Peng (2004). In addition, under a partial orthogonality condition in which the covariates with zero coefficients are weakly correlated with the covariates with nonzero coefficients, marginal regression can be used to obtain the initial estimator. With this initial estimator, the adaptive Lasso has the oracle property even when the number of covariates is much larger than the sample size.",2008,Mathematics,"list(name = ""Jian Huang"", ids = ""50535559""); list(name = ""Shuangge Ma"", ids = ""144072410""); list(name = ""Cun-Hui Zhang"", ids = ""1771912"")",7381e4a51b42c1b044000566c78e8c9075327a89; 46be236b6c3896aea3866672bb4606496694fc77; 8a0bade6963932db92d3b26ca7ffb0a9022e204e; e010e83b2f54c867987c3adf7aa44e75686dd3f0; 8383d71822437fe8cb39eadaddaff90430756e6a; d6cdab739509fa6d57fd853d4ef3140154a02ec6; 46b8f7a520ebba9e39f8c66a8b5d6f42a6213056; 176230da96e91833675eb7f235ae81181aadb56c; b30cad7bc48545f43f339ac67d8715ac3899d3d3; c02d91870513ac86da27a43df8a03b0c9d4bc511; 13bd5bf2c827e43ac93035f945ab774225208291; 0da6da1be8d1f0aaf24d748c0f7d17c99ca42ce1; 58c115531e482c4320147230795927862c3545d4; 89d4c4f1f510c98710926332f7c2dc27384551c5; bd63d22b6bfa4dd7925c4c6b58b155609a1cd92e; 7daa61460bf9f8843692c81ccef10291dabb3957; 168870f80253a95a0e5fc3a95653825306d79995; 064f1bbf24ab542f9b6ca50a03dcd414d967976d; b9862e612f37133e6279f438c373546d324ce1d1; a839daf4d95d8078dd8535f68adef446164e6c38; afae59ba8308de9ce8e7d0a96296aba27ce125a8; 7c76112078887b6017a4a72fe8290dc6df516d87; b0aa0622b24f27bd22ff2e4625d264850c0719d2; 6b7a9a05fe545fe213d1c6c18a29da2ed5df8436; 9989a698cd22a880246afd960187860303e9ca5e; dcdcb720c923c17e6602a7c5af6f308c235feb1b; 070d8f6e1d0ffed49ddc783ffdc6620829e1e1ad; f6118b913224b3fb123fde617707e534700f8899; 5ae516ce2983ad115dd44ec5575de780e69e2a69; 3e59ebb37013a296753cbea33eacd6416f0ff6a4; 08cd47784f12993afdf24034ef31944db2844f0d; c896e487184ba00bb0f30f0d64117059bbad4483; 6050e8ffdc125f7bb9fc56da18c584a44336425d; a1c7590b2ae697ecd433acb0f559577737981cfd; 42ad99afe8d841c4904d8b73d375d80f3ea79170; 47ef03cee689712cea86cfb3e4423705b70ad473; 97dd96dd57428fa90b5e6c357f96b0d5f97f5ffc; c320753864bf48ab2300c9790c689e89c728a7ba; e69e29276874e8e8764a83a86fc59a45514381ef; 1b447687c7814f6f72db5240295dc76565e7b3bc; 26ba364b5fba35cc61274caf6667b7dac645eccf; 29b3c8d7fb9a7c9fa3949ae9521fd15472f359da; a3b938fec07bb3109ce274a3bedbb02eb948ac9e; 8bb843b4f274d77c60944e5ac7365a2f36d76c7d; 44da8e60ed38040d396cf81dd8a2d8b4e3f615e9; 7a0e83a00163b22286e2fb70b6ce5dead95f515a; 277649f7e77794bc77980acdb83b1e6e49770a78; 36460dc667c4e587d2a16a7e0be7d9c061bf38a9; d13dace569732937ccbb0715f3afa445ad2c72cf; 4e84ed439d38a0e916e028281590f9586193ad06; c42223c7fc3cc97f5f4df67f327f074651a02720; f9dc04a04e295b90ef940ee8243f4dc5b208ce54; b71fb7f21ea1834220f092d2d6c5bb7720a6f253; ec8385a4bd6576a9aed14e3db86a53d0b5674981; 6e5806834ec7f944a963e05bc86fff7077bd74c7; 5206022de7d75d06a9a70651ea35f825662ddbac; 532d138ba15c862fb0a7d3a9fcc8f72329e5d4a3; 6bc6a087353cb8a12e2251a62c0e165287ad0b2c; 0b6251b02c4050a45a8adccd938a4339df9e5508; dbdf5ceaa2fa329e626b70b2a7a7c35a9eb06679; d8b2590a097dfaa3d6970157d80dacb61553417a; 19f90a8c59b2b5924debf81fc38c53f2f445b236; cc1ca8e6fa9b40187d48cb396696a95c4c2eb553; a45d9aa0db9aafcf6f8cb18ae764991af7cce041; e26a88e4abb564989b381e780e97e2441e51b8c4; 37f0bfe4f69cb2d7c322d1ddf37bdac74852ce5a; e57ed0a57896a1d504308c78bea4adc2f9c9c1a7; 1e20a56a50eae790bf40a707379a2e95d94c87b0; c11640f4c891672cdd9cea95404546f91e43eee1; 03f357cd27f939342cd44c173b82b5f0fbb14c23; 7e0a7e71229a42b95478b312cd2835a9c0ac2dd4; 497de05718257c700b423d8dac168b0f9db66848; 79153e5430d2fe1d7d9c5dec06618559c35999a3; 142844416c96f20070a12c153272c6e31f837537; 5d0c42968efbe5c8088313fa40f280efb47c7eb1; 0beecd1fd6594ffafdcd483ee09e9cca7ebb29f8; 315d1eed34cc519b51904b19f899145d220736b8; 6a0700327a8f589920c6b79366aa62b11c9c2789; 8b9a1b80460c5235b1e812b89cd650ba03a63d36; f0db6fc31357098c575f8f0f2e66e4b1f49f58a5; af17ed0986f11c08134426dfb46bd0496d74a3f1; 468d0e702357a717e7bb06effc460acaa55fe9ef; 44869705e8b7591591d6de662fdd32ad73fa6da3; 7c393439d94b29e7062748dbc8338ae6562b3836; 35407d9652fd78e4f783c2559f30bd7dd66051cd; e1f8ff1a59c94ab387c4f81a2b098342eda44d23; 4bbeaf9b966c3a0b25d1a07c5a08d0d812aa5429; 75369d9f9838c1dc4fb96812e595160700166a98; caf470b66b57a91925ef949a9d571ada76d7ef81; 67cb06037790b004968431a2d45921fc3f84d5f0; 1f30d0966b0ddb1ccf843de0de0c86d32cd91d0d; e05ceb23f539ff69892d91e57cb8b2e6a74e9fa0; e19aa67099cff626325d1cd52809cf9d17bd20a2; 5aa6dc3c63bfc0ce69fca6061ce56e47a213cf55; e7ed888dcbde4a42db68cbaac59358af368a0944; 4dde02880a0b40498734c6171bc5920311966fac; 582868b7a6675c564ea636938f19cac9e7de2109; 9b0238c57c6af339b916ab77786b3a29295e9bc3; 89e6e0c1a229a4077f8b816ba1f1ec9255c9c1c4; 0c06aed47c5b26fc4be547da072134beef6a0ff9; 9af582d6b08acdd69384b84e4ff6c369c97f5b23; 81b899136e15843adafa49dd0aae512613c4d6b4; f360d35ed6c538168a7fa5fc70b327fa9b571817; 4397a4b89ae8316325f5687a74bcbe0e5ab196d5; cf4011b9536141a164bd93e4d082455706668547; d36c2552ac92835c0d69e8c25b9c75432b822687; c3620866f75cf4d2cd498abc91b598ae1ddd1300; fe9615c09cf95fce33812f7b542b66d480b3965b; 73a8a205a37f0169e89d3f0819a8ec36b39d3d2a; 5a35c30a72ba80d5be4184801dbb615b421cacad; 7e45e93c01433c8f76591c840761672c4f729176; 892989f5e69a0c013232f117c289cbdb1cd784cc; 229bc0300c46eb351951de6f6d19f067cd8a1224; 4144ff098cf0c27529d7e9120df102c21e430f6c; e6d2ed3266a5d49e5219b8fe7b2ae896ea153657; 3c7c2f42e87caf4d65a5a0e2d7dafc71a451aa7c; eca1661e5e256197a721f8d5b92eb1360eab8157; 9c06e4904588d56a862741f3c7da49ed4f09cc13; 866fdd033f75a825bd2d65a4075052a24653966e; 90c0b691eadd0cc7eba798235f0929c236448848; cc30e6d84c4a34b5f2834e8aff221fe4fc2d5bec; b4627cb676c2714110658956b15cb72b9c34531c; ed3a2b1d571a8188f41341f9b5c675a7682792b0; af06ee87e0d456391eac61e710f9657583906c1d; 8273c3e4bdebcff7bf825b5ce8266845836c9049; 1282aa5b33e64c046963854d9c781deac5fa01e7; a389c45a5c2a1a4d107c3d0f5b6e49811e94c5a6; 74a2a39a9cffcd90f825f4c8929fc994024b12d3; fef6d32193b4344d765c066796caab02d3caba85; a57fddf4d831df0a302b48414eda98917e2140c7; c7416a5099cde208f96999303f47fec6b5da1f65; 35f1c608306bc91b9cb1a27d1945f8fcc3507648; 6471422c25e7ef704c4488fffe558fdeb809fdd7; 7cd1619370c1ab9b68acbb05d91b6562c78ed8a8; 48bf64a4f32dbec6e4313fa8675bd8828440b2ce; c176ab123bce04be8686d440a9c8e18cb16b1a3e; 47bf5ac5bced941555b0e9b4dd41f1fabfe0d4f7; 7b765739da5c75bfd76a11e39d5c62e08b1beab9; 76425a67e910c030068128826e0531e9c1e5cdfb; 65e63f8966350cd0355fdc967d867a7512ff2770; e3831b9cf7292a29a87ba4574a61b78d0e555994; 52252f26ea0ca0356b734d5cf1fd9800497e2233; 76c021eabbd5c921f29ef9822dcdbfb0a4da2a5c; fe5a7fc0d49a34561c770726a565afa1eef4ae6f; daf935215678718339b92c19c0561da36c0337e5; b4c02b88cf7978b72589f2e9b8356e6460d46d3b; 573229ac65e697c75b2110b2e8691e0c854a1845; 2b56aad662bb5d7b15485e90d8bf05f5e5ca5151; e0887bbd5920779e3aa4c73de6ca8c3b277f3591; 40a8eedc39eb90e7059c0cef31a5f4b98fabd705; 4d616deaed763d37ceb12f6d9dded80e1e6c2c05; 969544cc51f6a95556bcb32c80e1ea8bba12e17d; d9a4b9ed5d1996184eecd330afc339b66ff08647; 5cc657d5295f6091a3ef4ac898bf15342f5ed26e; 17d333dc975f788c88b636eac0d66172687518dd; 310ea531640728702fce6c743c1dd680a23d2ef4; 2499ef0c9200fa3ca221d5507703d001d824e511; 3b564f0cf9777895aae5c9bd36810d775dd52c56; 2d0a591f338204abc871d0bbb20117c75a922cf1; dd6679a3e99fcb528b744c58bf9d6b01ec8c24d6; d9cf08e3572bcb0882f1c83c8c9bd3b1eb79db6b; 2a3f5b792fe66315198e799cd8d2c1b2cee50859; f1daad2f5f2caa8f852848f6bbb888ca1e34fa01; 51aa859982cc7be2a42984341ad9ccafff9954bb; 972119ef035f4f7e949f93ac04263f73be7be21f; 2b2d4f9d2c7082ee71f5806266a7c25d769c6f1d; 83a62fc666375ef3c994299cd9ecfa42b2975444; 1ed7302afdeefc3976e955994d465a57bb650a9d; 689f0bed6ba098217af131fd623a0dfea6a6d951; fd752cf40caf8f713fa2b347d41b664b7c3be465; 38360513f936ab829b17fac04ff4444136debf74; c3ea102c2362327422b35727a38385c2da53546a; 184066e16164e1b9e06592df9f7b3e7e3d0f3ded; a582202229003019b19067578eb63cb8b070fade; 669e81175796640555f180fcc8e2a7f33e887765; caa5c3d3251e1665e116d6ab3d06b51d33aa1a67; 7e1ce7efcb0fa493d19feb8333c76293410ce90f; 74cab52add27e56ca7b8aa0465bbcb105969881e; 62269cfcfd08541926d78a5c5a0d703b26e189c1; 5db89746b77118f1f6c65f2b47d4074bcba55fa9; 569bc34c2f1dfda31170458bcfc3e5c79fe5d4e9; bc0aef148b8ec2f3dbdced4686b1ad094a2f0789; 90f76eedbcd7607fba2c73e933e971d6267a5a4a; 1158d6151fc75e045072b7a469c27d9f076b3038; 09c2b7208e58fdd666c5ec664e94f10b7462b780; ecd1bc7fe6ba079cd448de44ca0790339c94ed44; da93d447dcccc967216923cab0ead9bf4737b7b3; cf55bfb4f626e3da2b4cf056303c3a931a0dfbf1; 987e87b5e27293d0b747e55d318f7eabab209b94; cacdfb76b75ef776999812f694730855f81c9943; d0b8c36f03ac22ec0edd95ae574e79bd14801003; 44cbd3cc31fac9cc9f09433dc1db87f6b8970f81; 76c96edded0607bda5dcd0cb05ad38af23266a06; 7728f648a37075a0f95adb6e56980bb5101de490; 95201ea4905843d6c8ff09d9dddec1e31bb4b91f; fec2ddf91c371dd8eddea61e68eac9e532154609; de8094bd3aad6d7d243ed8edcb09ca1f96a96fcb; d28c5d665a1e0e4d7b0af67133950d2891d7d871; 2e73b21fa855a99349989ab6acbe702df8f7bc26; afae7250823d5737f8e658e729969de535ef010c; c812108855e32041158e7621ce902e913bd24785; 5dd642cdbee4943154d4fe6ba3fcccbc74018943; d37787ebd16ee246a6e84d2977096c7ea3fd2b41; 0e4c3e3e8a93195b44d3e00ef3c351ea04b4673e; cebdb3f935ebdeb5a9e521248fe19698a64f09a1; e3e9bf2eeaafb0702bc8fd469a64bad5ae20e156; 00dee7924e02656edb30213f9caed9e228dbb839; 7ea9ea65fb626bac4ee3ee5e02d6243b8c30a691; b4d2491a28eabbfb0470e30da237e20646a5e4e6; 65d60764719e187ad3559ae775e23fc3864b4592; 6487161d565be9384dc7ec9fe3ef418b8e85c10f; 00b7f44857676600805172e99be6f9f2987e98eb; d7b0cf239306b2866812f4d7e8ee5f9f851c6ea7; 8fe7a95f7440e09367c4cd6c1e04baf0f2c56b13; 6d2691d945dd0d38c8cf4060ac328fc76d150c53; 65d8f02fb2bdad97a5a9e993a4abfbb24fb05fe1; d4ff7059aead6b8771f2259bed1c9232d95d28dc; 3ff3369580ba566d4d4e3e2ec4a459d7c3ba0576; 0149e1a93ed29d9effa78a90c3efee3b45dc89f6; 792d8edd367aab6cc9ce5e5e838307a51d9ddf56; ccc814e63ff4179dcac185a67bba77acedb210f6; 5515a6a179301401ba5c3c38d497d05e904244f6; 1be7775f151fe628f7128808557a505fb5a3162a; 0bdbb40f7ff06758b3c6cc2b3853c3f4d94bba5f; b961bcc2c881b286001b377410c3c03b5a5be33a; eb3ed7e30ba9a2f7c362dab52f93b37c6935a5fa; 585b4192d1d0926b8ff0428666ea1bd5f64db4af; b8db0ca28c530dd0d0671af5d1a1c238a5a03fee; 54c1fc10cf632350ef4d0e7e318cd420cf1502d5; 5c5188d5684eba422935d1d8e74bb0bb460075b0; 315511e474b59b6469f5697e8b4e4abd14663b66; 24e6895d39f509be4cae4b161d3c3bc53832859a; 9010b49686788c2ffbb57656c9389ddc291db61d; de6556abad53c37d90ea28b673591a7e64ffc660; ac42404eaf0582884d6ffcdff1f4398f0febf549; 71b995524979ad2e82d2d4e2fbab81ab387ed98b; c188c6622a8178233adbc216dfc1518a636766f1; f62c806b177696e005683693c4374c00ca1e9785; 5ecdd18daa12b2cda2bde4374d4911022b88ebb2; 54e965124658592ed1e9dd0645e49cfd1ead2951; 25a1363f94a16f6457db49b6b1ea5c935e55e3e8; fb885e1f06bc637837edab3edde36f54a08ddafd; a2d7c338e76e7afc5e6f9e3dbea83717d85706e9; 32b1d2122fda31d393089dd15fbab743c5e9a960; fdbcbb3edfa7d5fee24f85391b75fe19015afefd; bf9039eb894f0699e767d48fedff5c3759bc2f8a; 98c3ec599685663e00bae07ab77b68021491cfc8; 56598657ab85ef57f436c5bdd0244f2821cfe0c9; fa7dc2ffd04b7ab68960736bd1e81399bd1413c3; c5cd5ab411bdef48c818a5d16dab56b381413b88; fa91673a2c38eff29af363dc55baa9bd73ede47a; 3d1d7fda543b548c54efcf94939efc328f20ff85; 52e0116e50f66d93a75a91ea91518690000935c2; fdf66e982ab8cbf9e8c494245244cfbfff3085b2; 2bf218e08360fe90e4bbeb817399e11d103978e9; 76d98cc92a7e69878abc0167120d9db4383d448b; a51338683a72be6e2da739109310179673d86f75; 555f06843f8b6e366024f961d3b180d2948221c0; f1eff7cf925f0236aae0d34bef7f5d0384372afd; 091600b7f62fade0d296ff174d389eb713b4bba8; f2f1f4da5ad888855684e7e81ca3f048ffdf0f49; 81ebce7d90f21686e857bdd988c72c6aff88f36b; 8a2dbd4a9c2dc81ff930862e6b2a76b6520a17a4; 5547252053cf828f06dc3717b007a5efbd30452e; f84f60f9134669fb5b7cf8e6a757e6194231f457; 426efb76f5e8bb9b6b9faf82e7e540844dd4da11; a2bcf51c099873d7b85c76e4f76189fe6006fadc; 84ae72f4ef81ada08ad57a089176c0dfaa0a6d19; 4552cb20e75284ffda9beda935156607576cc8d3; 890fbcd18c0a5fcca719e3768d06a2ba28fbeedf; 616ce3fa3d2707656d10e07706a7fdeb063e7744; 32707f4910df7e3df8fbd29556eb7d754aab9da2; 167eb90ef8c4552543b96bf08f2d4b55c17ad2d7; cc6bc625914752feff148fefc741ccd93dda54cd; 884da2aad99c077cfccaaa1a476142dda964dd9e; 5ca42a6aaafaa9fd334a4adbd646ea47397e07a8; 109974f8eee235de94ed270a1cc4bb3deff6d78c; 8c41b59617c52daa6aca7100a75e4612c0fda031; b3cefdd14869df48708eae9b12d20056cfed8c86; c4fda00b0abee9b9a18383fcaa36bdcc19d9e39d; 627d94d96e37d82118f2f03c016c3c05c1556f5c; d92a1c6a0ed1ba82bd4af07fe312eb6358f75688; 1d9565fcf038fad5215d1e574ec04bbde371b9a4; f9d2a91b101d4ef54ffe0649cc1af5846d66a9d2; ba329a80ddb287bd4d4c449af0b3d164855b8cf4; 2efd3ad97094837f92717cd617bb8a45474d0060; 4d619b4aa465610e963fbf7073588e14b1d91b2a; b5325b5301627600580a93798ccd01308d235e22; c069a2cab44ad228e39941c133ddd6090032ffbd; 4e65b13f76a87cc201ccba4f43f27334cf119ce8; 1e106f69d32eeda1465c787206c7b5c906042f44; 4ca5a833b8464a1e7ab46d04db6aeb2794eca848; a0cf21eec38769a4b2d17b4d6c4a6256369b225e; a2a1d7f43dc5c7d111a3df53edfbd743b6eb8025; 7e851e1092eb3a4f7476e3ad2510b265392bf7d3; 716231ad7463d8c2d6052628e5a13283043b2c74; bd9775a73ae50c0805c8dc5103bbd5249eb57d8c; 422881a91b829de95c2fede12ce58c36fb1aba68; 72b2318030f41f2ae36ba873fa249220c1c3e4c3; 521fd808a6d13daae8639067ecee5930887740d9; 9ce05174005c3dcc6869f83a58205ec2728a7d17; 12b335bbd12bf4240008cdc9de0dd8f66b0d40da; 4b358245e89fb7678340641f1b5760f9940e32f7; fb382b76d2d3db2b9e47b08c8e678ce0ca6f27b1; 448d6eb3241ff532a12cc9b63900fd00c870ef69; 7def0c04d91a28841255c0fcca90966942112f1e; e7365deba4efc9a98781de1bf523376168a33b72; fbd1fa700160cd8f887d659db26ced8151fc0b7d; cb5c10a54282e8c461673bcb236a6bf9444bee23; 785a410d465a19c6dc26dde68d13bc5f822d414a; 056d69bd0d342e03a32b0a10d383891f3dfc9d98; 56f9d57e258768e987170a9389457ea9b382bbb2; 4803f3ef40ed56276798881ae63999da5f260966; 3dccfa0247d8aa5675363f13abedfa10d9b6ee13; 0e804e7368558cc42ae76b87e893b3b5e9c0933e; fe0d1f1e8d11491697221a66f541abad301005cb; 94c597afe1259111514df2999274d5c543c20150; 7e9059930f99675ab9b473fa65e45e267412a2bd,e28ba0fd6ea94bd56f277d3a89de8f47fd5d1943; 500990957fb0f3a54914aff65413d76ae6e69d06; 8dea6ebc06a57dfc461dd8aea36c5a00c8dedcf0; 58db9852fedd50a4732e3c174383710422c32ecc; c9f5723859a665c3e54b8d9a1a7eecb8b5084af6; 7b4b6a3b9d19a1f57033d8642ca7b9ac97e94263; 9747f51bfcbb1a8b49c389070347b40e988a71b1; a5e6f4ed864385bab62e577984cfa3d5ebc66036; ef767b585b5d72e2194060060100d349b1f0486d; 62269cfcfd08541926d78a5c5a0d703b26e189c1; e5ffaa4d7752d55cc5cf76eed1fec267b2db171c; dc5b06753fac11268bc2300b7c25d50cbbcdeb5c; 53dc97756369cd1f9300116d6aabdffb7072f2ed; c8c66af8271d17092b8e2fa575d6e129bc06a564; b365b8e45b7d81f081de44ac8f9eadf9144f3ca5; 1c7c5595dc7a1f5d360acf5c360ca1ca49536ba5; b85902e1382a799b683c3907f57c896c9497f1cb; 6ed0e4a022dbc09ed1e0748a4ba8c192f5dd1d90; 66f5f763f5f868e529ee81edf5b9957043f7a6fb; 0bfd57b42c4620d3f51d0c75a3919eb9c7b73e83,,,
438d24e2a0c3e7bf24ebdfe880a723b321ba32c3,Yield Forecasting of Spring Maize Using Remote Sensing and Crop Modeling in Faisalabad-Punjab Pakistan,"Real time, accurate and reliable estimation of maize yield is valuable to policy makers in decision making. The current study was planned for yield estimation of spring maize using remote sensing and crop modeling. In crop modeling, the CERES-Maize model was calibrated and evaluated with the field experiment data and after calibration and evaluation, this model was used to forecast maize yield. A Field survey of 64 farm was also conducted in Faisalabad to collect data on initial field conditions and crop management data. These data were used to forecast maize yield using crop model at farmersâ€™ field. While in remote sensing, peak season Landsat 8 images were classified for landcover classification using machine learning algorithm. After classification, time series normalized difference vegetation index (NDVI) and land surface temperature (LST) of the surveyed 64 farms were calculated. Principle component analysis were run to correlate the indicators with maize yield. The selected LSTs and NDVIs were used to develop yield forecasting equations using least absolute shrinkage and selection operator (LASSO) regression. Calibrated and evaluated results of CERES-Maize showed the mean absolute % error (MAPE) of 0.35â€“6.71% for all recorded variables. In remote sensing all machine learning algorithms showed the accuracy greater the 90%, however support vector machine (SVM-radial basis) showed the higher accuracy of 97%, that was used for classification of maize area. The accuracy of area estimated through SVM-radial basis was 91%, when validated with crop reporting service. Yield forecasting results of crop model were precise with RMSE of 255Â kgÂ haâˆ’1, while remote sensing showed the RMSE of 397Â kgÂ haâˆ’1. Overall strength of relationship between estimated and actual grain yields were good with R2 of 0.94 in both techniques. For regional yield forecasting remote sensing could be used due greater advantages of less input dataset and if focus is to assess specific stress, and interaction of plant genetics to soil and environmental conditions than crop model is very useful tool.",2018,Geography,"list(name = ""Ishfaq Ahmad"", ids = ""145687237""); list(name = ""Umer Saeed"", ids = ""35041607""); list(name = ""Muhammad Fahad"", ids = ""153866529""); list(name = ""Asmat Ullah"", ids = ""49351675""); list(name = ""Muhammad Habib ur Rahman"", ids = ""36168531""); list(name = ""Ashfaq Ahmad"", ids = ""47679727""); list(name = ""Jasmeet Judge"", ids = ""145339492"")",8052fa9eabeab131fcd87e0b3a4a40611ec6d8a6; 753d816942420a5fe95d111bff11c2737d177d49; 51fbee632583a483c779e8ff85b5603f2cf2fd44; 2b81a1435a52055c24f80949c3a4b15b682de1cd; 07e889a1444eb0f0ba6f52d8b2b0a65d730e6853; 00953b416d289c59cc8abe4bc1a0751e0e5e4fca,76aac04e0c240423f19751fb6945964adae5e3e4; 2a2135439ce08f7560671f4a22b2cacba0f108d0; b930efd88aabe9eeb3b8b5de7910ff4f47a045e4; aa53aec2057fca4a337e96a879719243df9b8701; 28791034f020c794622b006d0b2179a3e08a678d; a05cca2c46be8f50bea8890190a6997226471631; e75c7cf0c577bb931fb71ec978050b537aa776f9; 64bf250591a368746680185b65c3aa4e73d2e42a; dc3e57dadea569feb567291be297fe7b69ab319d; dfb5d412f452f2bdf39341987b1e3e7c85044728; 549047157066e55df84763159fb815f308ecb2b4; 21a8aaceb8984952950f3ebdd4bfd445813419c8; a82ce65a976df1cc9dc41cb56b76bd8726cb129e; 16955e8ed7922acfbe03eaaee70adb1ecea06bd4; 46b4201fd370d07fcddd87223eff17797f7fa08e; 5363fc1cdae2b28cfb4cd36353b439243f9b03ab; bad0e2cbf01ad976b4bb557022b479e8ede090c1; 99f5fb98af9b8182c71a08ea1c38a3f8a57197fd; dc80ad168cb6d8bdf4e03befc3cab9d2801aa4a0; 53bec6469e1ed78171fae686ce3da5449490d642; 8ee1490b44c6c387889bee71c0836c003a2208dc; fabdb3002faadd08135f9fc604122e15d6ad0d6f; 2345cfb9b30ea3924ad1c771aead7fc64ab6e1fb; 1e0ac6f8084bc7df530ff6a9e227ee646e1a01b2; 2567eedf6495913454d4e68d711d469d91d3ea7a; 6ebbc69ebdf3efb97210ce3ebc07062b90d38e9a; 754b99747fce21b3a8ed1da060ab27616c5252e6; 2f3f991ea305cbaeaeb6a5bf9dad7fd2a369d4f1; 1acbf9b5a745085ec76a9c9a3584646076273cac; 30ba4a3990ac98255fdbf522fb759ef3cc9dac4e; 3d1bccfc201e19b22971786674a62603f2cad686; 021befc1b24922edd5b3f5cd66424cada2c7e1bc; 39091d0be7a4206931ce7f7c6bd15f7f727f2c98; f9122147dab63f605e4c80206c349360df99bf46; 67d6744f7f7a1b9936ffd61df49243ef90522cf3,Journal of the Indian Society of Remote Sensing,46,1701-1711
