id,title,abstract,year,field,author,inCitation,outCitation,journalName,journalVolume,journalPages
6aec1f8a12f1b2c0c9d1ad620d8c7e25bf9b0bd1,UV-induced DNA damage in coral reef fish: damage levels and protection mechanisms,"Ultraviolet radiation (UVR) reaching the surface of earth has been recognized as a major environmental stressor for marine organisms due to the potential of UVB (280 315 nm) to induce DNA damage such as cyclobutane pyrimidine dimers (CPDs) that can lead to cell death. Despite inhabiting a UV-rich environment, the levels of DNA damage in reef fish and factors influencing these levels are unknown. Whether reef fish are able to avoid UVR and repair UV-induced DNA damage is unclear despite the importance of these protection mechanisms in other animals. The presence of UV-absorbing Mycosporine-like Amino Acids (MAAs) in the external mucus of reef fish has been confirmed, however the efficiency of these compounds in preventing CPDs has not been studied. The aim of this PhD was to assess the impact of ambient and elevated levels of UVR on reef fish in terms of UV-induced DNA damage, and to evaluate the protective mechanisms available to fish with and without UV vision. In order to determine the net level of DNA damage in skin samples of 15 species of fish from the reefs surrounding Lizard Island, a CPD-specific antibody was used in an ELISA. Analysis using a boosted regression tree shows that the most important factors governing CPDs were species and size, with higher damage being detected in smaller individuals. Other factors such as family, depth and the presence or absence of UV vision contributed the least to the variation in damage. The length of exposure to natural levels of UVR over the course of a day was found to have no significant influence on net DNA damage levels, which were relatively low in situ, compared to levels that were detected in later experiments using elevated UVR. The first protection mechanism, behavioural avoidance to UVR, was tested using behavioural experiments in which fish with (Pomacentrus amboinensis) and without UV vision (Thalassoma lunare) were given a choice between UV-protected and UV-exposed compartments. Additionally, foraging behaviour of settlement-stage larvae of P. amboinensis was determined under ambient levels of UVR. Automated analysis of video footage using MatLab shows that neither species showed a specific avoidance response to varying levels of UVB. Although P. amboinensis showed a preference for deeper sections of the experimental tanks, fish spent equal amounts of time in exposed and protected compartments. The foraging activity and distance to shelter of P. amboinensis that were exposed to UVR were significantly reduced compared to fish that were observed under light conditions that lacked UVR. Next, the efficiency of natural sunscreens, MAAs, in preventing CPDs was tested in P. amboinensis and T. lunare. The levels of MAAs in the mucus of the two species were either reduced or maintained during captivity before exposure to a short pulse of high UVR. Spectrometric measurements of light transmission through mucus samples collected after irradiation were used to quantify the amount of MAAs available for protection. In both species, DNA damage levels in skin samples from UVR exposed individuals was higher than in control groups that were exposed to light lacking the UV component. Spectrometric measurements of external mucus of both species revealed a clear link between higher mucus absorbance, i.e. MAA levels, and lower DNA damage levels. Furthermore, a significant increase in mucus absorption was observed in P. amboinensis after UV exposure. The last protection mechanism, the ability to revert DNA damage via photoreactivation and dark repair was investigated in four species (P. amboinensis, Pomacentrus moluccensis, Lethrinus variegatus and Siganus corallinus). All species examined showed significant increases of DNA damage after exposure to elevated UVR levels. Interspecific variation in the susceptibility to UVR was observed, with L. variegatus showing the highest damage levels. Significant reductions in DNA damage levels were found in P. moluccensis and L. variegatus that were exposed to photoreactivating light after the initial damage accumulation. Individuals of P. moluccensis that were shielded from any light exposure post UVR exposure also showed less DNA damage at the end of the experiment. This is the first study to address levels of UV-induced DNA damage in reef fish under natural conditions as well as under elevated doses of UVR that could occur in a changing climate. The relatively low levels of CPDs in a diverse group of reef fish indicate that current levels of UVR pose only low threat and underline the importance of protection mechanisms against UVR. Increases in UVR could have an impact not only on adult fish capable of adjusting their protection mechanisms, but also settlement stage larvae which show some of the highest levels of DNA damage in situ as well as mortality during slight increases of UVR. Whether these and other effects such as decreased foraging activity have broader implications on the recruitment and reproduction of reef fish and the community structure on coral reefs needs to be examined in the future. Declaration by author This thesis is composed of my original work, and contains no material previously published or written by another person except where due reference has been made in the text. I have clearly stated the contribution by others to jointly-authored works that I have included in my thesis. I have clearly stated the contribution of others to my thesis as a whole, including statistical assistance, survey design, data analysis, significant technical procedures, professional editorial advice, and any other original research work used or reported in my thesis. The content of my thesis is the result of work I have carried out since the commencement of my research higher degree candidature and does not include a substantial part of work that has been submitted to qualify for the award of any other degree or diploma in any university or other tertiary institution. I have clearly stated which parts of my thesis, if any, have been submitted to qualify for another award. I acknowledge that an electronic copy of my thesis must be lodged with the University Library and, subject to the policy and procedures of The University of Queensland, the thesis be made available for research and study in accordance with the Copyright Act 1968 unless a period of embargo has been approved by the Dean of the Graduate School. I acknowledge that copyright of all material contained in my thesis resides with the copyright holder(s) of that material. Where appropriate I have obtained copyright permission from the copyright holder to reproduce material in this thesis. Publications during candidature Peer reviewed papers Siebeck, U. E., O'Connor, J., Braun, C., & Leis, J. M. (2014). Do human activities influence survival and orientation abilities of larval fishes in the ocean? Integrative zoology (in press). Conference abstracts Braun, C., Reef, R. & Siebeck U.E. (2011). The effect of UV radiation on reef fish: avoidance, DNA damage and DNA repair. 3MT Â® presentation, International Postgraduate Symposium, School of Biomedical Sciences, Brisbane, Australia. Eckes, M., Siebeck, U. E., Dunn, S., Braun, C. & Dove, S. (2012). Prevention and repair of ultraviolet induced DNA damage in fish. Oral presentation, International Coral Reef Symposium, Cairns, Australia. Braun, C., Reef, R. & Siebeck, U.E. (2012). How do reef fish cope with harmful UVB radiation? Poster presentation, International Postgraduate Symposium, School of Biomedical Sciences, Brisbane, Australia. Braun, C., Reef, R. & Siebeck, U.E. (2013). Mycosporine-like Amino Acids provide a rapid mechanism for UV protection in reef fish. Poster presentation, International Postgraduate Symposium, School of Biomedical Sciences, Brisbane, Australia & Australian Coral Reef Society conference, Sydney, Australia. Braun, C., Reef, R. & Siebeck, U.E. (2014). Natural sunscreens in coral reef fish prevent UVinduced DNA damage. Oral presentation, Otago University Postgraduate Symposium, Dunedin, New Zealand. Braun, C., Reef, R. & Siebeck, U.E. (2014). Natural sunscreens really do work: slip, slop, slap on the Great Barrier Reef. Oral presentation, Australian Marine Sciences Association student conference, Dunwich, Australia. Braun, C., Reef, R. & Siebeck, U.E. (2014). Natural sunscreens really do work: UV protection in reef fish. Oral presentation, International Conference on the Biology of Fish, Edinburgh, Scotland. Siebeck, U. E., Parker, A. & Braun, C. (2014). The impact of UVR on reef fish â€“ the good and the bad. Australian Coral Reef Society conference, Brisbane, Australia. Publications included in this thesis No publications included. Contributions by others to the thesis U. E. Siebeck was significantly involved in the conception and planning of experiments and design of the whole study, catching of reef fish for chapter 2 and helped with revisions and interpretations of all chapters. R. Reef assisted with establishing the assay for the DNA damage analysis, provided resources and technical assistance as well as feedback and revisions for chapters 1, 2, 4 and 5. R. Reef also helped with measurements of light intensity in chapter 2 and 5. N. Rosic provided the measurements of MAAs in algae and fish food in chapter 4 as well as discussion and feedback on the manuscript. Y. Reshitnyk wrote and improved the MatLab script for the analysis of video data in chapter 3, and provided feedback and drafts for the method section of chapter 3. A. Parker, C. Newport and S. Van-Eyk assisted in aquarium maintenance and fish keeping, as well as discussions and feedback on this thesis. J. Leis donated larvae for chapters 2 and 5, and gave feedback and discussion on chapter 1. S. Blomberg provided assistance in analysing the data of chapters 3 and 4. Statement of parts of the thesis submitted to qualify for the award of another degree",2015,Biology,"list(name = ""Christoph Andreas Braun"", ids = ""49849422"")",,329a759c4106a8a5acf66002d94ca612d3504d4d; 17e07388ef7d8ceccc08ef0ad831055d505d8686; 6e1425ad968a7019c505f24c7831c9bed1807bde; 5a18af6e669f49b2a649ff60859eda17462c70d2; b2b9f5b24cf502db67204de7e0fb6db57f4f363a; 8c6c2be209fbda7b652dd3af58445faa00f937e1; 7ccfb6b3e3b617c3added77a0d20310be4c584a3; 1c96be72b4686390f999545961cf1e4c80b11ba5; 991c135c313349c040d660400d1f209e0367de4a; 7a8e190d93589ff2b5f5ccd681d845d5a96ca57c; 5f3fe917a102cd8442f78c2c376ea78660da0764; 5e7771f6f4505ded34c29322b450712f17310c06; a5015d754c01d7dfe08e3565cf82a31f04e81e03; 037530c91942b1f20ad1e3ddcc4950b1fc86bfba; b475f1b02a141581f429f05389cd82a1a19c4170; da823fdc9150273a033a745e77e621144eae40c7; 2225b260a5034fafa33061c3847142fd5c7e830b; deb5a8212d0b896143b063e0c8d20866a9106d85; 48a13e9db955be1e7c0afa89f9a3582b2dcf3558; c813b50edb4881903fc42db7d1ae19346c1475b2; 8457424177a8410bf5ca809064c008f960a963d8; 577ed99eb1dde2b2bf9f4a2c57d2ec01815eb8a2; 88f4e11469e8aba341400b7809bf5bf327126a62; d6ca82620ac71b93a496d9f5124d45abce25a994; a0d43d8b1aa3c2afbc5d9f609526156127a5a675; 04290222a9a71d3d432f9b0c3149e2dd0302d9b3; 548ea4aae89b70f55e37ad98245b668de795f7a6; 288e940f208b7044700b67eb9a2ed789d57afeec; 5b6e40236b086ff6f63cf74d22f46d3caeb3dcbf; 503954d2fe7f78a24603950745dc1fcf21f4f691; 7f93a42243d801c300199f44686fe08511ad7111; c51b6f4e8502afe0b6298e7e53525e0bf52ef27d; 9cc0efc33b9d85026e4fa9bfd48e95b9859e6a90; 3344a4598e58f3e0100ec48f877999447ab6a230; 27065c4ab24b59b528dfb7ef5398ea5281a3f6d5; 0fc96247a10772ce4fda4555f8dd9ef734942778; 49e40ac1a035717e27cb713638a3917bc0868e29; 748854081125662e627ff0af3fa0cd152d34d1f3; 62f03ab87eb57945c9a4781d0aae9400f7840359; 5015217ba6e6ac8fe847d2abd4f14e75f6a29296; e1e4edac2122c4c275e20105edff21018ff3b0f6; 2749d9be85b385e99d7d489790cbf629db98281c; 695a51aca12dc5d451665ee243d2a233ece0d1ef; 446a1feae39d2b5d10b690c6d3bedc27eb3a03d5; af301a104fd03520509957c675d2e8bf2ed0e86b; 372e7a52aa97e560cc5088850ab4dd1b6ddce7fb; 8e548c8f811f18f60a1e47a9c28b2cd0c9c9d0d1; 0742c9fc461c3ecccc4d6f492cb9fc78b881c507; acef09f73817461c51858208fd6054a8bbdb61ef; c30fc383d795f1dfe44e15ebe681d6cc1a7e774b; ed78bdfb36720789e855672a8e625db5818acb0c; ad741ab3d8826776e2fb2e0729cd4f17de8dbd53; 6b462dfacd90090e70c36935ad690cc739fbd234; d66e9cba06d394b771f01ef7062e4864dc81c30d; 54c00b01c1bc48b5fbd4e80bce30995e7d9d7d7f; f7cd119c7e2cdc510eb55fba832c3044f25ffbbb; b2349563654a69c6c3f2f91d07f9344d15247e23; 048dd3fc5dfa6c9b1a337ee6d972264cad4fb64c; a41afeb06a8178c2dde698fb80f8d04ca2328df6; 4761f77682364135d9749be36e4805ca4f97b94a; a587ed6de0721336fb3ac6757bcdce4db8940a39; 709c26570d7de9bb9f585a93d3364638c78e8f78; d6bfdfc0d66c56c1eb19f037b29571ae45c9cb10; 2fabb63d0ee7092fe6f23412e96c2eb489cdee05; d8ebfa218710dacdb5eb5e08be6914a337916d9a; 234dc16f04874fba0618d3f7a0d29d39be04a231; d97637135ccee791fdb729e7f2bfe57a7ff6a87b; 469223bf2f4e753349f31ce3b8de00418fd421ab; 5f74244d62bdc42a8ef6606495508e40d647366f; 1ba5a51f0177b688372c7aa9db090973f5c9ae5b; 7ce211049e0ca0cb9c6eef29de016d2383f4c202; 60e23add425adda6f206007dd6c26575cbb204bc; 9ea5b0e0bc62f07d9bc1dd62becc583009f8e1ec; b7ff0059998442b4834f01629388364126c74282; c121415cb5bb3a1b097e8ebba3f71d6278b0be4c; cc6203863a53c59d66db7640893a3c2369396b01; 2fdc81b0e489389bbfd148a9cce9d27573199e0f; bacaaa9d3cb989edc2487bdafa34e43722ed60ca; 7f9e1c93656d55bc1844b572286d6f9894794900; 2c1fe56dc1fa84068c1457c483fa38fa9f52420c; 4a934e0ffd9ee587e7765622b5ce844856292572; c8e7f70697dda16e5980ca8abe722e27fc169e28; 80c93663a256a542b4452697abeca9c617c09840; d3803ace0c385b6c88dbd9875cef3385d47b0932; c59be1757a3b72e110dac425db604cbd14565157; 9eac4880f1c5ebef11ce3260310f25be1c13079f; 60366618379e2a1ead7fd99e340104cac20513b0; 34b736dddb1b662636d9cb95ed00928b029e306d; 2bdd6abadc11676899eba564b270b3b2ae2a06f5; 34a8d4eb92be404e850b750d3e378e8ef4d46132; e6d434816b39e549ec4c877eee71f1b75536947b; 5bb37e7a4326399f7abd47c099a8ded8a140b81d; c75bed12069b1a4066f78c169076660403f60a61; cf9950e847cf9ad214689963deff8bc0d6407afe; 95fc466cf5a42a73d5413659a9926d81f9a2ac40; 039405c625317b2f14beb33ab671fa186feb7f26; 601a559966206a91054548c5b7148970de1caaf2; d1175e7dea0d2bb0fc2c2e6598842b072e615e36; fcc9fe02d7df20be09a7347453a6f4d03b467b00; 4c6cb562765cd5249a6f57ad0629cc382292a360; 06f52ef2f047516857c31ab7d74505f4e2875214; f08706199d6cbbbbb753cb71af22d39e24f95181; 33ebdf65978389267d58a2a13fb124aa6731392c; 1cde58b4a0fc73c867f5824d5ceb7f1c97c2b953; e939c7af113f41bf359bbed12a84502a94eaabf8; 8b24784aa45a494dbc47f0bdb74ae56f6075c90f; 6cc037c27a8e3a330ea074cc7bd752ce5b043d74; ac79db8d08161a7bb29dce17048dc90d7d831736; d147a323aac9545cf6c33566584b86e8886fc20f; fe015f64582677b3f9f98e0779659fa00f2fe877; 6091684828843a96086012240d700366a9d86ac2; 6f8340573da4955f6cdff2a1504109560f4cd385; 76ae4152aed974134f796f902fc34cf8b7b5a26d; 834081f634afc1701e0df83bd0c1211d426c57b7; a9ae9770f25ab134b11dcee0d8945e23867db383; af1f6eecb90f95d3744caaf0ee4c9e465ac9ded3; a1e48ce889e0770af6de1d75dcc9acb56fbaa838; 62b13bcb49eed72cb1ea3067c58c3e22b5ad6564; ee11d21742541a3135d27be3fc606b062239c6ec; aac27c23e148c241a0259041d8bd38ebfec046d2; 27f70ac2e65bc9830b176d94aecfffe135a6f5da; 3f279ae6e79bf5f69e76e07e8b49aba8107890d2; dc5a3941ad010a7faf0f3664913b6fa2a76dc637; a4bfe45cff578954e90a372b4c59cb4aebbc695c; 7ffcc41f78b2fec54ccd8610b2441c1d2c2adea0; dffd0f2c90afe0608c6c3c974358d4d153d4dfef; 082829d27a1770507853ba5e178b4082eb0ddb25; a60526ea6493d22445477555b4877ba1bb0d221e; d605528877944e8d2365b3de23f26027bc0409f4; 2e31ec87fa43164748924106da2ee57c1d651bd0; b80d73a5bd77721a8c587b9fee63c707c2e41070; bbeece9def7c476a3eb8d71344f6adc9f7bd8b6a; ddd1d994e5d3d2ad9fa32ca6a88649084fdfd61e; 142a78eeb8cf047e2f9deb619f6a02f40b357b98; b4d3546fe081b83e8623db8bf1213421f6cc34e5; a49374af40770bd6d5a184921807bde07c1f354f; 9f335edac60f09ebb90478bbd96fbb0965e41ebc; fc9464333d942cde08ee895ea17089f18452c171; 95d16adb5bf912f521758e201579bcbc4f6144cf; 8aaddac1dfbe86a00b0758172ef8a1c323e6d1a6; 1cc683aac5356709f89909410314da88b606a09c; ff45b50caa61dbc26a6544cea9152c76953ff169; ba8fb4945257167a8c7c8ed0c60032fd94084d96; 495001d1ec5e790bb0010441bb7d04eb90180001; b6c8d5a6e87836ed8ba8960b20c58c3637f426f3; b8ec59c5bdf5c29ff1f6fda0cd006e63de1b0e08; 9206af2a40d08b2b8789cd98ec5c0bd314666da3; 804c1b250d4f958b959c21ba49df741a529687ec; c90a02692a5282cb77ec7e7eb116cb9ceecb8e6e; 04ed238dd60670692ddd42f445c69da52e3b3b40; 3cd6eaf2eb2a90997f1f5fec1f377b5107f6d416; 2beec90d247062d044ea94184e3509b2c64eebcf; 69ef113def8be72c79d8d44d76f7b455fb9c4e8a; 7889549ac0ad91dc646aa13ecc15e79659c396bb; 4e8308d47bd3aaba8a59921ac687ffc8e24a71bb; c83a27d8fdb935a9e4a7b2549dcae4c7fad2bad5; 98117a66eb32b9350deee9ef33bcd17a62110dff; a4b5bb0b26c92facbbb2d71f17c56e102bc27c32; 9a5ab4a528955de32da44f6189f1ff79e64bd859; f799d826d1c898345d30958ab26e5aadc671e3d6; 0ecd2fc6f5b530e260268c8fa84b8b9265dfbe76; 918affb32622650279e7477e967f541f30d82b03; 8f9f0ea7167cb091e274984b24731da843bb1152; ba7d647b116438e0d871dc2d9667bd7e6f4dd6f6; 922665904a4647e1d9fa00413e33c6d9187a5cf8; 373e234dc04a8ce60275b78f9a45db645758c819; 8fc4143a7bebeaec1c3423e0e650ff905ba7a329; 2652006609bb3ea523d0eaffc031511435e7055c; 419cf419210d0992ba2d2cca645f5c14d513bfef; bedd3df497e332214db4493a83b0fd1c74ba8e27; d60f2df823e6401e83bc9c9bcb0e3549e9841187; 79c8a41a47c4fadc15f9777a8c5bafaf1f6e3a3e; b427d98f5159380254440e31df8c2093ab5607db; 3210525657077a0e0024b9045555fb08ea531e35; 3f67a576d01a8e6dcf2c414bf3a00d33b3ca7a91; 356bf8811d7d174b919feca162249f01f2b9b02e; fe5f1272eb2129f18be0904af4604fce03628298; defb26e58a51785f7b79d8f16439ad90a87b2d4a; fe758f161ba3a3da969887cf03ba2c0d2a57f5ad; 7df6bc632ce8397f69704ec3d30f715e9d637057; 6ba9afd9241a5d04e2ce890f0a6f082d167968b8; 6b8cf3bc5789f3e63253722f6cc54af21393c020; 9df67d7079a23d666b80791629bf54640b7656eb; bfa2e11ce4128ac20d623557eef84f5f08741a0d; 7923ec018ac4beedc0fdecd474355dffff27d88b; f134c5bb61224d5739a3a161883272fb97b2285f; 4abcca6b9628b3f19f825630dc74a46808d888ce; 5763c050b0d7b58ba4490371caa61c94cd287d31; cda42baa94ca80053a076bb6a0b8dfdf5b0811ca; 22de9e43ff45486568f4c9cbad976b423814e468; 12df2e42baf0e1253da9008349e5379d829368e8; 4788a3d27c9406b641f42d2cf98411c1e7d5a39c; fde07b90fee872a0ae91edfc5d3e9c5ae12c8ac3; 83b9e186c9c9ac214df52a06f0cf0658a37eb578; 62dd000cbaeac24db1892c191a1b67796f94313f; 4abe8b75c666842bc23806194df0fd97671a0394; 51d53f480d7bbe7b0c81351082f98b8bc65e224c; 5decfad65d337d180605e596053b85cbff28d771; 32bd7ab977216287987daa3a7020ee9a3ff0819c; 1154c069324f7ca24cd3777ff31a6f55b49b9965; 86387c82765aeb76279d94f17d87b5d3109e772d; 83c47de9ca2efd8a8740110f615aa601d58259b0; 61628c6320308d9dff4bff87c2a25f912886c5d0; 7f1fb5435fc6bbd7ed974455041436ae097a07de; db5e0eec9207b9ad22401769313f44de36628683; 4cf7a73f5daabf2a062193d448b74b8a3ded3655; d34061bee2fdf6a477cccb456b56f24fbf4facea; 0808584584a6a3f7fd76dc8a6fe02b3cc7e1136e; 2e6efebe15ee063b2d88684e63ad1959fe0d13fd; d1a1ccd357306a53ee739163c5b9daa4dea14b2e; 68ec241dc666e62a587c83aa1c2653c837ec122d; e71932c914bef2a3d21217803828a08646812a1c; cd0c9b46c81048aa373955e925ff32cef7a64a16; 33f545e0b8b270b4cf95f12f5e6ecd1c055e93dc; e3875c3833acb84204c6a7ad6b66dce326e347cb,,,
58bbda1519d7cf7011f67ec3cdfaaf5e5df74f77,"Chronic pain, somatic unexplained complaints and multimorbidity: A mutimorbidity painful syndrome?","INTRODUCTION
Chronic illnesses are a major research challenge due to its implications in aging and quality of life of adults and elders, and it can be associated with chronic illnesses and other complaints. The objective of this study was to investigate the role of morbidities (chronic diseases with or without somatic unexplained symptoms) and somatic unexplained complaints in a hypothetical model of a multimorbidity painful syndrome. Our hypothesis is that chronic pain should be considered part of a syndrome that includes other chronic diseases and pathological states, especially conditions with somatic unexplained symptoms, and fibromyalgia is one of the evidence on that.


METHODS
A pilot sample of 306 subjects was investigated in this study (254; 83.0% with chronic pain). The following features were investigated: demographic data, chronic diseases (classified as with or without somatic unexplained symptoms), medications in use, pain characteristics, fulfillment of diagnostic criteria of fibromyalgia, and somatic unexplained complaints (gastric complaints, sleep disturbances, numbness, and the dry mucosa score). Statistical analysis included descriptive data, tested with chi-square, Fisher's exact, nonparametric Kolmogorov-Smirnoff, Student's t test; data normalization with Z-score; Pearson's coefficient for correlation, two-steps cluster classification, multivariate linear regression, LASSO and logistic regression.


RESULTS
Both groups of chronic diseases were more prevalent in the group of patients (pÂ <Â 0.001 and pÂ =Â 0.013, respectively), which had higher frequency of somatic unexplained complaints (gastrointestinal, dry mucosa and numbness) than controls. There was a high positive correlation between number of pain areas and somatic unexplained symptoms score (R2Â =Â 0.626; pÂ <Â 0.001), and diseases with these symptoms were a risk factor for chronic pain (R2Â =Â 0.5748) and fibromyalgia (AICÂ =Â 5.8952).


CONCLUSIONS
Diseases with somatic unexplained symptoms and somatic unexplained complaints were associated with chronic pain, including fibromyalgia. They may be risks factors for pain spread. The findings support that chronic pain could be further investigated as part of a multimorbid syndrome, which should be better assessed to improve aging and quality of life of patients.",2020,Biology; Medicine,"list(name = ""Silvia Siqueira"", ids = ""4085252""); list(name = ""Jose Tadeu Tesseroli de Siqueira"", ids = ""4070909""); list(name = ""Manoel Jacobsen Teixeira"", ids = ""51327136"")",,,Medical hypotheses,138,"
          109598
        "
a54d33bac9c2af9ffc93dbd9fd0d9ee4fe39fab5,Aeroelastic Model Structure Computation for Envelope Expansion,"Structure detection is a procedure for selecting a subset of candidate terms, from a full model description, that best describes the observed output. This is a necessary procedure to compute an efficient system description which may afford greater insight into the functionality of the system or a simpler controller design. Structure computation as a tool for black-box modelling may be of critical importance in the development of robust, parsimonious models for the flight-test community. Moreover, this approach may lead to efficient strategies for rapid envelope expansion which may save significant development time and costs. In this study, a least absolute shrinkage and selection operator (LASSO) technique is investigated for computing efficient model descriptions of nonlinear aeroelastic systems. The LASSO minimises the residual sum of squares by the addition of an â€˜1 penalty term on the parameter vector of the traditional â€˜2 minimisation problem. Its use for structure detection is a natural extension of this constrained minimisation approach to pseudolinear regression problems which produces some model parameters that are exactly zero and, therefore, yields a parsimonious system description. Applicability of this technique for model structure computation for the F/A-18 Active Aeroelastic Wing using flight test data is shown for several flight conditions (Mach numbers) by identifying a parsimonious system description with a high percent fit for cross-validated data.",2007,Engineering,"list(name = ""Sunil L. Kukreja"", ids = ""2427113"")",6a9d5f92ef215f074749d075416f303b1a754e19,f4e7cb8c3f0f1308bdd9d2e641e3f5012b50a501; b365b8e45b7d81f081de44ac8f9eadf9144f3ca5; 013e0ae35d6a9947f426f0bf98828851a079e508; b90dff0215bb654a30ac7e15fa39673fd7e9f3e5; b2b06000a7b6c6a098f844bf817abe901f8c6af6; 302e5309cca981b13d77d73edad4fe26a7e293c4; e7bae49dff506e321a3ce5da0fbddc2eff141b55; 16009f1fff5023a477251aae465e562a071e3e61; 4ff82785df147ffea1ce9bd6e483d30189f71162; 47b447fe1d573724c909329fe244b5a34363c6dd,,,
