id,title,abstract,year,field,author,inCitation,outCitation,journalName,journalVolume,journalPages
01a4d0b219db8fbfcc2c561ecf47ef6d85ebad91,Palynology of Triassic–Jurassic boundary sections in northern Switzerland,"A first palynostratigraphic scheme of Upper Triassic deposits in northern Switzerland was established based on spore-pollen associations and dinoflagellate cyst records from the upper part of the Upper Triassic Klettgau Formation and the lower part of the Lower Jurassic Staffelegg Formation. Drill cores from the Adlerberg region (Basel Tabular Jura) and from Weiach (northern part of Canton Zurich) as well as from an outcrop at the Chilchzimmersattel (Basel Folded Jura) were studied and five informal palynological associations are distinguished. These palynological associations correlate with palynological association of the Central European Epicontinental Basin and the Tethyan realm and provide a stratigraphic framework for the uppermost Triassic sediments in northern Switzerland. Throughout the uppermost Triassic to Jurassic palynological succession a remarkable prominence of Classopollis spp. is observed. Besides Classopollis spp. the three Rhaetian palynological associations A to C from the Upper Triassic Belchen Member include typical Rhaetian spore-pollen and dinoflagellate taxa (e.g., Rhaetipollis germanicus, Geopollis zwolinskae, Rhaetogonyaulax rhaetica, and Dapcodinium priscum). Association B differs from association A in a higher relative abundance of the sporomorph taxa Perinopollenites spp. and the consistent occurrence of Granuloperculatipollis rudis and Ricciisporites tuberculatus. Spore diversity is highest in the late Rhaetian palynological association C and includes Polypodiisporites polymicroforatus. A Rhaetian age for the Belchen Member is confirmed by palynological associations A–C, but there is no record of the latest Rhaetian and the earliest Jurassic. In contrast to the Rhaetian palynological associations the Early Jurassic associations W and D include Pinuspollenites spp., Trachysporites fuscus (in association W), and Ischyosporites variegatus. In the view of the end-Triassic mass extinction and contemporaneous environmental changes the described palynofloral succession represents the pre-extinction phase (associations A and B) including a distinct transgression, the extinction phase (association C) associated with a regression, and the post-extinction phase (association W).",2017,Geology,"list(name = ""Elke Schneebeli-Hermann"", ids = ""1422225859""); list(name = ""Nathan Looser"", ids = ""81291725""); list(name = ""Peter A. Hochuli"", ids = ""6750355""); list(name = ""Heinz Furrer"", ids = ""46813756""); list(name = ""Achim G. Reisdorf"", ids = ""104454066""); list(name = ""Andreas Wetzel"", ids = ""143610786""); list(name = ""Stefano M Bernasconi"", ids = ""40470871"")",a0807aff228f11771d53b2ffb7246c5a66c867ac; be61436af320c6e890f1633feec25dfb5dca35a1,87907de2668d75c71d142902e9d8564d0d626ce7; 70721f3b8e0da401df3a1650ca09c40f4addb8f0; bc7bff373ac13ec053e402ece79241ac7e9b0a56; 76620fd5ef8d9b7e2bbd443f986fcfc468d26cc3; 6cc8351a04729d50d0f4a757c374498d4c9d8174; 8f8bc70c1a0b52c827cd2129783c3416184b99b3; 9442a415ed7dec89a6294a4a449ec6500dc6f9a3; eb00dd29e9c7f3c0cbf6c9b18b0a2ba67f0741fc; 8586c02af129991ecdb7cf8c1e3f84c415dd44d3; abbd184e0a4088b96d394b16213b1e007c4ab889; 3e7a1aeaca4f724ed5ba53856ff32b5d2bf24300; 491f6e28e4692116d73ffae1cc8ef6980c828416; efb36f3ff59795f86c1cf9c5bc7adf9b17f5acad; 51e8f60704f30cd7a806428b312f3181563a49c3; 53aa5c1c44ebb2e8d6e984893c9205f06e9b9564; 54d4d04c9b5f85f7aadb09f0468d03170ac2821f; 60fd72f9a477e5258170b003795fd646affea308; 3f29a8ab2f88822f64f0f6d209192ccbed7c00e2; 44ed69e682404f7c47b1206496f12604c63bd511; d73109570364529c91ffdb30f59194c6ec36b9c7; a2a43175c5480adc5f8113f0fc0b69090d5fc4dc; 75eeb585c01faa3e7a797166d0dba6a1ec4db9aa; 8472e660a74a7e6a757220927b2e33d293f1cbe1; 2adfac77cd955dcb8faafb418969c25fae7b4e32; aaa1b642d00c3104479731f7fd010c6a4597b5e3; 0d7d525191d53c44935c81f98b5f6c04856730b7; 81431471fe10412ab7710faab25eebbd362d4764; 03e966c87331ddd4ccbd548c3555941a2c103599; 3eb42c6f513393172ac9ee7a47ddbf421a9038da,Swiss Journal of Geosciences,111,99-115
4f22257d21b290a4a59bf8627425140fd0a8952d,Identifying and Revealing the Importance of Decision-Making Criteria for Health Technology Assessment: A Retrospective Analysis of Reimbursement Recommendations in Ireland,"BackgroundDecisions on reimbursement of health interventions in many jurisdictions are informed by health technology assessments (HTAs). Historically, the focus of these has often been cost effectiveness or cost utility, while other criteria were considered informally. More recently, there has been an increasing interest in the formal incorporation of additional criteria using multi-criteria decision analysis. Such an approach has not yet formally been part of decision-making policy in Ireland.ObjectiveThe objective of this analysis is to demonstrate that cost effectiveness is not the only criterion influencing reimbursement decisions in Ireland. Furthermore, the aim is to reveal criteria that may have informally influenced reimbursement decisions in the past.MethodsA list of potential criteria was identified based on the literature, national guidelines and experience of the national HTA agency. Information on each of these criteria was sought for every assessment conducted in Ireland up to July 2015. A logistic regression was fitted to the data to identify influential parameters. Model selection was performed using the Bolasso method.ResultsThirteen criteria were considered in the analysis. Two members of the HTA review team assessed the performance of the interventions against these criteria. Model selection suggests that the incremental cost-effectiveness ratio and quality of evidence could be important drivers of reimbursement recommendations in Ireland. Less important drivers suggested include the year of assessment, the level of uncertainty, as well as safety and tolerability.ConclusionThe analysis demonstrates that recommendations for or against the reimbursement of technologies in Ireland are not only driven by cost effectiveness. This highlights the need for more formal inclusion of criteria in the process, to improve transparency and ensure consistency.",2016,Medicine,"list(name = ""Susanne Schmitz"", ids = ""48541602""); list(name = ""Laura McCullagh"", ids = ""4687137""); list(name = ""Róisín Adams"", ids = ""39081825""); list(name = ""Michael R. Barry"", ids = ""50360984""); list(name = ""Cathal Walsh"", ids = ""46319398"")",f062cc0c0a5cf152f54ff75ec0f9136f871c1342; 5046b1473c6190a4c03f50e6be3ec370baeefc48; f64eae218548596661345b88b2f840cd1578fd88; e312de81269bd1d89c3998fc2cc80c6f46ae1b31; 7328363a67ed0267938e96075b0301290a5683cf; dce29cc6dfbeb7ca2e06c5219db4ec162d909720; 3117393b922fb191d65e03f33d87963b57d5e6db; 13bec390515bc886250b9e441dd01ca7a860e355,d8d8477c50d3f3141823d090a34390dc35df439e; 530176444239ffdf1b237ce23800847c6695c756; e3e4d97a677dacc1b72ac02fd10961a61aff0b24; cf7a570008ecf74307f4158bd6af466bca430de3; 5d934833d39be8a30c0594e921b6b81156b30893; 1c7c5595dc7a1f5d360acf5c360ca1ca49536ba5; e41770c6b2dbece007375d939a0466dea00980e1; 84ae72f4ef81ada08ad57a089176c0dfaa0a6d19; b1f182e9ae330480752b76a37b0d10fb295c8449; 987100f75bdc9afc0972033d87d388014049f51b; 6c9d9b961f091332ee54404e41c4fc377e4c19e8; ba838abe40ffcfa76a650b787dadb515a9ce74d0; 38f97288dc47f92d43b4ff7e094d47ef87b65dfb; 0a14824290453b95d051ec9cc299d0f61ad82b23; 6677a92dec8dcec579d6d33b92c487d1f5a7f342; e5f60cf8b7f687fe52df10096af0f35a31a2fd2f; 75dc8ae8fbd38ef1c7571dd79710efa5914c97e7; dd45e47f50ff0322fd2813fb60d467d893e50042,PharmacoEconomics,34,925-937
ba3a41f3e14e37445b819758afe8de8d448b1e64,Environmental influences on patterns of larval replenishment in coral reef fishes,"Spatial and temporal patterns of larval replenishment to the San Blas Archipelago were measured using 3 light traps in each of 3 habitats (exposed, lagoon and back-reef) over 18 lunar months from December 1996 to June 1998. Traps were sampled for 19 consecutive nights centred on the new moon in each month. The effects of environmental variables (wind speed and wind direction, tidal range, rainfall, solar radiation and water temperature) on catches were examined both in the days immediately prior to settlement and during the entire larval phase using 2 approaches. Firstly, time-series analyses were used to compare night-to-night patterns in light trap catches of 11 species (Astrapogon puncticulatus, Eucinostomus melanopterus, Lutjanus apodus, L. mahogani, Ophioblen- nius atlanticus, Stegastes dorsopunicans, S. partitus, S. planifrons Synodontidae spp., Thalassoma bifasciatum and an unidentified blenny) with environmental variables. Secondly, modified correla- tion analysis was used to examine the relationships between environmental variables, averaged over larval durations, and light trap catches of 6 of these species. Time-series analysis detected significant correlations between catches of 8 species and wind direction; however, correlations were often weak and variable in direction. Similarly, there were weak correlations between day-to-day catches of all but 3 species and water temperature. Modified correlation analysis also found that water temperature was correlated with catches of 4 species (Lutjanus mahogani, Stegastes dorsopunicans, S. partitus and S. planifrons). Catches of the remaining species, Ophioblennius atlanticus and Thalassoma bifas- ciatum, were not correlated with environmental variables in these analyses. Multiple-regression analysis could not detect any combined effects of environmental variables on patterns of light trap catches, although this analysis also identified weak correlations (R 2 = 0.08 to 0.29) between catches of Lutjanus mahogani, Ophioblennius atlanticus, Stegastes dorsopunicans, S. partitus, S. planifrons and Thalassoma bifasciatum and water temperature.",2001,Biology,"list(name = ""David Thomas Wilson"", ids = ""144596936""); list(name = ""Mark G. Meekan"", ids = ""3973932"")",02c55c46e038504ed4baf5d1698522c42278d4e0; 15041fe6ae8a8fe6bcbd4b460407ae8418a947ca; 6413ba294f9c3e543b9b05ec172ee9a11dafc801; ee527c0eff1d7e4b91e0073e4c4267abe0697a11; 8c7bb420680dcd2b7f68a63adbff9ddbe3646f07; 1379f0a21eb193d14f78e0685e8aab7416625de5; 4162caf7e588d26828f055d193c7bbd44ca77e48; 5be0f8b74869c37ac35c03c468a5d6ec9f898897; 97b65b245401211e7e6fd87eed3b72b2ddf517e9; 67f871f0a960563281832ee90ff867f8a2f6ae47; 34bd6481189dcef9c52be4192ce7d24149a967a5; a0553b076aa254ec169bbe3517d97eb80393be8c; 69ee72e538b4a1835bf8ef87bf44a8b6762b0e4b; 797e11499d99e1cc8ddf624fa17bcf9b05255e9b; 1366290c0486e36f98705a7c283fc96805e0cd2c; a9fb30be201c99a65f1cac9ef5a38ea401332e3c; baaf1716321a7d1b0c69d76f1b630929c3d2074b; f0e5a5895943115f1dc2a095e97c2c4a7b4d7cc9; 11e8625d700304b13702e4c8fb9c34dfe2c44336; 21de13f45e8f050e699c15ca614a9081a0d91319; 0f19989b65be8d6ee24ee96364c691c79ee43e1d; e83b30e93e55784e5abae64d05c52e58b04f1252; 328af61fbfb453f965f1f82bbcbc9dd6e6392102,0a7a83586106dd79a86cc715c164e0227e3e67fc; 99b5a0a168fec7fbf12b8d3cdd232c1923a3e338; 954745bd7d074918b1245f221d7ffdfd028e5625; 3d5ea9d1443d8b6cf5fec2b2d4e0b635719154dd; 5af5b125d2cce906ae3828ccdb45d9d59e3de24e; b7278220891cb5d742fec28e8f756c1ed91b390d; 48401c3ece0c1c2dd37998dccd2b2891e92bf751; 5ece184249fa367b90f3d076ee0f5e07be1900fa; 873eaa6e304758416b9f038c8806123b574b8a33; 7f90e3aef319507df343bcef760bef6b43745ad8; 0cfcfaa0a71e2145615efa1fd13967972e364704; c5caec1053952717b7cd370a1e17845eae69fe46; a9e9f8a6bf1328e72dbe4487a18c5bb3f9bdea6f; f65644b3cb69e42c2201aa343d3d61101ba2d0a5; 3ccede030b586d46419e278366174b24fdc632b4; c4205da1a56f3cf73b51229c384786ac630839f1; 6cb919d7ceb88a94181ccb84d7595f972d0b2b4c; 2ca52c3e397fc55d88a3a15f7a339141d64a403c; 6817472079d9f80431a3896000610120107b8027; f134c5bb61224d5739a3a161883272fb97b2285f; 9036e194f837c926aa2133375ed730e7f97bc216; 5bb37e7a4326399f7abd47c099a8ded8a140b81d; cd8854cf01a01d970ed15e6eeb9cbfbb7c3564ad; f14abe80dc5b7bec72dc6d0e2b13ec19390763ca; d4e5c6b712a10321389b8ed125cdd69aea7d0560; bb073947de23d0bb1f442d6d812bf7f1d1852cd0; c1972f1848f6d02601ed1e4da00735bf685272c8; 5d8daa2f36b3d07359e401756208f9e3e271557a; 2e734c86d2abc9265e395aef01ace32438c9fffe; 40008408308831559f62490ce3d5325973e2b39a; 0dac13914d380707e380f77913c94f8430687cae; d7f0a1ce151c38195bcf55c1d781e2f7bddec9f7,Marine Ecology Progress Series,222,197-207
0a902831ad7135422b32845b0941f36e12adf520,Some Sparse Methods for High Dimensional Data,"High dimensional data means that the number of variables p is far larger than the number of observations n . This occurs in several fields such as genomic data or chemometrics. When p>n the OLS estimator does not exist for linear regression. Since it is a case of forced multicollinearity, one may use regularized methods such as ridge regression, principal component regression or PLS regression: these methods provide rather robust estimates through a dimension reduction approach or constraints on the regression coefficients. The fact that all the predictors are kept may be considered as a positive point in some cases. However if p>>n, it becomes a drawback since a combination of thousands of variables cannot be interpreted. Sparse combinations, ie with a large number of zero coefficients are preferred. Lasso, elastic net, sPLS perform simultaneously regularization and variable selection thanks to non quadratic penalties: L1, SCAD etc. Group-lasso is a generalization fitted to the case where explanatory variables are structured in blocks. Recent works include sparse discriminant analysis and sparse canonical correlation analysis. In PCA, the singular value decomposition shows that if we regress principal components onto the input variables, the vector of regression coefficients is equal to the factor loadings. It suffices to adapt sparse regression techniques to get sparse versions of PCA. Sparse Multiple Correspondence Analysis is derived from group-lasso with groups of indicator variables. Finally when one has a large number of observations, it is frequent that unobserved heterogeneity occurs, which means that there is no single model, but several local models: one for each cluster of a latent variable. Clusterwise methods optimize simultaneously the partition and the local models; they have been already extended to PLS regression. We will present here CS-PLS (Clusterwise Sparse PLS) a combination of clusterwise PLS and sPLS which is well fitted for big data: large n , large p.",2016,Mathematics,"list(name = ""Gilbert Saporta"", ids = ""2866252"")",,,,,
9f84922bbfebce452b40a5281256448f1b336d9f,Clinical prediction of thrombectomy eligibility: A systematic review and 4-item decision tree,"Background A clinical large anterior vessel occlusion (LAVO)-prediction scale could reduce treatment delays by allocating intra-arterial thrombectomy (IAT)-eligible patients directly to a comprehensive stroke center. Aim To subtract, validate and compare existing LAVO-prediction scales, and develop a straightforward decision support tool to assess IAT-eligibility. Methods We performed a systematic literature search to identify LAVO-prediction scales. Performance was compared in a prospective, multicenter validation cohort of the Dutch acute Stroke study (DUST) by calculating area under the receiver operating curves (AUROC). With group lasso regression analysis, we constructed a prediction model, incorporating patient characteristics next to National Institutes of Health Stroke Scale (NIHSS) items. Finally, we developed a decision tree algorithm based on dichotomized NIHSS items. Results We identified seven LAVO-prediction scales. From DUST, 1316 patients (35.8% LAVO-rate) from 14 centers were available for validation. FAST-ED and RACE had the highest AUROC (both >0.81, p < 0.01 for comparison with other scales). Group lasso analysis revealed a LAVO-prediction model containing seven NIHSS items (AUROC 0.84). With the GACE (Gaze, facial Asymmetry, level of Consciousness, Extinction/inattention) decision tree, LAVO is predicted (AUROC 0.76) for 61% of patients with assessment of only two dichotomized NIHSS items, and for all patients with four items. Conclusion External validation of seven LAVO-prediction scales showed AUROCs between 0.75 and 0.83. Most scales, however, appear too complex for Emergency Medical Services use with prehospital validation generally lacking. GACE is the first LAVO-prediction scale using a simple decision tree as such increasing feasibility, while maintaining high accuracy. Prehospital prospective validation is planned.",2018,Medicine,"list(name = ""Gaia T Koster"", ids = ""7808561""); list(name = ""T Truc My Nguyen"", ids = ""150322690""); list(name = ""Erik W van Zwet"", ids = ""2496120""); list(name = ""B. L. Vázquez García"", ids = ""87598587""); list(name = ""Hannah R Rowling"", ids = ""87631900""); list(name = ""Jordi Freixenet i Bosch"", ids = ""80137103""); list(name = ""Wouter J Schonewille"", ids = ""6045369""); list(name = ""Birgitta K. Velthuis"", ids = ""2722701""); list(name = ""Ido R van den Wijngaard"", ids = ""7295803""); list(name = ""Heleen M. den Hertog"", ids = ""48710639""); list(name = ""Yvo B.W.E.M. Roos"", ids = ""39843482""); list(name = ""M A A van Walderveen"", ids = ""7959616""); list(name = ""Marieke J H Wermer"", ids = ""49202913""); list(name = ""Nyika D. Kruyt"", ids = ""5261400"")",131f4692168139c6814f2d138f9d9ec6c64aa3ab,6ea866331436ce59a89ddb32da42f911cb1d3810; 765760ca75805283c4e7adb7b32f2aabacc18b66; 2d49959774af0dd2e37a30224d12e328321889a4; 7604fe8d79a5d4c5b701996f44cd573cf4bfc9c7; 0aee91cbdcf9e5116087a3c77fadd22a5713a09b; 2692834bf917230a06f7c0d8d9cba2da688516b6; 28e9b42deb962764f3b693b52788c8ed9c00d345; 15539fd2f2b6ffe4314279f54dceaace7097a74b; b73d8daa901364201fdb43ee0b26f6f5c8db8221; 62561aa5b1e583460c3af769721f072dbd5d61c0; 02b42f91ec5a08805332cc5f8c8dcb1ac9fa0f44; b8d527eea7a492d8673d1b551208f0b0b6198182; 10f44a760e176cc7d31b86531c1002e999b42b8c; e406b8b3750ca4d4f8b28241bbe794e44df3a153; 958d215dc29115cd75a8a7c42b5d9d51cfcae0f3; c8915114e1a13b5b415900272781ae866e33fdc4; b71d7fa4e2ed53ff56a9d463ca29d6267cd9bef9; f26a9d1c5a61420c26d7507d208b9de14b44d95f; e0c706402cf6cc205a0980ee047de9fc710c6aee; e6ea2f5f77617f03248a3c6c3222299886d6a7b7; 7a4656b6114cf3cd393a77d1d5ff4d532eeced56; 5743b43e4deace275b06723f93aea5819655bf4a; 241257cdeb051959597af7ea8112e085e620a255; 05ab43b91321e8cf57a42614dd630baecd110bd0; c7ff346894f2a5a8db25005fb7468febe8f7f922; 6250b5277d72642e18cd65d7f9161677c111dc8a; 8e7b867c1205cd6ad53044744c380271779feb4f; 1a4b9c4f218f84b99996589dd37f9153c5a30f66; 28ed2f84063132431b7a625fb786e5bb0d6e2bf3; cba5ec6a9de3d456f0a9b7e1b796dd594219ec95; 17cc79a371f3c2eef6a939b281ba3ef3f6bc2596; 93d703fdc1bfc22172d392024d1676de5c8f1dbd; e3d022ebb2cf3be3143a12b7e9924c25803d5ec6; 7446997d6447863c76072342ba0fd1b3d74584ab; 225418d40026bedf0fbea63bde8471e36e3e4de4; 3fb60f56b4efd5199754d43c905e91c908727e0d; f24054be2fba26c7028437f9a7f0812e37772a24; f9ea59d40f1433108443a503abf41b3d644ea6c0; f99ab20ae5674ad394086b1901fac654faf28a52; 28ef43cecf78e3101fd239b06dea963238e03515; 7a3aff94a8d5743e2af264d366a3de33ed888a74; b365b8e45b7d81f081de44ac8f9eadf9144f3ca5; 1f0ee20adde11b5e050b5be94acbbdf44dc640fc; c0f681aee684b9844cb8a73d685e0238a589b2bc; 38b7d32c704bcd362e849a6733f4c6cbfdcd434c; fe1ba6deb986a969544bc8fe0ad4c414c3390448,International Journal of Stroke,14,530 - 539
8757bd7e06c54647fae672941ddb40ca9a97c91f,Inference on average treatment effects in aggregate panel data settings,"This paper studies inference on treatment effects in aggregate panel data settings with a single treated unit and many control units. We propose new methods for making inference on average treatment effects in settings where both the number of pre-treatment and the number of post-treatment periods are large. We use linear models to approximate the counterfactual mean outcomes in the absence of the treatment. The counterfactuals are estimated using constrained Lasso, an essentially tuning free regression approach that nests difference-in-differences and synthetic control as special cases. We propose a $K$-fold cross-fitting procedure to remove the bias induced by regularization. To avoid the estimation of the long run variance, we construct a self-normalized $t$-statistic. The test statistic has an asymptotically pivotal distribution (a student $t$-distribution with $K-1$ degrees of freedom), which makes our procedure very easy to implement. Our approach has several theoretical advantages. First, it does not rely on any sparsity assumptions. Second, it is fully robust against misspecification of the linear model. Third, it is more efficient than difference-in-means and difference-in-differences estimators. The proposed method demonstrates an excellent performance in simulation experiments, and is taken to a data application, where we re-evaluate the economic consequences of terrorism.",2019,Mathematics,"list(name = ""Victor Chernozhukov"", ids = ""26331346""); list(name = ""Kaspar Wüthrich"", ids = ""51116158""); list(name = ""Yinchu Zhu"", ids = ""10170636"")",fcf824fb1435a7b7affd5a7ebb3320e6b18db028; 4ca3082af373f1323f80531b1bb76574c52f518d; ffebfe3798242d917df6cfb5a0f0bfb77cf47a88; 8a174f29ebf1f24878f1c855d769c40256b9d909,437bef83ed7794a92d55b8d94a859f55eed51d86; fe1d480d577dfed1306ef99becba578cdb520a60; d64e2a9498ff73c11b1a51b348df8db30df7f416; 99b4201b3264f3cdad9ceda7294ec8ad534cb63d; 4241c25b3b8089a0b9baca05b2e6ecdaf4a42022; 43b586b7b653bd8115e84c31af42ca8098c77367; 956bc66f0043962b8e057f57652f3cd336eeb72d; ef8d3a3a0b9d75ab918f8da7e4a4343e9e50efba; 276be991dd62a963a46ebd83cd05fc431c0ac322; 6c0816db531371a1a5b5871d2a89c62ed4e7a505; fc5db714f0126e38f89f3e92cf67e0ff848f55d9; efd3605ea229d6804e616b6af34becff2dac904e; 40166988d84c7e9867b11facf5cfbcd73df18437; bf48eb31a4dde96e8050bb97996ca02a488a1124; 0c738fdfa27450e6f35b963335db02f20f4bf687; 8c2c1be3b6530d3d94bd4b3283d9a4f0de6f0e13; ece5045d0f495834b25d2188735bcee982edd8c2; d38e40481ccebc43c9c2e50b1739f2c951a7e368; 545122e2990590524459ec9b59ccac6ce71e3b6a; fbf99e5562a0780856e7c4ed615ab2ab66c0dff3; 5de3ed893d55624f87405c6a1601aeb51c372afc; 605973926515415ff208cda4e52c3c02b136932d; a83e9272fe67d617368a22bbfddc43a9654e270b; 52c0923580f5cb13fd165eb42f9dfd64be7e96ca; 15a57477504246f26d124ec4ea143449a7fb46ce; c31c87c591a25c64fbaa82e8ac6a81831b6ac7ce; fe86c9ef608d5cd33c496d182879192287cf8569; ca5cf32b8357d8209eb9ea31d1018f924565a37f; c89cec14e26cb94a5e0acb7048295f9ce72553cf; 53445cafa0393a343b1d16fdf2950cc80f34e4de; 8500d524dd0a09446e389cd709e264d7f6b4ba04; 45f875c9d146094a75093f03b8e2a90a31ebee92; e716688ddc25dcc8871ef04c7f864063949aa8b9; 94324e25f7a67c714da808f4dd375949ce614a65; b35e52b9a37a3cae02ef13f7fe8990afef3dc35c,,,
e1ee101b7d7fe1c1f26b4c49cd1b5ad9339dee7d,Structured sparse logistic regression with application to lung cancer prediction using breath volatile biomarkers.,"This article is motivated by a study of lung cancer prediction using breath volatile organic compound (VOC) biomarkers, where the challenge is that the predictors include not only high-dimensional time-dependent or functional VOC features but also the time-independent clinical variables. We consider a high-dimensional logistic regression and propose two different penalties: group spline-penalty or group smooth-penalty to handle the group structures of the time-dependent variables in the model. The new methods have the advantage for the situation where the model coefficients are sparse but change smoothly within the group, compared with other existing methods such as the group lasso and the group bridge approaches. Our methods are easy to implement since they can be turned into a group minimax concave penalty problem after certain transformations. We show that our fitting algorithm possesses the descent property and leads to attractive convergence properties. The simulation studies and the lung cancer application are performed to demonstrate the accuracy and stability of the proposed approaches.",2019,Mathematics; Medicine,"list(name = ""Xiaochen Zhang"", ids = ""1750049""); list(name = ""Qingzhao Zhang"", ids = ""46324839""); list(name = ""Xiaofeng Wang"", ids = ""37026089""); list(name = ""Shuangge Ma"", ids = ""144072412""); list(name = ""Kuangnan Fang"", ids = ""8071985"")",,,Statistics in medicine,,
