id,title,abstract,year,field,author,inCitation,outCitation,journalName,journalVolume,journalPages
3a9ba5bbcc3cbc97141c04982886a60797d4d9b3,"Obesity, Central Obesity, Overweight and Diabetes: Women are the Most Affected in Burkina Faso","Objective: To determine the importance of obesity and analyze the relationship between general obesity and central obesity in persons with diabetes monitored in Bobo-Dioulasso teaching hospital. 
Methods: We used a sample of 380 persons with diabetes recruited through a study on compliance with follow-up examinations. Overweight and obesity were researched using the Quetelet index, or Body Mass Index [BMI], which is defined as the individualâ€™s mass divided by the square of their height, as well as waist size. Univariate analysis and multivariate regression were used [p<0.05]. 
Results: We found that 22.6% were obese [n=86], 29.2% were overweight [n=111] and 65.3% had central obesity [n=240]. The majority of obese [98.8%] and overweight cases [87.4%] and also 40.0% of those with normal BMI [n=160] and 8.6% of underweight cases [n=23] had central obesity. Being a woman was associated with general and central obesity. In a univariate analysis, obese were more likely to be woman, educated, have low incomes, reside in urban areas and have central obesity and a metabolic syndrome; central obesity is associated with being a woman, having a low income, residing in an urban area and having hypertension, obesity and a metabolic syndrome. In a multivariate analysis, being a woman, educated and having central obesity was found to be associated with obesity. On the other hand, being a woman, residing in an urban area and having hypertension, obesity and a metabolic syndrome remained associated with central obesity. 
Conclusion: Obesity, and above all, central obesityis a big problem in persons with diabetes, particularly in women in Bobo-Dioulasso, and waist size seems to be a better measurement compared to BMI. These results call for more organized diabetes care and prevention in Burkina Faso.",2014,Medicine,"list(name = ""YamÃ©ogo TÃ©nÃ© Marceline"", ids = ""5907386""); list(name = ""SombiÃ© Issiaka"", ids = ""32827268""); list(name = ""Ag OuÃ©aogo S Macaire"", ids = ""1379812929""); list(name = ""KyÃ©lem Carole Gilberte"", ids = ""4714310""); list(name = ""YamÃ©ogo AimÃ© ArsÃ¨ne"", ids = ""6623729""); list(name = ""Rouamba NadÃ¨ge"", ids = ""5808446""); list(name = ""Lanko"", ids = ""113912989""); list(name = ""Ã© Djingri"", ids = ""1397759314""); list(name = ""Pr Ag Sawadogo Apollinaire"", ids = ""1397759295""); list(name = ""P. Y. Kao Joseph"", ids = ""145269899"")",e2bcfa478691a5810f158359ef8e295ff4d55317,258b4b17fb05408a5b6c46d288a0feb96fac9c34; d7f756df048ab76b34de9d237d82940249f8937f; d5a2670dca53955f555d2ee40aebbe4e6d2e625b; bbc97e5efe7e0ef5f2a9f482b83a9d4dcbbda4f0; 83104abac55d765bdf1623fab4adf7378482fa69; 95b8df84a98c6d40a417a9161da2e1e4fb38c5ea; e7a77a25b1436528a8513161b33f9f42d6adfde3; 301293166cd9246c422088824df8bb4177bb7ade; a57780de9a94a3b40a17bb3a3f88eee99b045d60; 6abebd1c0c6db020e68e7f9d49a4878131c89c8c; 4521c5b494ce0ff95246403d4d7bf605557ef22d; 5feff931a66864f7c72d99c9fcb4264a11cc61f0; 9c346f073552c07f7be401d30f94cd4901dfd768; ed19cae910181e6d2f7c81fbc851f9f753008e88; 020091a220d02ac02849917564fdb9c7e81686d6; dda961388890f4caedaf257597da3129bf159e1b; 2f6bb3008a717293f71b242a6dded3c923c29d20; 506212413994be999746d87d33bc9cc465150b2f; 9a0904a21c797eca55e225b18d15307ab920aa56; 8f6b150e55535758eedad0d454df14e62ee92dbb; a04f9f9ab47945affe6ec034d33a54035d2ae7ad; 91a24333300c7f32fde5595658ad69e87bb4084f; ade31c3aa8e21195b5b5a37c03a7f535a200769b; 9a4407ce7d93c83a6a5840e53e0b708a7a30be22; 159e23cdc074e8ef2f848ba4b2a1882584212017; 744472588a1c9b532f721e33a81d355905bd0e64; 20bb442170392ba007f9a78338a89e046808db86; 8b1f3f1babeb34c83317913d5cc49f50d8fac07d; 6565f6742bf7307d83987f700df38310b51aed86; b0010d5c4b737f6181980b61590240657fe2c390,Journal of women's health care,2014,1-5
ba89ffaada98f87b567d5cf615e67d104a652dca,Confidence intervals and regions for the lasso by using stochastic variational inequality techniques in optimization,"Summary 
 
Sparse regression techniques have been popular in recent years because of their ability in handling high dimensional data with built-in variable selection. The lasso is perhaps one of the most well-known examples. Despite intensive work in this direction, how to provide valid inference for sparse regularized methods remains a challenging statistical problem. We take a unique point of view of this problem and propose to make use of stochastic variational inequality techniques in optimization to derive confidence intervals and regions for the lasso. Some theoretical properties of the procedure are obtained. Both simulated and real data examples are used to demonstrate the performance of the method.",2017,Mathematics,"list(name = ""Shu Lu"", ids = ""145713173""); list(name = ""Yufeng Liu"", ids = ""46399637""); list(name = ""Liang Yin"", ids = ""48089519""); list(name = ""Kai Zhang"", ids = ""145489257"")",304ddf95e2a39e2a3f2a196d35623d4adb168254; 58f5be2ad4c12284bd8db53d4661ce853d849248; 73ee4ccca339c754283197a4fc807df44cbf4d2a; f6e6e164bfc18f4a41e99eba657b9f946f6a03de; 38fa4431eb31ecf809f6000064472f3950588e42; bcbadb66aaff9402a126d1accc36a55314082f9b; da07c28ee46316227ab61c1cb0ebd0854181a30b; 68d3c63c4958d8ecb6f0694854c26d4b9f1d0d48; 74a8230998e5314bd38cf116622be57149abd6af; e36e22b5e387f1abc722049fb89fd4cdcd1386e4; 3b81308ebc5132ba4c002e3d509deafb90a155b3,20ee888ca9c3bae784f266405b4d6395c6f32955; 7b4b6a3b9d19a1f57033d8642ca7b9ac97e94263; c8d4be093cd4da26f0402b6b9b2680d7ffae2959; 500990957fb0f3a54914aff65413d76ae6e69d06; 46be236b6c3896aea3866672bb4606496694fc77; 58db9852fedd50a4732e3c174383710422c32ecc; 59a45558657e93aed40a2f5c73bbd50a8d76dda0; 6e79cd2f1b8f03f4b94cd258659cd758f7d52e51; 8125d755ad1fa64b869657d0f102836908af7a09; 12e5939a80ec59f81214d7e729c577c350af9501; 14e751b428d9c23148331f6215a699bcf0f3ddd4; 6410ec306cfec30aa85d2172ac9eba1ef5bea4cc; b365b8e45b7d81f081de44ac8f9eadf9144f3ca5; b8db0ca28c530dd0d0671af5d1a1c238a5a03fee; d97d7f1109206fe6925badd934b4c8dc9a3b380d; bee570503aaa0ed5bc5dd4cf6aa742df0b5cef87; 67f33b4ea84c8cf815a9919dd34fee6e85c22f6f; 2d2ca0a06be3f597e94310b9fc78a350d0dbfcfa; 05ab43b91321e8cf57a42614dd630baecd110bd0; 2a4a3c9b6aac9733e11c8860a5be1f2d32a617bd; 113b10df570f00ed2065e5e6fb2259b44ab94f1d; a5385e302ad6cc7c82c84096290989a02c96c0fd,Journal of The Royal Statistical Society Series B-statistical Methodology,79,589-611
29365331f6a56938bdcd2abd8e186d127a709af0,Learning Local Dependence In Ordered Data,"In many applications, data come with a natural ordering. This ordering can often induce local dependence among nearby variables. However, in complex data, the width of this dependence may vary, making simple assumptions such as a constant neighborhood size unrealistic. We propose a framework for learning this local dependence based on estimating the inverse of the Cholesky factor of the covariance matrix. Penalized maximum likelihood estimation of this matrix yields a simple regression interpretation for local dependence in which variables are predicted by their neighbors. Our proposed method involves solving a convex, penalized Gaussian likelihood problem with a hierarchical group lasso penalty. The problem decomposes into independent subproblems which can be solved efficiently in parallel using first-order methods. Our method yields a sparse, symmetric, positive definite estimator of the precision matrix, encoding a Gaussian graphical model. We derive theoretical results not found in existing methods attaining this structure. In particular, our conditions for signed support recovery and estimation consistency rates in multiple norms are as mild as those in a regression problem. Empirical results show our method performing favorably compared to existing methods. We apply our method to genomic data to flexibly model linkage disequilibrium. Our method is also applied to improve the performance of discriminant analysis in sound recording classification.",2017,Mathematics; Computer Science,"list(name = ""Guo Yu"", ids = ""48056614""); list(name = ""Jacob Bien"", ids = ""2154667"")",f6599d7b81f13eb5f71e77297ccf94bc18957200; 2ba2c62facbbfb6a689cd3bb62b25d2bbfd44f3e; d1528bfa6bc35d1afc5c8a741c55df3b2a87b710; 08054ad91d099019455c77577fa4cfd0c824d1ae; e4aafdc8350d8e0a084d9b4e3befee94b453efdc; 509ff1f5496a6a316711a3d578be8a9041c68fe4,31d495c134b6ec8d29985699f0708598b749b517; 5b573a9f42ec2e9c384be886a5b1eae688b8ba3c; b365b8e45b7d81f081de44ac8f9eadf9144f3ca5; e03748570662f7e2c37e60dcf429b880e45f2189; a35d565e8f70cb6ddc09a65904a72622e16b9485; cb59554e76f45f344bc60b97a6144dbb4cb0de05; 7b4b6a3b9d19a1f57033d8642ca7b9ac97e94263; dc5b06753fac11268bc2300b7c25d50cbbcdeb5c; 7cd1619370c1ab9b68acbb05d91b6562c78ed8a8; 73694794fed5f68ccfdaeda76a00eca4dea230ea; 44165956328b5d07c82d95e682648efcb09ecc8f; 4406c54f40e0f73db2180704d454951649df32f2; 5cc657d5295f6091a3ef4ac898bf15342f5ed26e; c59c6afcfd5d03eb2c8fb5d1665afacc077771b9; ed796d7626d70749afb0bf713429198f74c8f3df; 910f8df95db7849036910e5773dcc9b09e70f03f; 31c88a88c9603ec32b237128dec6feeb5713a5d5; e5ffaa4d7752d55cc5cf76eed1fec267b2db171c; 19f90a8c59b2b5924debf81fc38c53f2f445b236; a645bc96aa224b3e4c40ea9ad8c1d319d38fa9f5; 02b24f4376e8ff17d6c4179b548b2c8d7934cce4; 2540b36616761e6fde519eed00aef8f0e5e412a0; a310c1018197e6dbb1e1e45c23d6ac50ac272e20; dc0c0afe4d2033bbe49d40df8a7d4194a6142f4e; 80db408970c1b8d4ebb664ac313bf5c452f95671; eba49f4e6256f44fb6a2fab5ee95519e9a9fb49f; 20ee888ca9c3bae784f266405b4d6395c6f32955; cb507858c4546fe102bea4dd1274ea2a748fb176; 05ab43b91321e8cf57a42614dd630baecd110bd0; 9a3edc623b5ffa7522ed8f37c01ce4b5125002ad; 37b573e791a5e41ef3b59e6f68f58a8cbe9f8cdf; 9e8d3337e3aa9686b2f70d9db0b4bb9eb6f9d9b1; d06798476ae907160dc4ec6b88be466fdcdb8b6d; 398ff09f1ef9fdc1d70f59eeb744f06c06998528; 93d617c2891e450ba8d5cd4149ba4fc38c962295; 2a4a3c9b6aac9733e11c8860a5be1f2d32a617bd; f36c762eef6d0bbb3d7e5d29f226e234f070344e; 43b3440fd8ec728ea6e57df25f3f686f5eca26f1; 5006e66095e3a42634e5ee4de59f10220c204778; 3b754b458b125772fee0460957d69366d07bb864,J. Mach. Learn. Res.,18,42:1-42:60
97adeb530113dd553c1df145d499a49e6f8ee099,"A Temporal Examination of Platelet Counts as a Predictor of Prognosis in Lung, Prostate, and Colon Cancer Patients","Platelets, components of hemostasis, when present in excess (>400â€‰K/Î¼L, thrombocytosis) have also been associated with worse outcomes in lung, ovarian, breast, renal, and colorectal cancer patients. Associations between thrombocytosis and cancer outcomes have been made mostly from single-time-point studies, often at the time of diagnosis. Using laboratory data from the Department of Veterans Affairs (VA), we examined the potential benefits of using longitudinal platelet counts in improving patient prognosis predictions. Ten features (summary statistics and engineered features) were derived to describe the platelet counts of 10,000+â€‰VA lung, prostate, and colon cancer patients and incorporated into an age-adjusted LASSO regression analysis to determine feature importance, and predict overall or relapse-free survival, which was compared to the previously used approach of monitoring for thrombocytosis near diagnosis (Postdiag AG400 model). Temporal features describing acute platelet count increases/decreases were found to be important in cancer survival and relapse-survival that helped stratify good and bad outcomes of cancer patient groups. Predictions of overall and relapse-free survival were improved by up to 30% compared to the Postdiag AG400 model. Our study indicates the association of temporally derived platelet count features with a patientsâ€™ prognosis predictions.",2018,Medicine,"list(name = ""Joanna L. Sylman"", ids = ""4689635""); list(name = ""Hunter Bryan Boyce"", ids = ""40995885""); list(name = ""Annachiara Mitrugno"", ids = ""9068082""); list(name = ""Garth W. Tormoen"", ids = ""4517846""); list(name = ""I-Chun Thomas"", ids = ""115260876""); list(name = ""Todd H. Wagner"", ids = ""25386885""); list(name = ""Jennifer S. Lee"", ids = ""32834565""); list(name = ""John T Leppert"", ids = ""35182236""); list(name = ""Owen J T McCarty"", ids = ""48871909""); list(name = ""Parag Mallick"", ids = ""2376538"")",3629274ec94e3f3081735c8c1687d6d9383ad272,89c6ff8f8c68225149cb4dd0d24581c3b46a6d3f; a01ad43e52baebbf7ea576edd5676126e8c429e8; c5d713608674491abc2a0e1444e436d4091b31ce; 892815d7571fd68806619038816501086a662a38; ac7f9efb61ffe7f27a760ceb8f81fecc253fb8a0; fdc7761cd426891eca15bed087f27150b8f59e37; 6996656524d7039276867056c313dbcd1399e4d1; af37ea170023fc78a0eeb08204d1d3e0be684cd1; 148cbe5d4354b4f6889ec819d14b6317e083ab16; acb1dd68781f7b6463d73ee973bda7389b0110b0; cb1c5a844ca88817c29c79cefe402a0eb94d53db; c31cd5a245ac287970c5ddc26da0fdf1f82d6f18; f37631f8b699a2d6e628c63efb23970397ad1e09; 588d2a62a6406d133e6b71dede918d2647e835e0; 5769b6e687a62ed1151ffb46d07d7c90c7a05c5b; e0657746965b1541b91873352fd740448d0edf4b; 0a7f81bf00bc1edd01e4247865eb3fd6cd9edd1f; 4e15ed40e1af74c287b35a88fc411ab5d3f5ef92; aeeaf45ace6c376ee78f711dfec9cd5c30539b18; 7b47c79d140bdf6fb558938959e03b6fe2c49f9e; 247149761b0bcdc0a5920bfe89bdc2c17db2970d; a4c60dc20621029914d306f0a1f997fe1fc0ec0b; a285105c96e7d67acd03b6d25f01c34bf1bdd0b4; c95512465e6e7a6ba95355969d91ff14a15e1cd5; a5ba99753e92db093cfd076dc04110ea85989ba1; 71deea8ab2141e3e7b25343b6fada6aa30b52530; 56b2d9f2f1b20421f27ec832d754172b2c6b8d70; ad1df22c68bfeed11c3d6ce3b795cfc8b4cc0aa6; 9e838634e86acc6b22dd9cdee19839a29aa8941b; ed0fa7916fa195246762d19814e68a99fb78b265; 7aec55b791e620223d451fee3e18f34478b49fe6; 7619e4acc9e425b1c20aacfb8a210368a9a222ef; 975f1a2dc6cc10d8b56c074469dc076837a010e0; b8e02ecad28afbb5f412f1dfc54f6630f631d384; f1406b28fd7b0cb7ffcfbfac6af0507eb163592f; 1a18a9ad97c579dc18deb3c0a7fccf6354a044d1; 0576ffc6c82e8238f872657d652e97952105856a; 5c49f64283a67817a5e264edccdfc2ec63cd964b,Scientific Reports,8,
b253da1fa544aed534bd8abea993358f0bbe5831,Using Multivariate Regression Model with Least Absolute Shrinkage and Selection Operator (LASSO) to Predict the Incidence of Xerostomia after Intensity-Modulated Radiotherapy for Head and Neck Cancer,"PURPOSE
The aim of this study was to develop a multivariate logistic regression model with least absolute shrinkage and selection operator (LASSO) to make valid predictions about the incidence of moderate-to-severe patient-rated xerostomia among head and neck cancer (HNC) patients treated with IMRT.


METHODS AND MATERIALS
Quality of life questionnaire datasets from 206 patients with HNC were analyzed. The European Organization for Research and Treatment of Cancer QLQ-H&N35 and QLQ-C30 questionnaires were used as the endpoint evaluation. The primary endpoint (grade 3(+) xerostomia) was defined as moderate-to-severe xerostomia at 3 (XER3m) and 12 months (XER12m) after the completion of IMRT. Normal tissue complication probability (NTCP) models were developed. The optimal and suboptimal numbers of prognostic factors for a multivariate logistic regression model were determined using the LASSO with bootstrapping technique. Statistical analysis was performed using the scaled Brier score, Nagelkerke R(2), chi-squared test, Omnibus, Hosmer-Lemeshow test, and the AUC.


RESULTS
Eight prognostic factors were selected by LASSO for the 3-month time point: Dmean-c, Dmean-i, age, financial status, T stage, AJCC stage, smoking, and education. Nine prognostic factors were selected for the 12-month time point: Dmean-i, education, Dmean-c, smoking, T stage, baseline xerostomia, alcohol abuse, family history, and node classification. In the selection of the suboptimal number of prognostic factors by LASSO, three suboptimal prognostic factors were fine-tuned by Hosmer-Lemeshow test and AUC, i.e., Dmean-c, Dmean-i, and age for the 3-month time point. Five suboptimal prognostic factors were also selected for the 12-month time point, i.e., Dmean-i, education, Dmean-c, smoking, and T stage. The overall performance for both time points of the NTCP model in terms of scaled Brier score, Omnibus, and Nagelkerke R(2) was satisfactory and corresponded well with the expected values.


CONCLUSIONS
Multivariate NTCP models with LASSO can be used to predict patient-rated xerostomia after IMRT.",2014,Medicine,"list(name = ""Tsair-Fwu Lee"", ids = ""1771310""); list(name = ""Pei-Ju Chao"", ids = ""5352745""); list(name = ""Hui-Min Ting"", ids = ""38757973""); list(name = ""Liyun Chang"", ids = ""7320973""); list(name = ""Yu-Jie Huang"", ids = ""1724059""); list(name = ""Jia-Ming Wu"", ids = ""47876259""); list(name = ""Hung-Yu Wang"", ids = ""1755989""); list(name = ""Mong-Fong Horng"", ids = ""48863657""); list(name = ""Chun-Ming Chang"", ids = ""48695123""); list(name = ""Jen-Hong Lan"", ids = ""2715633""); list(name = ""Ya-Yu Huang"", ids = ""7524979""); list(name = ""Fu-Min Fang"", ids = ""1875711""); list(name = ""Stephen Wan Leung"", ids = ""12941320"")",5ea2b70d7dfdcfb2114725ffc197952ab8265087; e5a9e1975ce97f21823acf65bd18743f3ab130a4; 435cb26beb26ef54552cfe9136d135cd4c1c6ea6; 408610a6abf3ee821598387eea1d5c87ff04d0fa; c8bd9a679e93a4e28c1cc67ea9bdf2a16c15ee01; ee28b25102e9a90a3521ac396c4ac03c8b04c16d; 9e57a353c7abee3e7e9eccc69de0f6de4ea8d59f; 6148bbfd2c797e8dad02633c9c05326b804397a7; eacb8a586928dcfe7005d00f90c63d955422884c; 9bba5998c71209732d8f6a1b1cb6193731671943; 75e6e40b27e68a8c9b44ceb7eda7f06f22ae9dca; c86060f582ade6670c09327693403231389f6a65; e26450a1ef54edda7c8326ecd0f638115a9f65b0; 44479cc5266788c3bafcc0b12ef0758827741fe3; 5791e2352cdd4711cf7e6ea27ba9cefbbfa77bb7; ce04733c64b253a6d19f1b9c49d13c1bd1300955; ec3ab384d93e758eac1aceb17be3bf870501dde1; 7ab111745c95b2b9a2e990cc872d779a94b1838d; a3f0afba31d875c5ba3e72df9613c42e826e2c69; 802e3a3fca58911f3fdbdd67db63a28f7d44609f; 63ed08ded1b8fedbc46e086b876767fadaf98a54; 8f24dadb867c6f8390613c134299805e052315e2; d8307f4587b123f4c8edb8bf32284edbb5e82611; 50684a8477659fac012fb0c91500680c7af21b74; eb063bcfb0905ec51764368a972c8e48404d5e0a; 42a1dc1edd5a1067dc3095a75e9e5fbb9e02a7f7; e4f37ca092dd4ff49681b934c1c7f2738987cfe4; c683c2848158079e9456165155c2e77086c15005; 66faabd7a6cfb3302c9fbd45fdbd32f080efbdef; 92b69105a8af4ca63c6d2b7ef75456938760ddaf; 5e5e1602d017e67a3682b710eb3241d1ae4daf56; 48ad928cf857f717c6d71886b1ebc49766320120; 2451c3f75bd0eb9000d1b190c3d72dadda704337; 09e7cf7a115492c703bc9e8a44d7827818d5ba84,a2a046050d20871209ac3b9da1e8dc264c9c0cb2; 13175d0e8ad2e4ee197a1bf37064937fd4f9c595; f7d9ce5abb373ffa21bead9c8377b41dc4c93384; 7c7d3edc283fd8475d648531d36df66a3257e574; f141ff599733f2c94e4875294b541be4b1b0c48f; cbacba5e654cf84bc735bac6940d3124f2997fc2; 4712bbec43350e36653dc68a16edd6622198c955; b42a02737976ae2e1e29dc38e081a5e941182d00; e4615097c1c9b233ab8829dbfe0df138f97eae48; c121bb0a680dc632ff98bb7972b09ddb394516d5; b97e532da2248963eeb06d414baf3e7115b45575; ad7d7afa85cbc3a8d5ab87471f6545c392a682f7; 5020b5f1c986e3cb82ececc3a7941e5b685f0ec2; 9b6327dab2d0cb4b21489e0881ad4120a5b5149e; 46d328435b9bd95876057deb89db984e13d600cc; 446d06de60be91f5f384f5e9290654438b83abc1; 25d0fe0a4d034fcce36e73f27b81bc825f945b35; 71acf70da96e82520bb0e03e0dd8c24f5ab2d3da; b4f3e0e0767280911d4177933d55d32acb1c46c1; 7a71baa3d43ee3201173f3df5dea311abe13c707; 3c7625c4b82306d4523ce458cd632c4a5bb13a99; f23ba1023763950f9647af7bc34f3d04ad19a2d5; cee98d987941c4194b7b93efd29e11f6a2c4ac48; 8244847c41bf17c990ab4f10cc362cb03d0798be; 0e83b0680f3067a0fd8b9a367edd39c9b28ce61c; 8dbc78c1ff1742643f32c9b4d37e64b494fb719a; 147de7a4d9a688c57c818a62d2ac5ff7a0fb9563; 9afbcbeeb065247bef6eebd72b01ac83cee607b0; 29f64bd1f95355b82c1f33d35569390ecb59beb3; 74d4a273dda10911540696a35d5928241f6bea6d; f89be3aa29635b1e7f6c8bb40d9aa81acaf41fa5; 8da579377e0a685cfc11a7e16e2c2a5023dc8979; 1dc8f7af6886396a61d75390c4f720981b52ccdb; b365b8e45b7d81f081de44ac8f9eadf9144f3ca5; 713a631f8f988b2a0dfd4eca014f93e7827189f7; 57d290e940aa3db3bfeaea03b9ec3a3bb3a71aaf; d260766429f6b64e270aa47d11851f6cb90d5e81; c32e14c48c4df011ed5b68ae95f7fe0f8a01ad9f; cabcc0aea76c7896ff80fbff682c4a2fff9cbd85,PLoS ONE,9,
