id,title,abstract,year,field,author,inCitation,outCitation,journalName,journalVolume,journalPages
1e106f69d32eeda1465c787206c7b5c906042f44,Asymptotic Confidence Regions Based on the Adaptive Lasso with Partial Consistent Tuning,We construct confidence sets based on an adaptive Lasso estimator with componentwise tuning in the framework of a low-dimensional linear regression model. We consider the case where at least one of the components is penalized at the rate of consistent model selection and where certain components may not be penalized at all. We perform a detailed study of the consistency properties and the asymptotic distribution that includes the effects of componentwise tuning within a so-called moving-parameter framework. These results enable us to explicitly provide a set $\mathcal{M}$ such that every open superset acts as a confidence set with uniform asymptotic coverage equal to 1 whereas every proper closed subset with non-empty interior is a confidence set with uniform asymptotic coverage equal to 0. The shape of the set $\mathcal{M}$ depends on the regressor matrix as well as the deviations within the componentwise tuning parameters. Our findings can be viewed as a generalization of Potscher & Schneider (2010) who considered confidence intervals based on components of the adaptive Lasso estimator for the case of orthogonal regressors.,2018,Mathematics,"list(name = ""Nicolai Amann"", ids = ""123547573""); list(name = ""Ulrike Schneider"", ids = ""46741105"")",,be6acea7508ec46a948d5d521f3ab23ed2d2ac5b; a2ce7f88a24f68c97cf7b9c2c5f6d3864f80eaf2; 71dc66aef9690747c8ab3a779cc9b98d85045966; b365b8e45b7d81f081de44ac8f9eadf9144f3ca5; 6cd1350af11da392dd0b188ba57167e677494e3f; 3352e59ce4a58e9f12e0942769c1fbd57319d5f2; 7c24dab9a44feed3842eb27be24e17187d6f2dc5; 880cdc02d3125c8d753ef8d34da1750d2b924f93; 3a3e13046a729e007efa4ba9c607e7c7e1768634; 5f0d051ffcbde45f92daee6395883cd476777ad9; e5ffaa4d7752d55cc5cf76eed1fec267b2db171c; 819562c634d2d4e1369249e94086da8626e75f56,arXiv: Statistics Theory,,
3c5cbd903ec024d3db78e1b3c5aa67a3c2b22057,Pattern alternating maximization algorithm for missing data in high-dimensional problems,"We propose a novel and efficient algorithm for maximizing the observed log-likelihood of a multivariate normal data matrix with missing values. We show that our procedure, based on iteratively regressing the missing on the observed variables, generalizes the standard EM algorithm by alternating between different complete data spaces and performing the E-Step incrementally. In this non-standard setup we prove numerical convergence to a stationary point of the observed log-likelihood. For high-dimensional data, where the number of variables may greatly exceed sample size, we perform regularization using a Lasso-type penalty. This introduces sparsity in the regression coefficients used for imputation, permits fast computation and warrants competitive performance in terms of estimating the missing entries. We show on simulated and real data that the new method often improves upon other modern imputation techniques such as k-nearest neighbors imputation, nuclear norm minimization or a penalized likelihood approach with an l1-penalty on the concentration matrix.",2014,Mathematics; Computer Science,"list(name = ""Nicolas StÃ¤dler"", ids = ""7912619""); list(name = ""Daniel J. Stekhoven"", ids = ""2225948""); list(name = ""Peter BÃ¼hlmann"", ids = ""145825806"")",17d023aead2fd1edcb7754ed56d7512dc6d2fe79; 1e20a56a50eae790bf40a707379a2e95d94c87b0; c58926c856782379e1aebe7193abacfa1c8880f1; 47ac08735bd6703e8e62e9498dda15081bf12f13; 45ea19c4b3a63741b1688294488dc689a16b34b4; 8392f93cf0073301c440bc7e4f89396ed5288cef; beb7348536ac3fcc77a770ec22e58ba97113dda1; 98dfa9681cee7c546bbc8b00d3046f9a1349ab69; e7ad0ce42cc02a890b0c042455944e13f3169bb4; 792ec1fca65ada2ee787f2cc4f8bce591930ed22; 2248336279dbf958cfbcc2f7ad6ef8325939eab5; 656658e07f0546e13ffe51664e8975ee82439f8c,05ab43b91321e8cf57a42614dd630baecd110bd0; ed8ddc4e3384d0e28c71d0b5a77afe764d3619e1; 78c2a503cce428082453fa186b2a20a41c9d75d7; eae97fb7c27ecafa785bc67dce5c0a9f211c3bb4; 956d43b30629e6be5e8f2c4edb4cea2404598eff; ed86ba250f3ccda0e5cd45f13ed393c829ce0adc; b15a00143e016d6348572ea1669b0221cfb8cfb8; 36632b6ea5ea553d7e48d5f342182650d58cc79d; 0d798ccdab999daaa94d8d5da79a4c0ab8984b8c; 31af4b8793e93fd35e89569ccd663ae8777f0072; ad3bebc29f034584f7b06957586e902bfdccc4f4; c1f4f6222167e95bdf07a1358960a0a3ab2320a4; a1b3294a937cae1239a9d0d825e562c2d734c272; b18db8ad3b91556088840834513162173d560db2; 5b3b9fe128e6849d59a26d7ceda57baad2524815; f558afeec9667b66995b46e306bcf5aabc2898b5; eba50a16826e34ee3041671120beabeaf3173802; 59fa47fc237a0781b4bf1c84fedb728d20db26a1; 12076b54e05aaf5b09ba2d929aca4ef8622ac156; bdfb57141b2141095ed942b28be24808aeba8d54; d56ac73315205d3ab2453a96433623da9f0eeb8d; 9f87a11a523e4680e61966e36ea2eac516096f23; b1fd8f26969806ca9c6e80472d20e7f58fe5f875; 892fd05687f032b93cda33ed9a0b3b8c5435b54f; f5676d7a129ce1100737a719794a2aefec46ce42; 5c28b24b0ecb610c6a527b32c3acb2c03b1bc184; 0a14824290453b95d051ec9cc299d0f61ad82b23; b365b8e45b7d81f081de44ac8f9eadf9144f3ca5; a9e0444b694a804a9088a622a6123e10a04430ae; f7f5e6be3b4f9eb957e66c6e75b0453ddd268b6e; 994ca78751ecfc571cb7ce05c4343c12b9677b71; 0bdb29b4786a4c95b73bbef7a69b86da8baa9396; 023f6fc69fe1f6498e35dbf85932ecb549d36ca4; c369d9192c9754fb7a04529c68f2fb286f646df7; 87d996fb98f586b7f134f60d94076bacfb693fec,J. Mach. Learn. Res.,15,1903-1928
021e1c95f68f89c097623af597466cebcb08fec4,Radiomics Signature on Computed Tomography Imaging: Association With Lymph Node Metastasis in Patients With Gastric Cancer,"Background: To evaluate whether radiomic feature-based computed tomography (CT) imaging signatures allow prediction of lymph node (LN) metastasis in gastric cancer (GC) and to develop a preoperative nomogram for predicting LN status. Methods: We retrospectively analyzed radiomics features of CT images in 1,689 consecutive patients from three cancer centers. The prediction model was developed in the training cohort and validated in internal and external validation cohorts. Lasso regression model was utilized to select features and build radiomics signature. Multivariable logistic regression analysis was utilized to develop the model. We integrated the radiomics signature, clinical T and N stage, and other independent clinicopathologic variables, and this was presented as a radiomics nomogram. The performance of the nomogram was assessed with calibration, discrimination, and clinical usefulness. Results: The radiomics signature was significantly associated with pathological LN stage in training and validation cohorts. Multivariable logistic analysis found the radiomics signature was an independent predictor of LN metastasis. The nomogram showed good discrimination and calibration. Conclusions: The newly developed radiomic signature was a powerful predictor of LN metastasis and the radiomics nomogram could facilitate the preoperative individualized prediction of LN status.",2019,Medicine,"list(name = ""Yuming Jiang"", ids = ""1682850""); list(name = ""Wei Wang"", ids = ""97520370""); list(name = ""Chuanli Chen"", ids = ""32452314""); list(name = ""Xiaodong Zhang"", ids = ""46447506""); list(name = ""Xuefan Zha"", ids = ""51297247""); list(name = ""Wenbing Lv"", ids = ""3192182""); list(name = ""Jingjing Xie"", ids = ""49598385""); list(name = ""Weicai Huang"", ids = ""51134258""); list(name = ""Zepang Sun"", ids = ""120379197""); list(name = ""Yanfeng Hu"", ids = ""1966220""); list(name = ""Jiang Yu"", ids = ""47891163""); list(name = ""Tuanjie Li"", ids = ""47268198""); list(name = ""Zhiwei Zhou"", ids = ""116463205""); list(name = ""Yikai Xu"", ids = ""7014083""); list(name = ""Guoxin Li"", ids = ""37078693"")",26d4b28aa7b5a48c193f7340df690ce5b0b714e8; 859d821e997b3fdc437b6e361b46fca153a6d03f; 34c5337b582ec70826d6ca95976b6f67deac5554; 14c489f25a7a2e4b6dad5a047cf4580217cd66b8; f3c77a2d188f450d6121ba69b6822a7c7e4ddb53,359a45d8d95f8ef303ec59cbf4187319f88be688; 58a7cdc20e3a5d17688f0f34ac448bc99a1e2133; 6d8c3be5e71816f92080e7206394fc2fa5fb0ce7; be8be301457c33906b4bf41367921696a06876f3; 263eb7a739ffb26ebfa948ad89717954dba387e1; 8f147c54fa5266ec9597028ce73d3a8c816e6b9d; 1d72f25545d93332b7e2f5d7211655e63d864796; dcd99d49af33bd14e9e0750bcf854e7b306c808a; d7781818d38aad7b1b54ea558653c7cff5cdf35f; 48302f7715de62eb4c11a2b891b519c5de6234bc; bf1ada90469df5f55f13f7014940c44aeb87ccdd; db426957c5dd8eec03ee187a081b5fb00919af07; c4c1e657b4ef573a140210f30343951936f2b653; 80b6df0b985e25755bbbcabe3e8662afa65782c0; 13be3028b3c1f2addbb5c0b040a81f60829be669; e72cdcbd8eff8b09415bc4d31df12b3bb5153ccf; cd9f70473ade2eddec49e073bdf2bcbfe1d13341; 422bdddb34b4ed581591381de4c7cd6445d25a22; 101f8270c770827120b0cf3ccfc24800747184c8; 3aeb3804b76224bf60bc811f32ab33d1c5c3bd4a; 6b5e99c128b9cd7b7fbc817a2843a47ce8a1c35d; 2e52dbad2419562f39d099585be881a97755e85b; 7d4ff6475771190ad9ea8e1a3394222e7f46ed56; 5b707984763381ba49b9dca58c10011e8cd4f850; d991e97e6c4174418947edac6dbfc189f0737ab8; e0daa35133304975bfc5eb28dd2e594b6c3ccff3; 84626ea7bb93f6aa4572d649b088dec71d1fa2d7; 6f86f8e486f43c36fac9b8c7f042620065132c3f; 22829b485a2fe75919f62c5c646dcc9ed051cfbd; 3b002068646831a6f59fabb6daeb0209ed54049d; 7ccf4b56f19c89bdefc9b3c135572b15e7abdca2; c621979c533256dbc10ab7b38ceefa6e1d5406a4; 58d1c1ffadb50d928258ef37d7620c27fc6d1429; e8ee0cf8b6ceff75372037309a429da69a393a37; 0e423d26b195eb3ac49890201016c2366e949580; 1634c3159c2504ded68c22aba74178d4474a51fc; 1f1ab69e3647471f6bfd991918bf6440d1b0b771; 7a380fbd9ba93b2b36e792b442b4d66bef34b5f2; e66b9bce3ba17990c185e148558d951ea058cf57; d73d3129d26bd708ebfb53d034f5018e1de9163b; 90ca821c8e700f8ede86aa2ee7f7ba796d2cb9f9; 8d9c07ecea3e16411fd4a40e9c08c691ebdab966; 9bee26242ed7dd5c10cebe4c768f042efb83203d; acea062b00bd2f099500837a36c160a8b7fa125c; da6dcd45f8d66874db5e10b7dac75bbc5ad158cf; 1cec162c42e827c1882f16f30158f2fbd20b5d3c; 5a933734175e1e92646f48934d80f23ed3658743; 975f1a2dc6cc10d8b56c074469dc076837a010e0; e96b2facaa2f3e64d12d20e267667e8738bc9bd9; 782fae54b8fe759215fd5c3ea3aea86b05b31fc8; 92fe8bc5f0814094ae9ea415590be7561f3fa58e; 77004cfce0882ab2b0610e776a4e3a7f64faf84e; 6a9403de320bbfa364fddc90413544324bbc91a2; 83ab5cf89399bca5449f4a7baf1b1b3c2e1178c7; e58d9d7d28d035b82d135722dafd486008273d44; 99f819ba10fea0ea659cf02347f406cb69fcab61; b8577be05c964fdc5590e2ebbda273d24da05dc7; d41e180011fd39a1b3f0da3c0ef633ae917e7e69; 6d4107d1fecdaadc4f4dd5f4cc030ab05b0cde30; 4c98183e077634a5fe136e1af3a585ab4d00d617; 9954675200f65c6ae50fec36a380e60194ec7c84; 29decdb46ccba0d48eea5104612856a129142fea; d7f81902330c8b4c19d5905264531c3627299ff6; ab3ce1f6f651bdf68235b093745dd200fa496256; 48d56083c966cdb50e36797bfae60973e05254e2; b920f18f65d2604d4c28bc1552627ce7e3af9921; 085f2c9e4b801a2d0a665a47c0894e533eb2dcb4; a6d33daa0e093a50b1b58e3aa34191c4b5acda92,Frontiers in Oncology,9,
13d33f65d650bbfe155783ffb92fb7a61ccfb927,Prediction of Quantitative Traits Using Common Genetic Variants: Application to Body Mass Index,"With the success of the genome-wide association studies (GWASs), many candidate loci for complex human diseases have been reported in the GWAS catalog. Recently, many disease prediction models based on penalized regression or statistical learning methods were proposed using candidate causal variants from significant single-nucleotide polymorphisms of GWASs. However, there have been only a few systematic studies comparing existing methods. In this study, we first constructed risk prediction models, such as stepwise linear regression (SLR), least absolute shrinkage and selection operator (LASSO), and Elastic-Net (EN), using a GWAS chip and GWAS catalog. We then compared the prediction accuracy by calculating the mean square error (MSE) value on data from the Korea Association Resource (KARE) with body mass index. Our results show that SLR provides a smaller MSE value than the other methods, while the numbers of selected variables in each model were similar.",2016,Mathematics; Medicine,"list(name = ""Sunghwan Bae"", ids = ""49161908""); list(name = ""Sungkyoung Choi"", ids = ""48919402""); list(name = ""Sung Min Kim"", ids = ""48388436""); list(name = ""Taesung Park"", ids = ""144903092"")",8446d9c30f1df17985cddf112aa063eec93a000d; 0aeacf6e44d3d4b9a05da529cbc599d70eec7f99; 320da49f3b2f59149b20e316adcaabe41c322f56,e908660e625ebeb52149ac3aaf3897f17895cb9c; 153bb30ba9e71c5ccf059fc246a26297a8c70ea7; 59a45558657e93aed40a2f5c73bbd50a8d76dda0; acee53b365a82a7c9fe106f4f50e0ddad3c56f01; a341759dd4c81189ec4894fa64deed03aa78a6d5; b2d8a0dee043cc644c1432e956ecae9ca447f62e; 12e8f7a076e2152da12c2d96d8757ec34e5c232a; 205ddee967b919460a6ce078dc2220074f13de27; 6ef499791516f6e87874736f1ba2b5c50bc2d733; c9f5723859a665c3e54b8d9a1a7eecb8b5084af6; 2861ca95e97a4a0447b575a910033edffe93d934; 0870f87694efed0d1bb6d74b00fb4188a36bb95d; c8c66af8271d17092b8e2fa575d6e129bc06a564; b0782d4f0dc197269cea37f255bf350711f4d24d; 8357d186cf234fa8fb0a788ac965c76ab2ff1d58; 5be45dd93c6d4fab988f398c193f7e46769e2864; 7c9c96531aae7afc6bdfbcb1a6e03b20d779a17d; 167ea16a581a86ac31d1e88b93ee835aff43f038; 5924944a87e77c4f9e6cb7e28bc548eacd332b83; dbc83fbe6a1832e3a93a869c9aa1cad5340c4d6f; c2f088d74093d15285e9e650e41e0bbb5b26f18f; 000551662c3902ed66709be879053d95dafc0211; 565949a972d45ff78f810e1155f44dcfb002816c; 4ac24482fee0652d3d83ca8a30477004a3d180df; 0a14824290453b95d051ec9cc299d0f61ad82b23; d6189989ac587f0296e0d65e51faa18db947affb; 74a6c8ffb2995afce8adb5c8ef353402a914267d; b365b8e45b7d81f081de44ac8f9eadf9144f3ca5; 448b0aca601347406abbfc31b204a942fd4840ae; 4fdf29d56a87362cb246f625694aa75af24f046d; 1ed28ea5bce3b6f9f61f40c16fc24881ad985ecf; 11c79fe40c9cf6da7d4b2580411d854c07830acf; b16ab29b461cc87e76d13fdefb5bf652b64cc44c; 6122f1e84c0dab96dc6b31659c29524f8b6f1e66; 94786d1c65764b0f7f73c76597caa7205ac0ead4,Genomics & Informatics,14,149 - 159
f2edec22b93f3c6e05c5eecadcfc30d3e6ebab64,A combination of tumor and molecular markers predicts a poor prognosis in lung adenocarcinoma.,"PURPOSE
Whether patients with stage IA-IIA lung adenocarcinoma require conventional chemotherapy is still a controversy. An ideal metastasis risk prediction model in lung adenocarcinoma is valuable for determining the prognosis and giving timely, individualized treatment.


RESULTS
Analyzing the clinical cases of 153 lung adenocarcinoma patients using an Ï‡2 test, Kaplan-Meier survival curves, and a multivariate logistic regression analysis, we selected the most valuable factors for determining metastasis and constructed metastasis prediction models. We confirmed the importance of the tumor markers (CEA, NSE) and a molecular marker (CAMKII) as independent prognostic factors in lung adenocarcinoma. The result of a five-year survival status was significantly associated with CAMKII and CEA (P < 0.05). A nomogram was created using CEA, NSE, CYFRA 21-1, and CAMKII to estimate the metastasis probability for individuals, specifically, 78 stage I lung adenocarcinoma patients were used to verify the effectiveness of the nomogram. Using machine learning, LASSO selected the subset of variables that minimized the predictive error of the outcome, including CEA, NSE, CYFRA 21-1, CAMKII, tumor size, histologic type, lymph node status, smoking, and age. A ten-fold cross-validation showed the average accuracy of this model was 86.208%, with an area under the curve of 0.857, a sensitivity value of 0.840, and a specificity value of 0.873.


CONCLUSION
Using both complementary methods, the predictive models illustrated that the combination of tumor markers and a key molecule to predict the prognosis of lung adenocarcinoma patients in early stages is valuable. The postoperative transfer rate of stage I patients can be effectively predicted by these complementary methods.",2019,Biology; Medicine,"list(name = ""Changxu Liu"", ids = ""50557153""); list(name = ""Qiujuan Huang"", ids = ""19218856""); list(name = ""Wenjuan Ma"", ids = ""51126656""); list(name = ""Lisha Qi"", ids = ""2102326""); list(name = ""Yalei Wang"", ids = list()); list(name = ""Tongyuan Qu"", ids = ""40631934""); list(name = ""Leina Sun"", ids = ""8222940""); list(name = ""Baocun Sun"", ids = ""88979645""); list(name = ""Bin Meng"", ids = ""50785318""); list(name = ""Wenfeng Cao"", ids = ""35691619"")",,cf0bbec51d92685d9b3d653c546702e6554e1b08; 84dd37acdb1b3649aa0cc59921667998f36999db; 94283d259a506af9a4afd2a5fb8cb495ed01b64e; 29760591ab845a13b7b3a48ae3a2d655e5cad895; 01f42bf3e17ee4132d0ec2c9745821f08d252848; 9c19979aef72564331f76b37e09f255baa4c2bfd; 72ef592376498f392dbe5c795e27b3faf1781587; 7880344093c6ee65d819507cf1a1ce742e5819d2; 95274ca3be569765960464d24f898c6fe025bac9; 820f9d8a56159ba1d89acf3699d4c3790709a96c; 523b6246febf860709411adb121e9771afec72f8; 6565f08745e6d690558d6020cb17aaf7ac344d11; d54afe837b2e04c048d6498213db91cbcb950644; ccccecc5fce66d2c092943c3cbd90765f7a19c21; ebe14ab38c7bc8187737c8aed7fef3d7cd2becf7; 7eb3a336bcf4aac970f4c5ca7e4cdd61cffb3903; 2c1469af5db589e4461e4e033aff61a637b400b5; b0e0b48443eb622a12ed07ff466fbc44a3592784; be4344ff851dda9699dd9692a2f8c2cf407595ab; 85de00892107eb4ab4bacf638b9107b87af3ea2c; 7e7b9f37ce280787075046727efbaf9b5a390729; 4ad48f9ef51674689100858c7fdd39773ac0522d; 7d4a021ec5efcb5e0404cf58cd0128ada47d68ce; 2f71661f3838b392a11bc480927a21b43e8ab12e; 5d45247ce802f6af86a72db291897ed5f58e51db; e8000a9e3769eeae43c52e925b3f063d837f5888; 1a8c6f7b0638449a49de89e51a6600627d22b25e,International journal of clinical and experimental pathology,12 5,"
          1690-1701
        "
25a155d85a4fd66de6ed027905abcff49d0628bf,Multimodel inference for biomarker development: an application to schizophrenia,"In the present study, to improve the predictive performance of a model and its reproducibility when applied to an independent data set, we investigated the use of multimodel inference to predict the probability of having a complex psychiatric disorder. We formed training and test sets using proteomic data (147 peptides from 77 proteins) from two-independent collections of first-onset drug-naive schizophrenia patients and controls. A set of prediction models was produced by applying lasso regression with repeated tenfold cross-validation to the training set. We used feature extraction and model averaging across the set of models to form two prediction models. The resulting models clearly demonstrated the utility of a multimodel based approach to make good (training set AUCâ€‰>â€‰0.80) and reproducible predictions (test set AUCâ€‰>â€‰0.80) for the probability of having schizophrenia. Moreover, we identified four proteins (five peptides) whose effect on the probability of having schizophrenia was modified by sex, one of which was a novel potential biomarker of schizophrenia, foetal haemoglobin. The evidence of effect modification suggests that future schizophrenia studies should be conducted in males and females separately. Future biomarker studies should consider adopting a multimodel approach and going beyond the main effects of features.",2019,Psychology; Medicine,"list(name = ""Jason D. Cooper"", ids = ""123197133""); list(name = ""Sung Yeon Sarah Han"", ids = ""39991160""); list(name = ""Jakub Tomasik"", ids = ""1894575""); list(name = ""Sureyya Ozcan"", ids = ""47937808""); list(name = ""Nitin Rustogi"", ids = ""8208681""); list(name = ""Nico J. M. van Beveren"", ids = ""115168213""); list(name = ""F. Markus Leweke"", ids = ""3231443""); list(name = ""Sabine Bahn"", ids = ""1713917"")",53fa1faea4533d2ea2cbf630288fdc16ff32d2a4; 73ec6f937a4d968c5c52345edbcc92ecfa385fd5; d8165075000138e9895fa198300f0873954f88eb,003aa796666b28cbc66f7bebff078e712bff09bd; 659408b243cec55de8d0a3bc51b81173007aa89b; cf99fcb15ac18cfaf852a648081a2bf79af71967; e0d5dead2d35b5391ad4f46fcea789f005d37b05; d98ef875e2cbde3e2cc8fad521e3cbfe1bddbd69; 767557b5d54467fd6051db172cdb729d2cfd8932; 53b0343422c7979a1d08410d4156734096f06b3d; cf8f764132858ce94853ea4e127868b07113ad32; 400b45a803d642b752a84147ef547af7811e8f3f; 955fe5b0eb5e9fefab7bf21dede20e1285dca410; 88d800051e1034645038425e3729e74d47f94d21; f74f5f6abe2fb01372aef57d0830cfbcbef68b4e; a07596bb687dcab45f3da5e1137fb95c00f2fa6c; 14699ffaebc6c2423824d8ff1466c6236733bf12; 9bea108c81919453a5774bfdc3586a4e03e52338; 61f65e92251e6f93d7659dad9adb3bd97a37b221; 3a6e7d3053fd5c8c53d61835d82caae5cdffa9cd; 4e845b9780595ff9f18e0ae1d99459253ae3d2b7; 45e55e460864ac2c9639d7a673406fa64f6751a8; b365b8e45b7d81f081de44ac8f9eadf9144f3ca5; acc25ae7324f57225a642f0b0c97ccfbfc56da62; 2fe6832cfc74c18cac79df56ae6d80ccef455f9a; f0906d4933d268c129670059d686e3ceeb7f6e2b; 7a5daa88d200ffc5d1d986f54c1ace30938b13d3; dd0f6a4c54f8539a7b45795a52d7b3734aa491fb; 5d2bb358ebdd274be895e325b3237d8a0dde15dd; 140e28b488407e4c52bd3b201c44f1f3e693d241; 4e4812c79144c2bedbcc1f5f6a04c12f683c10a5; 977fa8d2eee01f82670eeb00a50d881d0f80df77; 5e4698cd7acb8eb17e7234e3aa617c2cbee858a3; 163d61769f18644c784f275c939c7bb6dd896583; 1fdf98b2c4729bcca7e55b07f9fe0916ded91acb; f087cfb3a35a9d9f2a23658ff489dfbf5cb7f6f0; cf1bae03e1bc884b30c746b3216968ed4cd0986c; 70ee44786510db7c361aeaab6f37cc008bc9701e; 96ef799148b63e2f4399cb454b1dd1b0c6836c3d; 5f0d3b6fa53c3e5e2d6ce0a26ede8a352b064067; 0bee95b1f79e78dad87bc2d5236e921291636d7f; 6db41626eb0c98a58da7346d88d2dd7c4ae9cbee; de5baf5d993991c669de3868e4199458ce9a0edf,Translational Psychiatry,9,
eaa487e4b66ee19ec89e162085eeff2d0f512902,Sampling Constrained Probability Distributions Using Spherical Augmentation,"Statistical models with constrained probability distributions are abundant in machine learning. Some examples include regression models with norm constraints (e.g., Lasso), probit, many copula models, and latent Dirichlet allocation (LDA). Bayesian inference involving probability distributions confined to constrained domains could be quite challenging for commonly used sampling algorithms. In this work, we propose a novel augmentation technique that handles a wide range of constraints by mapping the constrained domain to a sphere in the augmented space. By moving freely on the surface of this sphere, sampling algorithms handle constraints implicitly and generate proposals that remain within boundaries when mapped back to the original space. Our proposed method, called Spherical Augmentation, provides a mathematically natural and computationally efficient framework for sampling from constrained probability distributions . We show the advantages of our method over state-of-the-art sampling algorithms, such as exact Hamiltonian Monte Carlo, using several examples including truncated Gaussian distributions, Bayesian Lasso, Bayesian bridge regression, reconstruction of quantized stationary Gaussian process, and LDA for topic modeling.",2016,Mathematics,"list(name = ""Shiwei Lan"", ids = ""36247254""); list(name = ""Babak Shahbaba"", ids = ""2642138"")",8a13a443f6adb356ec66f761ddd9194642867cf3; 189361d0351ec63bbd4d01a20138d0524d602eaf; 4b25998d6eeb9a639454c2d34fd56564431f10c4; 94c8dde08e388e4297f127a95f987bdad6954ccc; aa8bf6a9f5f6eb2573c9e7ca009ef176992310b2; a2f4d34b9b8afbc50c1b0669d902e8f080a633a2; cd88af6c9b28635a7a1472a01ac2c09b4f36e364,4a7efd34691690c929d44ffa1458cea2bff865e2; b97f1b1f012031e63e30aa78ffea681b0607be53; 71ce231faec79aeb667d7c889d6fc203e2bb95ae; e1103d528d874a9e8e84ca443fe3fd5c1ff9eb9e; db8d4098b044ba3b3979bfa0fdc3da1c0d249fcf; c7a41ebb9a055e164926fb00efcbcafb40f0a16f; 53dc97756369cd1f9300116d6aabdffb7072f2ed; 43aaf314805d711a137343667f4da5ab3a305e92; ec8e5ea7c421b792871130cc1bd5e074602b1aae; df0c32c4165aecfdc9bb05f61dd43b6c2bad8545; 762cbbbeb46f0b1873cfe1dccb57a37da3a5af3e; f198043a866e9187925a8d8db9a55e3bfdd47f2c; 7a70d7ee172d8ec20754903be6114ca8daf16f7f; 4c3d7bb6bcaa1e49dab561f1a74f236a7d100d68; dd7bbdc9b0cb716b6f3b4a3b565cd6ed555708cc; f079272c3a16b30ae414a4511c64c211f5e64369; ac54930c7f076b881886f240a3d0e516c9a40c66; 86a03544946f617a1581b389e3c32f2d97867982; 8d5c21921ec62cb3518055a3c919a0c822b329b1; c8110bef6d1eaf5b8e028e000d5447437694b2ef; 617111ed3746c4304c87b188ba155b160e9f082e; 0a3873992669e8577a906149a81007cb13c70599; 0f96b0dfc3cc5814fee3ed1f7bcaf45db85d7d06; aeed631d6a84100b5e9a021ec1914095c66de415; 44a47ad4d90310a54667ebab01f300735334792f; 4278c990e87e8f39734701f8a9d2b742b5073f75; 5b458ee989583e9a6a67046ed9441e254a49b1da; 2dd91a48c0912392bba4c0c989bf383eddb609ac; 3f98645200078264ebad85c318d7c2b8f81f61f0; 0ee392ad467b967c0a32d8ecb19fc20f7c1d62fe; 3fc09565a661cb133ab39ae5f169a543ebedb60b; 1542fe458849b1ce26306f68200f6c71ae2ed147; 8fc339912ffc530550d9f03c65f01f4e0f5fefaf; 9a0afa390e05da8afbe949c2ea6f52c7acee0ee6; cc58edaacecbcc20b8a54ad4f68648415a7b974a; 00cf63a7926a826f7cf73c1d5edb117f98d70c2c; 502e8e0d8502ff9d8cbfc565d9360afdfb2aea45; e4f3ec8909370c2fc5b95d6697547837884d20a2; 2939c42d40b6a45fef2429ad09f4a348911d1b48; b365b8e45b7d81f081de44ac8f9eadf9144f3ca5; 7fe6e93cd6b6ea92dbef1e48be343dc00f437c1b; 785ede21535ff3a4ccc75daa990e45363db3a363; db869fa192a3222ae4f2d766674a378e47013b1b; a2fae29f914bdc555847e689bc91900c2256cb59; a88c4014da492520eceff8b359d981d6ef4b8e5e; d9a16fa2d1067d262c2ad43ce26ee6de0b7b08d2; 0c6b0171fe26bb84e89c244e1f859ebdf86e6e45; 693d3e45ec5077ffa01f343824a54ea64604e11e; c5cd21a41176dfaba5f602810a4c6808c4ff16eb; 1e918d01e7df34379525bd008caaeb547b878aa9; 5824669d4cb17ed933df829f381fefeadb2429f6; 2d8cbd7370b4ce666edd864e66f83ebf20963516; 6b7b53d80e1858df988306019fe97e75c9e76a0e; 75f063c9b32912f4b1b1f08dbcf6b0575ce16bf1; c61418a6a1308ed03acf52d0ad73f9dd71aa74b1; b3295bc1b2df23d0e01ab4c395a27a5a9a867625,arXiv: Computation,,25-71
