id,title,abstract,year,field,author,inCitation,outCitation,journalName,journalVolume,journalPages
c6ac0376a92aac44910fcd4ebd6f41ebf84d0424,Correlates of Adjuvant Therapy Attitudes in African American Breast Cancer Patients.,"PURPOSE
Black breast cancer patients delay and underutilize adjuvant breast cancer therapies; yet, very few studies have specifically examined Black women's attitudes toward breast cancer therapy. This study observed the influence of self-reported interpersonal processes of care (e.g. self-efficacy) clinical and sociodemographic factors and sociocultural (e.g. religiosity), related to Black breast cancer patients' attitudes toward radiation and systemic therapies (chemotherapy and adjuvant endocrine therapy - ""AET"").


METHODS
This was a secondary analysis of data from the Narrowing Gaps in Adjuvant Therapy Study (2006-2011). The analysis included 210 Black women who were newly diagnosed with breast cancer. Bivariate and multiple regression analyses were performed between independent variables (e.g., demographics) and three outcome variables (chemotherapy, AET, and radiation therapy) to asses women's perceptions of therapy type. The lasso method was used to select variables correlated with therapy attitudes.


RESULTS
Most women reported negative attitudes toward AET (56%) and radiation (54%); fewer negative attitudes were observed toward chemotherapy (47%). Higher education and greater perceived susceptibility of a recurrence were associated with more positive attitudes toward chemotherapy. Regarding radiation therapy, women with greater patient satisfaction were more likely to have more positive attitudes.


CONCLUSIONS
Our study findings may aid in the development of behavioral interventions targeted to mitigate Black women breast cancer treatment disparities. We found modifiable factors (e.g. communication, satisfaction ratings) that support opportunities for clinicians to better address Black women's needs regarding adjuvant treatment options. The development of tailored interventions for newly diagnosed Black breast cancer patients on patient related factors in health care are warranted for Black women with lower educational levels.",2020,Medicine,"list(name = ""Megan C. Edmonds"", ids = ""35547442""); list(name = ""Arnethea L. Sutton"", ids = ""35777023""); list(name = ""Jun He"", ids = ""1472927078""); list(name = ""Robert A Perera"", ids = ""1902907""); list(name = ""Vanessa B. Sheppard"", ids = ""3445003"")",,,Journal of the National Medical Association,,
1513ca17fcbf21e5e26ea50ab9f739643387787e,The degrees of freedom of the Group Lasso for a General Design,"In this paper, we are concerned with regression problems where covariates can be grouped in nonoverlapping blocks, and where only a few of them are assumed to be active. In such a situation, the group Lasso is an at- tractive method for variable selection since it promotes sparsity of the groups. We study the sensitivity of any group Lasso solution to the observations and provide its precise local parameterization. When the noise is Gaussian, this allows us to derive an unbiased estimator of the degrees of freedom of the group Lasso. This result holds true for any fixed design, no matter whether it is under- or overdetermined. With these results at hand, various model selec- tion criteria, such as the Stein Unbiased Risk Estimator (SURE), are readily available which can provide an objectively guided choice of the optimal group Lasso fit.",2012,Computer Science; Mathematics,"list(name = ""Samuel Vaiter"", ids = ""3310559""); list(name = ""Charles-Alban Deledalle"", ids = ""2262533""); list(name = ""Gabriel Peyré"", ids = ""145481009""); list(name = ""Mohamed-Jalal Fadili"", ids = ""144812306""); list(name = ""Charles Dossal"", ids = ""2219084"")",c98ee6aee15ca6ad970cf327014a61caa74763e8; 117fddad6bcc1468ccafe89c17dcf37084640b13; 5f18458702e8b0dafa59edcd4e4e2c7981d95cab; 49d3e667f10adf685a015616a0909a26b183aae7; ae97f77b3c2d72c23b37d8bcd5a749265ab38b2c; e6ddabdb165d1ce85a8b80f826e4e84d82128aa7; d68fdcd96cc4b9414d57a3f7217595490daf484b; 38302b2a351e1588157f602eb852e45c8c31dd55; f64ab233c40d37a5fd4dbdd57374be69173b7cf6,d98ef875e2cbde3e2cc8fad521e3cbfe1bddbd69; 8a501aaf2c52210eea45e1786b41233d6b62c774; cc2d97b32aafa46184440d81b2b37eac703db796; 3424286d6d39de51080ddd683646565545d015e2; dcbfed708df1ea92ce3b01fc12e3f01e6ecdbb10; f603e9476b6613e4f36c5848902a17b3af19e1cb; 5db89746b77118f1f6c65f2b47d4074bcba55fa9; 021bea68871304493cbb68ebdd91dba4d0155bab; dc423c0563ac6c80ae8af840c8560438644a0e59; eddb3766525ad09e831933782f9d210e15449065; bb92178d5133f9165b704500cbe2e5a1b2dab01d; 9ce8189786118f5795779d894307e6752f90d95e; 61f53054eecddcca3f78915e70c62aa80af1ec8f; 400b45a803d642b752a84147ef547af7811e8f3f; db31973871f5648cffb02e7590582376e16ad0bb; 77f4f0f1de8e80afc0fe0591ddd4bf3d52098329; b365b8e45b7d81f081de44ac8f9eadf9144f3ca5; 8d647886ad63f37bfc671c19c2d3b70e995adb89; bc14819e745cd7af37efd09ea29773dc0065119e; abc45baef4cd2d66bd8b069ef74726bc08570047; cbaf5ea0b865bcbecd0d3ce59866332051a01422; e9133969c2fa2113948a2698a3f5ced97e219781; 7e1ce7efcb0fa493d19feb8333c76293410ce90f; 5214b65ed56efffd97493a59114a772dfb54caf1,ArXiv,abs/1212.6478,
eb71e97211842734f9b651200dec92c838e15c9e,Variable selection via nonconcave penalty function in structure-boiling points correlations,"A new variable selection approach based on nonconcave penalized least squares is employed for interpretation and prediction of boiling points (bps) of 530 alkanes. The good performances of the proposed method, compared with stepwise regression and the improved least absolute shrinkage and selection operator (LASSO), along with its simplicity and fast speed, makes it a valid competitor to the existing variable selection methods. All the 530 saturated hydrocarbons with carbon numbers from 2 to 10 and 128 common topological indices are taken into account. As a result, only 12 topological indices (TIs) are selected from 95 pretreated ones but they still present a satisfying fitting and prediction effects.",2005,Chemistry,"list(name = ""Xiao-Ling Peng"", ids = ""2575128""); list(name = ""Qian-Nan Hu"", ids = ""1788677""); list(name = ""Yi-Zeng Liang"", ids = ""2325966"")",,,Journal of Molecular Structure-theochem,714,235-242
b9b6656ff04168273a094f562f27b00ca0ec1169,Predicting Suicide Attempts and Suicide Deaths Following Outpatient Visits Using Electronic Health Records.,"OBJECTIVE:
The authors sought to develop and validate models using electronic health records to predict suicide attempt and suicide death following an outpatient visit.


METHOD:
Across seven health systems, 2,960,929 patients age 13 or older (mean age, 46 years; 62% female) made 10,275,853 specialty mental health visits and 9,685,206 primary care visits with mental health diagnoses between Jan. 1, 2009, and June 30, 2015. Health system records and state death certificate data identified suicide attempts (N=24,133) and suicide deaths (N=1,240) over 90 days following each visit. Potential predictors included 313 demographic and clinical characteristics extracted from records for up to 5 years before each visit: prior suicide attempts, mental health and substance use diagnoses, medical diagnoses, psychiatric medications dispensed, inpatient or emergency department care, and routinely administered depression questionnaires. Logistic regression models predicting suicide attempt and death were developed using penalized LASSO (least absolute shrinkage and selection operator) variable selection in a random sample of 65% of the visits and validated in the remaining 35%.


RESULTS:
Mental health specialty visits with risk scores in the top 5% accounted for 43% of subsequent suicide attempts and 48% of suicide deaths. Of patients scoring in the top 5%, 5.4% attempted suicide and 0.26% died by suicide within 90 days. C-statistics (equivalent to area under the curve) for prediction of suicide attempt and suicide death were 0.851 (95% CI=0.848, 0.853) and 0.861 (95% CI=0.848, 0.875), respectively. Primary care visits with scores in the top 5% accounted for 48% of subsequent suicide attempts and 43% of suicide deaths. C-statistics for prediction of suicide attempt and suicide death were 0.853 (95% CI=0.849, 0.857) and 0.833 (95% CI=0.813, 0.853), respectively.


CONCLUSIONS:
Prediction models incorporating both health record data and responses to self-report questionnaires substantially outperform existing suicide risk prediction tools.",2018,Psychology; Medicine,"list(name = ""Gregory E. Simon"", ids = ""144839706""); list(name = ""Eric Johnson"", ids = ""145829059""); list(name = ""Jean M. Lawrence"", ids = ""3492377""); list(name = ""Rebecca C. Rossom"", ids = ""5214503""); list(name = ""Brian K. Ahmedani"", ids = ""3785545""); list(name = ""Frances L. Lynch"", ids = ""3157892""); list(name = ""Arne Beck"", ids = ""35544109""); list(name = ""Beth E. Waitzfelder"", ids = ""4613456""); list(name = ""Rebecca Ziebell"", ids = ""3586516""); list(name = ""Robert B. Penfold"", ids = ""1726424""); list(name = ""Susan M. Shortreed"", ids = ""2278681"")",5eaff2fb91a3d97f8997242ce7f50251ca19eb21; dfe17a2d2e7e6e707acf38c7429b3125f14666f8; 6f31ab627077673789c40af9f13f2286f64c4ac2; aa03af50c9bc84b64f02dd9af8e553ee4e59e96f; b42bb3e079d3aef541683ac3333b65928f8ba4a4; 4242a1637d3f8a3f305921b077833dc9ad3a8332; 6eb62ac4139625cb4c4431d0e3672af54ecdcada; 9e0d8f154b1f44bc50de2a2507d172d26c6b41ff; 96312140d3385ca53f2951afbf9e720cfcf37c8e; 1050a510295776d78e42d95e1afbb5afcd380f5d; b8b28443f7ecfbc0885d0ea4065684123c6ab588; 2e66829470845312c4ad0458da3d5eecc0011f11; 856cac00c2ea7693b2b485bd94c632679a11bb10; 59967b4f56f83ff2863d9d776e27f804ccfdb955; 0fedc892cfb7641db1004b969f7657783b189500; 0f2aabd76d6ee65329633556ed027e4b475da13b; 633f0a2aee6b4078d9d2d870bfdcd08f3a4deb39; 30a7fb4b5f19af9ae49fcc6e03674f0b8e90ace3; 59342a76ea2d7f7541c0376d6fd221b695624932; d8bfd8e9996ceba69ace396b763ea5dac0777a6a; 35b11cbb2ac71c377862a6a651b0ee8812e00cf5; 8bfba23cbef5da2dc790e9510bcfd872b927d01f; 4228b921367533033aaaba35f871981cd9778878; a552e80da245eae78462d5acb7aa04f361358ea1; 1a140afc0e5f60b36b8ce0edd874e12ffc78c7a4,,The American journal of psychiatry,175 10,"
          951-960
        "
5515a6a179301401ba5c3c38d497d05e904244f6,Quantile regression: a penalization approach,"Sparse group LASSO (SGL) is a penalization technique used in regression problems where the covariates have a natural grouped structure and provides solutions that are both between and within group sparse. In this paper the SGL is introduced to the quantile regression (QR) framework, and a more flexible version, the adaptive sparse group LASSO (ASGL), is proposed. This proposal adds weights to the penalization improving prediction accuracy. Usually, adaptive weights are taken as a function of the original non-penalized solution model. This approach is only feasible in the n > p framework. In this work, a solution that allows using adaptive weights in high-dimensional scenarios is proposed. The benefits of this proposal are studied both in synthetic and real datasets.",2019,Mathematics,"list(name = ""'Alvaro M'endez Civieta"", ids = ""1402910906""); list(name = ""M. C. Aguilera-Morillo"", ids = ""1402010759""); list(name = ""Rosa E. Lillo"", ids = ""2772744"")",,a2893118e14c29a23472b02249b4641b9971786b; 7c69172ef03e1c70de7b3dac6298b935a13c5dd0; 58db9852fedd50a4732e3c174383710422c32ecc; a01ecc4db6468755db9b09e73e535f988073251e; c09db7439505f49a0958f68e782df94b3807341a; d98ef875e2cbde3e2cc8fad521e3cbfe1bddbd69; f8d141f258e92fe25f17dd812cce535dc099265c; 5565df5479f0b470aa19389973e22e86fc8783b1; 2199cc2f0a5dd4dcc50e09c2a7531ea5ee6cb90a; 29ca74c4149f84661bbba2d4282021bceae31379; e5ffaa4d7752d55cc5cf76eed1fec267b2db171c; 70cec17c85682bf90744100744c5777fbff844c2; 6050e8ffdc125f7bb9fc56da18c584a44336425d; b365b8e45b7d81f081de44ac8f9eadf9144f3ca5; 3e1c7f27763c6400010d81074df87c0e2ccdf83f; 3aebbdeda5b0547e9e41fbf1b73aae308bf8033d; c4fda00b0abee9b9a18383fcaa36bdcc19d9e39d; 3979fb6d3962ef72e063102f3105dafd1409e83a; 87a433c972510fd7d462f07443182253983ab998; 5f0d051ffcbde45f92daee6395883cd476777ad9; b85902e1382a799b683c3907f57c896c9497f1cb; c8430c5d13834e46631960469d86f7ed4577b0e2; 74227090d23c958f601ad05369fad587e3b546f1; e177365c0dd642341469ba2f045405646c5dbb79; a7ee0b46d43b4b72c5e7bc35c0805dac5630c7b1; 829b659f96771f2076ab325b1202b26085b300b4; 2f29f896deac1d8190f9474ac268b42eca010804,arXiv: Methodology,,
7f719980b8cfc9b466ef460dbdb6947a83a3a19f,Genomic prediction of breeding values for carcass traits in Nellore cattle,"BackgroundThe objective of this study was to evaluate the accuracy of genomic predictions for rib eye area (REA), backfat thickness (BFT), and hot carcass weight (HCW) in Nellore beef cattle from Brazilian commercial herds using different prediction models.MethodsPhenotypic data from 1756 Nellore steers from ten commercial herds in Brazil were used. Animals were offspring of 294 sires and 1546 dams, reared on pasture, feedlot finished, and slaughtered at approximately 2 years of age. All animals were genotyped using a 777k Illumina Bovine HD SNP chip. Accuracy of genomic predictions of breeding values was evaluated by using a 5-fold cross-validation scheme and considering three models: Bayesian ridge regression (BRR), Bayes C (BC) and Bayesian Lasso (BL), and two types of response variables: traditional estimated breeding value (EBV), and phenotype adjusted for fixed effects (Y*).ResultsThe prediction accuracies achieved with the BRR model were equal to 0.25 (BFT), 0.33 (HCW) and 0.36 (REA) when EBV was used as response variable, and 0.21 (BFT), 0.37 (HCW) and 0.46 (REA) when using Y*. Results obtained with the BC and BL models were similar. Accuracies increased for traits with a higher heritability, and using Y* instead of EBV as response variable resulted in higher accuracy when heritability was higher.ConclusionsOur results indicate that the accuracy of genomic prediction of carcass traits in Nellore cattle is moderate to high. Prediction of genomic breeding values from adjusted phenotypes Y* was more accurate than from EBV, especially for highly heritable traits. The three models considered (BRR, BC and BL) led to similar predictive abilities and, thus, either one could be used to implement genomic prediction for carcass traits in Nellore cattle.",2016,Medicine; Biology,"list(name = ""Gerardo Alves Fernandes Júnior"", ids = ""4262607""); list(name = ""Guilherme J. M. Rosa"", ids = ""145541034""); list(name = ""Bruno Dourado Valente"", ids = ""2928761""); list(name = ""Roberto Carvalheiro"", ids = ""2819532""); list(name = ""Fernando Baldi"", ids = ""48496257""); list(name = ""Diogo Anastácio Garcia"", ids = ""46734772""); list(name = ""Daniel G. M. Gordo"", ids = ""4435032""); list(name = ""Rafael Espigolan"", ids = ""4717943""); list(name = ""Luciana Takada"", ids = ""39195344""); list(name = ""Rafael Lara Tonussi"", ids = ""6576729""); list(name = ""Willian B. F. de Andrade"", ids = ""3646976""); list(name = ""Ana Fabrícia Braga Magalhães"", ids = ""37592451""); list(name = ""Luis Arthur Loyola Chardulo"", ids = ""3578013""); list(name = ""Humberto Tonhati"", ids = ""6786685""); list(name = ""Lucia Galvão de Albuquerque"", ids = ""3647395"")",fb93c61e8dda1df9d95c46a3c8ded7db6aac0293; 65706e549b4180b05d026b2cff5139265e05200c; ce4e43a0d00cbc1085eabcaa0e25e64548ddbe41; d7b26a3d7b8496a440ae84e242067115700b4e71; 7e4cf02f4524a73b84e7fdc7606d9de8d4c41911; 05f2f53d7ca817d379bb1442c112cfb8eedfdacd; ada73783b64f9114ee10052282c7374fa4c31bb7; c475097008be009990d04b68e3c11ec58085f480; 316832a7c4459e37b9ed42796c2c2578a9d581da; 7b0e721c00770e8bddec1d4a0973c25b3a6aaad2; d1b536b65994ab1c7fda169d6ce9e948e37eddba; 9c05e0cb7a70a12a774d1f8940d227257c4f043e; 5394ee6061f5ae2e225ac8e721702445e6035b73; d0fcbc2a6691efb08fb2ef6bd34c3905e6730274; 1f3f8c4f7dad4ea89a503051fdf7296b3d83a3a2; 789c99e19b3713c86501b68cd01df86131ce2ceb; 5eb7b61d37baac6725ff771ef91ec351c3dc3d3e; 739c03184b12acc90b4338fc19d867df716693f6; 7ce40199bcbf0d95d9a3392be436c8ea7780ec88; cf0f1ebc3b1fed820ec7c894fb0c1bafc3e2c797,225cac6e09449814352010fda578f5622439d580; e05e1312133bcd23b3912ac5b48649ae6a0f2e6e; 605916c8833f6bc8a49168ec77eed746cb93d954; 8a9260489d11c73d4a20a31b77d5d1a5f8ecc1ce; cd3feaa37dcdd768cc68ec261471a40e18fa3a4c; bd6e45caed04286a115e1a20a0f8bce30fc9c451; a543347de2ab10e191a1130c04d88e012f4bca21; 381a1da6f3f4afe5267ee9f991cc23472e8451e3; 43ab2cdb48b48208cb525a190ad02e5ce1df0795; 1c8aa5b42e0945eb7fc12b7ed976ad909887fb62; d2b6c9aafd5e40b19ca72a6ea4b63381a907fa21; 341691ea16578696fea3c8e5ee2e8b92d06d2e23; d195789c60ad1c27c7c4ae1255c1e1049b5b8661; 7bc099b8460c396a626a786d2943a1b74bc4ea0f; f1451484623b8b1aff5c9dfc8e475227f508bf71; 88dd1bb70841677dbcf8dff72ab101901e8d16b7; 4ea0fbf652cbf0756b024098b1d1751d57c4164b; c21539c7c83b825b686f6ff2893771615856879c; d11b3e79111205910f04cc8dfdf8df847ddefb94; 9a3adeee5ed9ec5615adb1f1e7471d6c0ad3be13; 69cceaa84994b12f56824cb49d89e8ef20f99a78; 7bd6cc55ecbfe1b27838ecd441e8fb2c5f29ae67; c09721259b90541e033ce89969b126363ee13246; 93c2c099c045dc09182716bd5e188df54ae20e2b; 3c0ce5393fb633c0c899ca5683b20619da6e3f9c; 8de0f4d3168750a2509a7ef72131e055aba4c674; 1feed4c04feb607d28fd653b7020baf9c5b612cd; cdc2e0bcd7ce4813fea69934c7613395633f01e4; f34b3128580ebe6694cb20a009c2f24031d20e63; 007b0653011777421ff2506259740e5a67c29eed,"Genetics, Selection, Evolution : GSE",48,
744eb4cbd3f4cd26030fa2a1dda467e23157dd4c,Urban Distribution Grid Topology Estimation via Group Lasso,"The growing penetration of distributed energy resources (DERs) in urban areas raises multiple reliability issues. The topology reconstruction is a critical step to ensure the robustness of distribution grid operation. However, the bus connectivity and network topology reconstruction are hard in distribution grids. The reasons are that 1) the branches are challenging and expensive to monitor due to underground setup; 2) the inappropriate assumption of radial topology in many studies that urban grids are mesh. To address these drawbacks, we propose a new data-driven approach to reconstruct distribution grid topology by utilizing the newly available smart meter data. Specifically, a graphical model is built to model the probabilistic relationships among different voltage measurements. With proof, the bus connectivity and topology estimation problems are formulated as a linear regression problem with least absolute shrinkage on grouped variables (Group Lasso) to deal with meshed network structures. Simulation results show highly accurate estimation in IEEE standard distribution test systems with and without loops using real smart meter data.",2016,Mathematics; Computer Science,"list(name = ""Yizheng Liao"", ids = ""4686487""); list(name = ""Yang Weng"", ids = ""2221471""); list(name = ""Guangyi Liu"", ids = ""2718270""); list(name = ""Ram Rajagopal"", ids = ""2515457"")",c90eadae5071681dce1e1e93325cbdca1d396da2; 8fd9f71d95e481d0fb3db5fdeeef0cafe6202a00; 4d3ba549c033902b3b5a42b0485695e62b8f68fa; 44f84247f3881d7b4671007ad357ae21a9166bf3; 27a7e900b22092ddc10fdc4da37c05290dd56862; c8ef115bab16c792a8c3e4ab411065c09e292875; 2190d239680ea48f49ac0769c2a332093089993e; a0915b6041be671a4d1f174fa7a36cd961f47a80; 018e8a9bb3337e5ba5a3385f5a4cc54b9f871c23; 5f4bbd10639a40674b9ca62e5cde12a48e892eec,d024f1a4185eeeb5f3553ce1a1128331dd2b44de; 00b7f44857676600805172e99be6f9f2987e98eb; d98ef875e2cbde3e2cc8fad521e3cbfe1bddbd69; 41a402c933f2372f5ada49b690c9de5ed7524025; 88d9ed51d8bf9c230052dcadad0b675588e46981; 6b63d7d5ee04993824014207e43c27708262be1e; f091b68db289dbe08d8483c4ecf47edf8a4b89ac; 58209c6db7b321ea7c75395b23ddb5100cd9bf81; 015cf476a95c0199e8a8a8e3dbd39d6571b9b319; 95fe4e7097ea525125fed22ecf8b68805aa7c2ce; 4f48b6a243edc297f1e282e34c255d5029403116; 7b4b6a3b9d19a1f57033d8642ca7b9ac97e94263; ec572c02fad95a319a29c2ebd18ae42790cd1b1d; 799258bc950a72840c98b09cbaa9e0ff0533b478; a03add746ebaea4be7261686beedf39b97ffc456; 636ede7021dd62dd4a21955e47ac6c2c95b19899; 5de14b7785fef13da6abb2e9defae999e4201f00; b365b8e45b7d81f081de44ac8f9eadf9144f3ca5; b11f836d7c3b682044d7305c7443b321834e1dc6; af045ba2db8869ccf27a5c19e3118d930a07973b; c7028d284b08e3c5aaf35ed8327b07c37b182086; bd9866d9230b72fde302fccdd6992bd048a12f12; 31c88a88c9603ec32b237128dec6feeb5713a5d5; b6d35f1d38abf86b0f2993910c845cbab6a01d36; fc52ce9c36dd675c6bc07606dd318cca1786f39b,ArXiv,abs/1611.01845,
