id,title,abstract,year,field,author,inCitation,outCitation,journalName,journalVolume,journalPages
8aff9c8a0e17be91f55328e5be5e94aea5227a35,Sparse Tensor Discriminant Color Space for Face Verification,"As one of the fundamental features, color provides useful information and plays an important role for face recognition. Generally, the choice of a color space is different for different visual tasks. How can a color space be sought for the specific face recognition problem? To address this problem, we propose a sparse tensor discriminant color space (STDCS) model that represents a color image as a third-order tensor in this paper. The model cannot only keep the underlying spatial structure of color images but also enhance robustness and give intuitionistic or semantic interpretation. STDCS transforms the eigenvalue problem to a series of regression problems. Then one spare color space transformation matrix and two sparse discriminant projection matrices are obtained by applying lasso or elastic net on the regression problems. The experiments on three color face databases, AR, Georgia Tech, and Labeled Faces in the Wild face databases, show that both the performance and the robustness of the proposed method outperform those of the state-of-the-art TDCS model.",2012,Computer Science; Medicine,"list(name = ""Sujing Wang"", ids = ""7489436""); list(name = ""Jian Yang"", ids = ""37081450""); list(name = ""Mingfang Sun"", ids = ""3028807""); list(name = ""Xujun Peng"", ids = ""8249814""); list(name = ""Mingming Sun"", ids = ""46611108""); list(name = ""Chunguang Zhou"", ids = ""8239114"")",a4ce716455906f3c6fad379e95313079360abee1; 832f1639970f1842f0457434987ebcbedfa778dd; 869513e775f2e27bfba8c771118e4304589ceb85; 9f480527dc20f292117bc5d863bcbecb4fb53cfc; 370315eca8ccab6caaf37d8bdf10073f244f165d; ecd10c99c033ab01d23447ec8026ac758fd99d0a; 8b3f6cbd296ee28c9154ec020b2df7ca6201b045; 6e73bb17cf29e8e79dfded2564e314b6265aa5a4; ad4dfd46c000fe83e6d143aaeaeac386a7bbe52a; 35b4b45a9a30496f7454f8a095a227c3ff6c06ca; 2557f53ab0dc9ab5fab8c68783e3943737665857; 8b1f697d81de1245c283b4f8f055b9b76badfa66; 58d6a11077d413d0e9c2a9c85592aabac193fd16; 37c5e3b6175db9eaadee425dc51bc7ce05b69a4e; 75b31454f9374db94cbb64bba7b05a862ff3e3e4; 9b6bbaa4e9c86f91df3f318d910fd44fb84355a3; 8a2f1350ef2ebdc7f9ce389e180e5dc1f8bee49f; de84971bde3c0a01d17a55aa321433bd9f1764e5; aba9acb4a607071af10684f2cfbdefa0507a4e9a; 888e6e6e7bf06a962e9737f591e18fb8620cb6e1; d554131d0f567779f929c39e3d9329b84f28e792; a8b3646ca0e98ba08a880bbbd4e63725651ec89a; fec3b4c089158d1920af1e59a8b2b979aaeccdfb; 70d80b230785fb830259abaaf29071b32c1806b1; a8b8cb0e769e72b433e0254f1eb4ac40320048b9; 04c86619d21cdcd55a82539559854bd746042f5f; 475e570d96916de7dff2e65ff231d63bf6f46462; 710c11be249e99ec15af16a3ddbd1e7cef63107e; c46759303c4922d6319faed14462751ec689752f; a2ca87ec37ffffe46c9e0f935d3dd94ae9aad535; cd66a1d08db3d56c91156797659b96dce8aa015f; 9fc65c248ba04279be91473b9e4103b31a65eaf8; 7308cd63101e5fbb60f7c7bb989a427b48ff41b6; f5461c8043da2f0f36c3d68ec15b2111c375b910; e2ece723e61dd8b922ff311d2eaa19f5228c8f84; cef58d5b3e76a2ee1c157a6b1ea3329dc7624e6c; a7f870847ca4c5f8dd832988f333cb4eeeaff95f; d7647391c9bd4528b44b47774107e64d090054c6; 9b0859544c570276a1ee85e26b1444569ab10015; 2f7ebb110dd7f683255f457a494e8838743755f6; 71b92af03c135d570a57c9c8766a691519822e27; 7fda3b7e173936bc8acbafc7f2963c10675939d8; d26008a00e95bfa0136a091514fe52eca9be9c5b; 4c99073a8a1d2f6c69a9a879c53c90d844b8abb4; 2ce5dbb12461e78ab923f04e6b8d3b90f2e639e7; a88160d691d31ad669aac6e527b08ea1b54da791; 9fb6f67d9d728d053558d76159fe76d51a627714; 7e2e27a533509eec986e5f6fac9f2898168f8323; e4695c8efb8fdb5923e868888ddb4b614a49c9e6; 8185be0689442db83813b49e215bf30870017459; 78034811e1d0adcaf88e3dc4d08ae1e03dbfcd94; 47caa516511a111b9dfd04f0eae55c6568bddb6c; ec440ffc63baa8d150a49c678d99321ad2455c14; 3e1212ecaba710a7ef1623a7024ee5936d4eee94; 746433b148d25bfbae9ecbc94e8db72580208546; cc2ec2040cff7e51690a2a8d7f03ae15b1606c51; 988d7abe1e0b074b58b0ca23354748f92c450fa1; 055112b0f2f06484ab3d48790812796ec2e4d8cb; 684e4df6271f40438f85ea2a9393c68d580a6e5c; 245e905f5cc934f528ceed040e522c03f535a814; 171bb932265385dd0d5bfc50502e098524000fed; eca4aa7238d232b108847edb62a49e38cdf8115f; adf44037d75e6aaa6e709c898a158b14b001f969; 93eda37ac8a2937f726cef4459ac6fd7b155ec4f; 19237fd84387378635ae135cc53ae934267addc5; ffaf667e76b6ca77eea20138f6a90c7e40b1ab03; 4f42346ad17a4e05bac7a4b3f96480900bd00999; 73b2c117fd3faaa3e03726c0583c02faa09111b5; c715b98ec2ba915fbfeabb50b7b4a669345c1542; 21aa3f60cb8f123732414755fc679895b7d95413; c638137dbc9ba80d5ca522f96f208187b699ed52; b824cdb86ed0b5c43d46a9811c170a661b4646e9; fb59467c40911bae27857964043f9d62f23b6f43; 9c3a25f7f8ac74cc3e5335bc06ce85f16edc13ae; aca57cd3f1f4edea9918814aabd0460c682cd56e; bf83ce4fb5884691989c8eccfcb6000515f538ff; 5c4f9260762a450892856b189df240f25b5ed333; aa4efbabbab87bfbdd5472dfb1b5f6b7965ea805; 0a41e1c0d0694fbaea107748ae1bd32d9c021a0f,55925b3a6ba9fcf9cfed966cb38e2bf5c008137f; bee570503aaa0ed5bc5dd4cf6aa742df0b5cef87; a311254f1296a2885c99b422301a8f868c3d10e9; 46904e968f51f626d10f88d788a26df834f570a6; 74d381155143ec50a2de65769f16e54708f886c1; a68bf8a497483dea1429230d8fb547ffbd2c6b35; 305e70add6d2fdbabc72b757c93e38b89bf352b6; a10d1783a1e8dc8746728e7a29ead80e783849fb; 6136d4e52a6ffd0b21ae85a36fd2e400af41ca78; 18ffc5e6914c894d92aff80b3c6931c2371b5b87; d5eec41043d91964879c4c745c7165f823967f29; ee18e29a2b998eddb7f6663bb07891bfc7262248; a6f1dfcc44277d4cfd8507284d994c9283dc3a2f; 6d96f946aaabc734af7fe3fc4454cf8547fcd5ed; 1c7c5595dc7a1f5d360acf5c360ca1ca49536ba5; 048bfc88b9f54512304433bb2eeb68a3172159a8; 3624ca25f09f3acbcf4d3a4c40b9e45a29c22b94; f1277592f221ea26fa1d2321a38b64c58b33d75b; 067db524b6d1e6ed3058826470a5e6a84b33b3fb; 2b11f435eaa58f141b050f3ab63279cc716507d9; c21ebd4b58737480899c8b36f0371eeb68b68e96; 029ae5240b472145661e65e818f54de0acaf8597; 33cdfe08ff0a088166cd8e2c09f46eb3e52b5bc5; d363d3343cb70ad757d472d80622e1a7c5982fd9; 75335244b49f4d1bb27aa51f1690bbefbbe1c3d1; c16bae6b2e578df2cba8e436e02bdeda281c2743; 65747ccbc558ba2ffb6c1726ce5808f0c5f81774; 87e43e9eba01a4eb03436c9946bf6aa031a5d5af; 3c989a48a59868c015415a91e55715105cbf1242; 221d61b5719c3c66109d476f3b35b1f557a60769; 6b8ec0cf3b54cda01eb55ab6005606f6e128a5bd; b8240b4b863aa1d9ed4fc9de17e58b65746c7221; 32c623d10ca7db45dcf897e9f614e1374bad74d0; 0025fc4f00c21960297fbdf83220d6bde75da645; 11ab5f214bd42c5880134b7dfd62e0aefd5f39c5; 274bc40268671fa3fff54d2ef89454b13fb026da; 7d2955d38fcac7cfedac525abe100779ad9de8bd,IEEE Transactions on Neural Networks and Learning Systems,23,876-888
f1a6b9507e7fb58019cade5ae58b73b0b1e88e85,PW 1593 Characteristics and risk factors of physical activity-related injury (PARI) among chinese undergraduate students,"Background University students might be relatively physically active and tend to experience physical activity-related injury (PARI) under the current global campaign to promote physical activity (PA). However, scarce is known about the problem of PARI and its associated factors amongst university students thought it has been firmly appreciated for children and adolescents. Objective This study, supported by the National Natural Science Foundation of China (No. 31640038), aimed to explore the characteristics of PARI and its risk factors among university students in two Chinese cities (namely Shantou, Guangdong and Jinan, Shandong). Methods A cross-sectional study was conducted in four universities, where 1421 students Year 1–3 were selected randomly and invited to complete the questionnaires during April and May via the one-on-one investigation after their completion of the baseline survey in March and April, 2017. Information of socio-demographics, PA involvement, risk-taking behaviors, and PARI experience in the past 12 months and its related characteristics were collected. The group Lasso and multivariate logistic regression were performed to identify risk factors for PARI. Findings Totally, 486 PARIs were reported by 289 students, with an overall incidence rate of 0.82 injuries/1000 exposure hours of PA participation. Most injuries involved the lower extremities, were newly occurring and medically treated injuries, occurred in outdoor PA (skating, football and basketball particularly) and non-contact situations, with sprain and strain being the major injury types. Over half of the injured (52.1%) experienced an inactivity period of 2 days or above. Significant differences were seen between males and females. PARI was associated with city, gender, study year, club membership, higher vigorous-intensity PA (VPA) volume, and antisocial behaviors. Conclusion and policy implications The above data reinforce the necessary of implementing conditioning and practical programs to underpin the injury mechanism to prevent university students from PARI and maximize the benefits of PA.",2018,Medicine,"list(name = ""Weicong Cai"", ids = ""29802790""); list(name = ""Liping Li"", ids = ""49192869""); list(name = ""Cun-Xian Jia"", ids = ""35654746"")",,,Injury Prevention,24,A177
d9a5b1a7e149ae8405d33caec89421f6021adf4f,Performance guarantees for sparse regression-based unmixing,"Sparse regression-based unmixing has received much attention in recent years; however, its theoretical performance has not been explored in the literature. In this work, we present theoretical guarantees for the performance of a sparse regression based unmixing (in short, sparse unmixing) implemented in the form of a Lasso optimization with non-negativity constraints. We provide a sufficient condition required for the exact recovery of the endmembers and validate it both theoretically and through experiments. In cases in which the condition is not verified, we explore the performance of sparse unmixing in relation to the exact recovery coefficient (ERC).",2015,Computer Science,"list(name = ""Yuki Itoh"", ids = ""144274505""); list(name = ""Marco F. Duarte"", ids = ""1888626""); list(name = ""Mario Parente"", ids = ""145813797"")",690de84b2f1108d20bd2f020e7e6ac1eaeaae730; 806f2144f622ed9732ed7b8ffaa464541eb5c9e3; 9666bcc07591037330f298a81c054656ae263fa5; d9a5b1a7e149ae8405d33caec89421f6021adf4f; 2306ebfbc79322eb494e3abd09e40b70ff463d78,2b07d0bfcbc64b8cefa2d5d7b84a3dd13b6d7b51; 7736e5662bd8702d2d76640885ad1712357c7b9d; c3ee93ee4d70da4a04425a723ee4dc2061b992c0; d9a5b1a7e149ae8405d33caec89421f6021adf4f; b830ba166a6c56706ae6299792f0894e4f36ca12; 6ffc3965342faf3be2cd73e1ea15ca2569a7dd92; f87a1219bc488b8a26add55670db9fb13547a0b2; 41f426e2dc5b4944148014d9c86d20fdd21dc968; b365b8e45b7d81f081de44ac8f9eadf9144f3ca5; e16e77ab199a10603384fa2b1a820d4dac0d28c7; 360bcd55143613770192013aecb1656a3e8129b0; a6f5c8d82f27bd68eb4cc40bc3d0b00fccc5d469,2015 7th Workshop on Hyperspectral Image and Signal Processing: Evolution in Remote Sensing (WHISPERS),,1-4
5f684d5a8bfd659bb2457eae775afe24d412bcdf,A Fast Em Algorithm for Quadratic Optimization Subject to Convex Constraints,"Convex constraints (CCs) such as box constraints and linear inequal- ity constraints appear frequently in statistical inference and in applications. The problems of quadratic optimization (QO) subject to CCs occur in isotonic regres- sion, shape-restricted non-parametric regression, variable selection (via the lasso algorithm and bridge regression), limited dependent variables models, image recon- struction, and so on. Existing packages for QO are not generally applicable to CCs. Although EM-type algorithms may be applied to such problems (Tian, Ng and Tan (2005)), the convergence rate/speed of these algorithms is painfully slow, especially for high-dimensional data. This paper develops a fast EM algorithm for QO with CCs. We construct a class of data augmentation schemes indexed by a 'work- ing parameter' r (r 2 R), and then optimize r over R under several convergence criteria. In addition, we use Cholesky decomposition to reduce both the number of latent variables and the dimension, leading to further acceleration of the EM. Standard errors of the restricted estimators are calculated using a non-parametric bootstrapping procedure. Simulation and comparison are performed and a complex multinomial dataset is analyzed to illustrate the proposed methods.",2007,Mathematics,"list(name = ""Ming Tan"", ids = ""144158096""); list(name = ""Gaoyou Tian"", ids = ""50720764""); list(name = ""Hong-Bin Fang"", ids = ""2729728""); list(name = ""Kai Wang Ng"", ids = ""37064360"")",ebae5eca3d229950b8171bd2c63849c553a0730e; 504d39896c7634405b23ce0cb723a41e6fc54530; c44972f46a220f24aaa468c6e3a499036340243d; 94cab329b366f172a36fe529d5570da5ec193451; ec6311555fd8a5d3f05fb0fc9ddc8cf7bd80a10d; c480a248c3493968be6aea01c81c1c08425ca5b3; 5403601c4a55f4b499cf601b2d5a1a84bd1b5006; 68da4ef3e5bf9596ce779daf9c895f67ad398574; de4126d67f88b54e6aaf0d07ea83cf587cbd34f0,,,,
140d8949dd4ab4e8439868644ab781a41e9875e0,Inferring Time-Delayed Gene Regulatory Networks Using Cross-Correlation and Sparse Regression,"Inferring a time-delayed gene regulatory network from microarray gene-expression is challenging due to the small numbers of time samples and requirements to estimate a large number of parameters. In this paper, we present a two-step approach to tackle this challenge: first, an unbiased cross-correlation is used to determine the probable list of time-delays and then, a penalized regression technique such as the LASSO is used to infer the time-delayed network. This approach is tested on several synthetic and one real dataset. The results indicate the efficacy of the approach with promising future directions.",2013,Computer Science,"list(name = ""Piyushkumar A. Mundra"", ids = ""1955645""); list(name = ""Jie Zheng"", ids = ""145627067""); list(name = ""Mahesan Niranjan"", ids = ""145387873""); list(name = ""Roy E. Welsch"", ids = ""2242562""); list(name = ""Jagath C. Rajapakse"", ids = ""3906447"")",cf492ab2d5aafbe83f4d1eaef2ec67a9b05b932c; b5ac4f4fe91f399913ba8f5edfa6db547a7a95c1; 248fe589b3c0614fcaee8142861968df606135b6; f19f9dc90c0d525a523f7af7ef2af40f196298be; a48e3473ed5de04b598e2804d81e796a94efb957; 6f3215db9edbfd27afcf3b6795dc3e4a32204478; 04f9eafa86ffec4e507c7c2da60d2fb6562d0d1e; 55b8290eacdca70074d7c9700438b5cc786ba66f; f5008cb8d5ce84a74975b1062f9f0c529206a482,dc7c1e485aafe150a8b3048e6c0c027b0ba05c6f; cfe94ff79f96dcb0badfdd6c6cfcddafea1a48a1; aee9709704f84defcf97d622b490eb662593d026; b7849493d1dac4e77718aa736b756165121503c0; 6798937191b32affdeb37f8ff333771a40e777c6; ecf64bbe466946e6f11b5439575df16431b3678c; b3293d47911043ba0b0b7e4b4d2111826763bc72; d9968eedc0e3b4390c38f80d1f928f1047b7a011; 3f8bab6ba811b5f705aee4dc60d081abf8abaf7d; 95fa89f33623a344d172b03520e0906c10dfe592; b674b59440ca29c09317493c8d4de8c2c3b52883; a18d78e6169ea26170c32677eab3cee4f28bd3a1; f8411fab18e37c54d0a7785d0f810e491b1f2a6c; 956d43b30629e6be5e8f2c4edb4cea2404598eff; c95f605c34eb8e08d80b4ed9ee662b35081f4c15; ab41e8f7451f3f0afd99f6b3c974d445c4f1e173; 98bdc2ae2546cf76c742f13daab3f3e17ef4e46c; 08bf201233e7a6703fe464c648d9318d8435a342; 0bec3c7739c0cf01d9e74a21da77ce0caa1002a0; 0e32911701180cfefca420e6daa58f17b09c61f0; fa8cdc1ca4d316f6123c8bffad98a0bfc9c34aef; 116640a15450721810dc02bb27f9c574c6a73a46; eae56089b15d02ebd8279a61cadb52742edf6dfe,,,64-75
c8d942334013c0a00ecc68c7156958c3f47b60b2,Cochlea CT radiomics predicts chemoradiotherapy induced sensorineural hearing loss in head and neck cancer patients: A machine learning and multi-variable modelling study.,"OBJECTIVES
Immediately or after head-and-neck (H&N) cancer chemoradiotherapy (CRT), patients may undergone significant sensorineural hearing loss (SNHL) which could affect their quality of life. Radiomic feature analysis is proposed to predict SNHL induced by CRT.


MATERIAL AND METHODS
490 image features of 94 cochlea from 47 patients treated with three dimensional conformal RT (3DCRT) for different H&N cancers were extracted from CT images. Different machine learning (ML) algorithms and also least absolute shrinkage and selection operator (LASSO) penalized logistic regression were implemented on radiomic features for feature selection, classification and prediction. Also, LASSO penalized logistic model was used for outcome modelling.


RESULTS
The predictive power of ten ML methods was more than 70% (in accuracy, precision and area under the curve of receiver operating characteristic curve (AUC)). According to the LASSO penalized logistic modelling, 10 of the 490 radiomic features selected as the associated features with SNHL status. All of the 10 features were statistically associated with SNHL (all of adjusted P-values < .001).


CONCLUSION
CT radiomic analysis proposed in this study, could help in the prediction of hearing loss induced by chemoradiation. Our study also, demonstrates that combination of radiomic features with clinical and dosimetric variables can model radiotherapy outcome such as SNHL.",2018,Medicine,"list(name = ""Hamid Abdollahi"", ids = ""144529837""); list(name = ""Shayan Mostafaei"", ids = ""3986463""); list(name = ""Susan Cheraghi"", ids = ""36350475""); list(name = ""Isaac Shiri"", ids = ""11905921""); list(name = ""Seied Rabi Mahdavi"", ids = ""114786822""); list(name = ""Anoshirvan Kazemnejad"", ids = ""52249537"")",ee11cfa702a16bd199b7e82de4d8c471f3688cd2; 10f77080adb080eb64e4e1378ebb48e3c8860aa9; efdb969358be3adb69e147aae71ff7983cd03622; f18f07945cfc5be07d27fca538e67fad65f35500; 6b9d842d20ed828dd9eb876216dbb3576a7617dc; e85a815c0493af41e41eade5b593061628c52104; 5e2db2571abd33dbdc89ce24e4347c219b833aeb; 81dcca23fe89e16a40e28f3ddf703d94b5f86547; 2cadd662a63684f16761a159537631aa8da1eae1; 1b03c34f270d434047abf5f59222455a88e5aee9; 79aecaba7518f24c5c5b08f9fff0c3bace2e2a37; 412972c6729bb8f4bb84cc50d94e97f82c0be25d; 27244a3c55084af4aa33d7a41b6eac202a59b7b6; f2c8f469ee71192a06c5ffe74c578d93319d09a2,a8c719426bab698ff8f5d72b304306341257ff16; a6133261507af708881817166842d62b67ddff36; e2ec0c0a4a1fa64545393a0e9c210bf584f838f0; 6227bda73c86d61fa4dc2653b11ea27fb9cdd162; b617afebde5e1a01103a2ea63cdca87bc3ae2407; a2382b93ee7557dbc8703e71f95c66e4eb80c027; caf23f47e88bd7c9447eb7b3f21d29602d97f37d; 35a6a71a3f8f1e58134bc4c173e08a3e93d1fa54; 15d2da5066252a8bd5a5a4fc1450cff7981b5b6a; d41e180011fd39a1b3f0da3c0ef633ae917e7e69; bf1ada90469df5f55f13f7014940c44aeb87ccdd; 70b1856a35584b8b8f77e5c6dd3438f9350972c1; dcd99d49af33bd14e9e0750bcf854e7b306c808a; f547cab003f79a84bd81a6de628da30afe797d39; 282747ccba3f53c9bd7d113b0bab076adcf40898; 1e8bd89a6feae93d4acf68b82c17660a577dad1a; 1d8a55ed3ac95a7c754426d41d8be73f4b03d213; a15067563a18378dac71a206c6cc2e2d8c871301; 934a2055975c7953d3587acd2d91827660d8a180; 03780ab36334b404384e1290a33c5755693864a5; 4ce5af57c8c82c50e41236894980acc1232fbbc1; ccb708d030aca4afab5b8acd30248304ed60f740; aee36f2c72a37acd23bff9368fa9019cff06cd2e; 714191c0645a595ecc115834c862585c7f714087; a85ab96c1be0ed1261197902526c8879e795cb28; 73d491704a20ac0db6c26cb9715b2f6bc165c9cd; 0a14824290453b95d051ec9cc299d0f61ad82b23; 100f6e9d3b99ab599847fe6d28ad6c268e92b86d; dc26d735aa03039be38d7893f74c9c49cbd7b431; 640e70226454d4ed8934c40183b31ad4a057fbf8; 80b6df0b985e25755bbbcabe3e8662afa65782c0; 967de2b2c2910c1b92f4201b7d2aef58addab3f3; 6d8c9fcce8177d6f8d122d653c7d32d7624d6714,Physica medica : PM : an international journal devoted to the applications of physics to medicine and biology : official journal of the Italian Association of Biomedical Physics,45,"
          192-197
        "
ce6cf91ac1f503bce23cfc7fcc73b4c494161c51,Fast Lasso Algorithm via Selective Coordinate Descent,"For the AI community, the lasso proposed by Tibshirani is an important regression approach in finding explanatory predictors in high dimensional data. The coordinate descent algorithm is a standard approach to solve the lasso which iteratively updates weights of predictors in a round-robin style until convergence. However, it has high computation cost. This paper proposes Sling, a fast approach to the lasso. It achieves high efficiency by skipping unnecessary updates for the predictors whose weight is zero in the iterations. Sling can obtain high prediction accuracy with fewer predictors than the standard approach. Experiments show that Sling can enhance the efficiency and the effectiveness of the lasso.",2016,Computer Science,"list(name = ""Yasuhiro Fujiwara"", ids = ""144841089""); list(name = ""Yasutoshi Ida"", ids = ""1719865""); list(name = ""Hiroaki Shiokawa"", ids = ""38738753""); list(name = ""Sotetsu Iwamura"", ids = ""3382187"")",cb51606f9d6345f187a2440c6bd8ebebb15825d6; 2148a906b30147621f98f08c0bd1ce100f9a7870; 769b3fd1797859c9de6a3a183c1495de57b3bbd4; d58b672ff701a177603cccf2a43d97e2548884ec; 2c3fb8290402f9a1d6a1e2da9a2cbf503da1beca; a21ef3d0d142de028009b822c57c38f98d3fbe33; 04eb0de79106570082001dc2957fad9f0e6b2ef2; ec975f959cc47a78dffc22d0219f3bf0b95de80e; 88cdb017c39432b89ae947d5354b6d12edf1e22f; 577d4d39a7f287853b24cb4a987e1b8b59c3e64d,,,,1561-1567
8a0dbcd1c5b4322a940102e52939e9f424f269f4,Forecasting Lake Waikaremoana Water Availability for Hydro Power,"Lake Waikaremoana is a high-altitude, large-volume lake located within the rugged terrain of the Urewera National Park. At the lake outflow a rapid elevation change of nearly 450 metres in 8 kilometres facilitates the lake’s use as the upper intake portal for the Waikaremoana Hydro Power Scheme. At the time of this study, Genesis Energy operated the Waikaremoana Power Scheme in response to a water availability model based on daily lake level differencing from which daily generation capacity is predicted, allowing strategic bidding into the electricity market. However, when river flows are low this model is subject to error, as small changes in lake level sometimes cannot be determined accurately beyond background noise on daily timescales.

This project develops a method of estimating both current day and day-ahead water availability of Lake Waikaremoana, independent of lake levels using simple hydrological models, thereby improving operational efficiency of the Waikaremoana Power Scheme. The forecasting is developed specifically for the lower inflow conditions when the lake level differencing approach is most error prone.

It has long been recognised that a significant volume of Lake Waikaremoana water leaks through the ancient landslide dam which created the lake. Previous to this study, it was considered that an inaccurate estimation of this leakage rate combined with evaporative losses might contribute to the error within the existing water availability model. A modified catchment water balance and simple regression approach was applied to Lake Waikaremoana to estimate the lake water loss not accounted for by recorded outflows. Estimating this unrecorded loss translates to estimating the intercept of a linear regression relation, where the assumption is made that there is a linear relationship between the discharge of the Aniwaniwa Stream and the net lake water balance (excluding known outflows) under low inflow conditions. On the basis of the confidence intervals about the intercept, the balance term (constant background lake inflow minus leakage and evaporative loss) is estimated to within the range of 2.89 and -1.17 m³s-¹ suggesting that the unknown portion of leakage and evaporative losses are not significant contributors to model error. A useful consequence of the regression was that regression coefficients could be used as a means of upscaling to give net lake storage change for low-flow conditions. This enabled day-ahead water availability forecasts to be acquired from Aniwaniwa Stream discharge day-ahead forecasts.

Two forecasting methodologies are developed to forecast the Aniwaniwa Stream discharge: a finite mixture rainfall-runoff model, and a multiple linear regression method. The rainfall-runoff model is formulated initially as a many-parameter model which is then subjected to a lasso-based model simplification concurrent with model calibration. The simplified model forecasts next-day inflows by using a weighted linear combination of hydrograph forms which best match the previous observed…",2011,Environmental Science,"list(name = ""Carrie Louise Hopkirk"", ids = ""103728128"")",ebd539bac366ecd1e0074539b8fffaa9130de4db; 43087e5320f1cfdd41e412a938e057cb757b083e,aad294b67a819b1595c8f57305acc634609faa0e; d767abc43e4ea5c39ab62c4c889c25e1a337529c; 1bec25fe6262751ccc33f6bf68b793121af4365c; bddae8c492a8c482d137379be05a3e5ab371e6c6; ce61347968ebf3ca81ce91dc0e001f9b7d93c3ee; b365b8e45b7d81f081de44ac8f9eadf9144f3ca5; e2dc6c3934a65b3577d7659198eca180354c745a; 68328c580f417e2b7e4bfe6490f5d836154f060e; 13aba0306bcdd8876a35d26065692302cfa59cf7; e63b3dd28f12efcb22a0fc5c5d4facbc74149877; 5f25406e81eb1c69d8327c0213dcf33991fe9202; da6b4ffb382f2feda20259519cdfdd968636af50; ef42238dcac30dee34f4406b249e6bfb5ddd1440; 6a76765c7d4569ea2208433b2e1dbdde2d00a6e3; 920382338e33174739e661145b32a2d9ce3b08c8; abd4e69bab4d022052e0bfb9a461f6feb149ce3e; 767b2faa01e55150dec8dc274d2f123ac489e278; 11f853761b610c141e245260431b6bf25a0d4539; 9e4a647b3c8b3bec3d186c4df80d963eb64100fd; 74c24ac58f24f409d6ab0201f35b0f1372fbfcf8; ea8460ef8ac20b39bcdb2691e6bfd6c097e5fe7c,,,
