title,abstract,year,journal
MRI-based Radiomics nomogram to detect primary rectal cancer with synchronous liver metastases,"Synchronous liver metastasis (SLM) remains a major challenge for rectal cancer. Early detection of SLM is a key factor to improve the survival rate of rectal cancer. In this radiomics study, we predicted the SLM based on the radiomics of primary rectal cancer. A total of 328 radiomics features were extracted from the T2WI images of 194 patients. The least absolute shrinkage and selection operator (LASSO) regression was used to reduce the feature dimension and to construct the radiomics signature. after LASSO, principal component analysis (PCA) was used to sort the features of the surplus characteristics, and selected the features of the total contribution of 85%. Then the prediction model was built by linear regression, and the decision curve analysis was used to judge the net benefit of LASSO and PCA. In addition, we used two independent cohorts for training (nâ€‰=â€‰135) and validation (nâ€‰=â€‰159). We found that the model based on LASSO dimensionality construction had the maximum net benefit (in the training set (AUC [95% confidence interval], 0.857 [0.787â€“0.912]) and in the validation set (0.834 [0.714â€“0.918]). The radiomics nomogram combined with clinical risk factors and LASSO features showed a good predictive performance in the training set (0.921 [0.862â€“0.961]) and validation set (0.912 [0.809â€“0.97]). Our study indicated that radiomics based on primary rectal cancer could provide a non-invasive way to predict the risk of SLM in clinical practice.",2019,Scientific Reports
On the Prediction Performance of the Lasso,"Although the Lasso has been extensively studied, the relationship between its prediction performance and the correlations of the covariates is not fully understood. In this paper, we give new insights into this relationship in the context of multiple linear regression. We show, in particular, that the incorporation of a simple correlation measure into the tuning parameter leads to a nearly optimal prediction performance of the Lasso even for highly correlated covariates. However, we also reveal that for moderately correlated covariates, the prediction performance of the Lasso can be mediocre irrespective of the choice of the tuning parameter. For the illustration of our approach with an important application, we deduce nearly optimal rates for the least-squares estimator with total variation penalty",2017,Bernoulli
Enforcing Group Structure through the Group Fused Lasso,"We introduce the Group Total Variation (GTV) regularizer, a modification of Total Variation that uses the l 2,1 norm instead of the l 1 one to deal with multidimensional features. When used as the only regularizer, GTV can be applied jointly with iterative convex optimization algorithms such as FISTA. This requires to compute its proximal operator which we derive using a dual formulation. GTV can also be combined with a Group Lasso (GL) regularizer, leading to what we call Group Fused Lasso (GFL) whose proximal operator can now be computed combining the GTV and GL proximals through proximal Dykstra algorithm.We will illustrate how to apply GFL in strongly structured but ill-posed regression problems as well as the use of GTV to denoise colour images.",2015,
Regularized rare variant enrichment analysis for case-control exome sequencing data.,"Rare variants have recently garnered an immense amount of attention in genetic association analysis. However, unlike methods traditionally used for single marker analysis in GWAS, rare variant analysis often requires some method of aggregation, since single marker approaches are poorly powered for typical sequencing study sample sizes. Advancements in sequencing technologies have rendered next-generation sequencing platforms a realistic alternative to traditional genotyping arrays. Exome sequencing in particular not only provides base-level resolution of genetic coding regions, but also a natural paradigm for aggregation via genes and exons. Here, we propose the use of penalized regression in combination with variant aggregation measures to identify rare variant enrichment in exome sequencing data. In contrast to marginal gene-level testing, we simultaneously evaluate the effects of rare variants in multiple genes, focusing on gene-based least absolute shrinkage and selection operator (LASSO) and exon-based sparse group LASSO models. By using gene membership as a grouping variable, the sparse group LASSO can be used as a gene-centric analysis of rare variants while also providing a penalized approach toward identifying specific regions of interest. We apply extensive simulations to evaluate the performance of these approaches with respect to specificity and sensitivity, comparing these results to multiple competing marginal testing methods. Finally, we discuss our findings and outline future research.",2014,Genetic epidemiology
Regression-based sparse polynomial chaos for uncertainty quantification of subsurface flow models,"Abstract Surrogate-modelling techniques including Polynomial Chaos Expansion (PCE) is commonly used for statistical estimation (aka. Uncertainty Quantification) of quantities of interests obtained from expensive computational models. PCE is a data-driven regression-based technique that relies on spectral polynomials as basis-functions. In this technique, the outputs of few numerical simulations are used to estimate the PCE coefficients within a regression framework combined with regularization techniques where the regularization parameters are estimated using standard cross-validation as applied in supervised machine learning methods. In the present work, we introduce an efficient method for estimating the PCE coefficients combining Elastic Net regularization with a data-driven feature ranking approach. Our goal is to increase the probability of identifying the most significant PCE components by assigning each of the PCE coefficients a numerical value reflecting the magnitude of the coefficient and its stability with respect to perturbations in the input data. In our evaluations, the proposed approach has shown high convergence rate for high-dimensional problems, where standard feature ranking might be challenging due to the curse of dimensionality. The presented method is implemented within a standard machine learning library (scikit-learn [1] ) allowing for easy experimentation with various solvers and regularization techniques (e.g. Tikhonov, LASSO, LARS, Elastic Net) and enabling automatic cross-validation techniques using a widely used and well tested implementation. We present a set of numerical tests on standard analytical functions, a two-phase subsurface flow model and a simulation dataset for CO2 sequestration in a saline aquifer. For all test cases, the proposed approach resulted in a significant increase in PCE convergence rates.",2019,J. Comput. Phys.
Gene Expression Profiling Stratifies IDH-Wildtype Glioblastoma With Distinct Prognoses,"Objectives: In the present study, we aimed to determine the candidate genes that may function as biomarkers to further distinguish patients with isocitrate dehydrogenase (IDH)-wildtype glioblastoma (GBM), which are heterogeneous with respect to clinical outcomes. Materials and Methods: We selected 41 candidate genes associated with overall survival (OS) using univariate Cox regression from IDH-wildtype GBM patients based on RNA sequencing (RNAseq) expression data from the Chinese Glioma Genome Atlas (CGGA, n = 105) and The Cancer Genome Atlas (TCGA, n = 139) cohorts. Next, a seven-gene-based risk signature was formulated according to Least Absolute Shrinkage and Selection Operator (LASSO) regression algorithm in the CGGA RNAseq database as a training set, while another 525 IDH-wildtype GBM patient TCGA datasets, consisting of RNA sequencing and microarray data, were used for validation. Patient survival in the low- and high-risk groups was calculated using Kaplan-Meier survival curve analysis and the log-rank test. Uni-and multivariate Cox regression analysis was used to assess the prognosis value. Gene oncology (GO) and gene set enrichment analysis (GSEA) were performed for the functional analysis of the seven-gene-based risk signature. Results: We developed a seven-gene-based signature, which allocated each patient to a risk group (low or high). Patients in the high-risk group had dramatically shorter overall survival than their low-risk counterparts in three independent cohorts. Univariate and multivariate analysis showed that the seven-gene signature remained an independent prognostic factor. Moreover, the seven-gene risk signature exhibited a striking prognostic validity, with AUC of 78.4 and 73.9%, which was higher than for traditional ""age"" (53.7%, 62.4%) and ""GBM sub-type"" (57.7%, 52.9%) in the CGGA- and TCGA-RNAseq databases, respectively. Subsequent bioinformatics analysis predicted that the seven-gene signature was involved in the inflammatory response, immune response, cell adhesion, and apoptotic process. Conclusions: Our findings indicate that the seven-gene signature could be a potential prognostic biomarker. This study refined the current classification system of IDH-wildtype GBM and may provide a novel perspective for the research and individual therapy of IDH-wildtype GBM.",2019,Frontiers in Oncology
"Feature network models for proximity data : statistical inference, model selection, network representations and links with related models","Feature Network Models (FNM) are graphical structures that represent
 proximity data in a discrete space with the use of features. A 
statistical inference theory is introduced, based on the additivity 
properties of networks and the linear regression framework. Considering 
features as predictor variables leads in a natural way to a univariate 
multiple regression problem with positivity restrictions on the 
parameters, which represent edge lengths in the network representation. 
Theoretical standard errors and confidence intervals are obtained for 
the parameters and their performance is evaluated by Monte Carlo 
simulation. When the feature structure is not known in advance, a 
strategy is proposed to select an adequate subset of features that takes
 into account a good compromise between model fit and model complexity 
using Gray codes and the positive lasso. The same statistical inference 
theory also holds for additive trees that are special cases of FNM. 
Standard errors and confidence intervals, model tests and prediction 
error are obtained for the estimates of the branch lengths of additive 
trees. The dissertation concludes by demonstrating that there exists a 
universal network representation of city-block models based on key 
elements of the network representation consisting of betweenness, metric
 segmental additivity and internal nodes.",2006,
Component-based regularisation of multivariate generalised linear mixed models,"We address the componentâ€“based regularisation of a multivariate Generalised Linear Mixed Model (GLMM) in the framework of grouped data. A set Y of random responses is modelled with a multivariate GLMM, based on a set X of explanatory variables, a setA of additional explanatory variables, and random effects to introduce the withinâ€“group dependence of observations. Variables in X are assumed many and redundant so that regression demands regularisation. This is not the case for A, which contains few and selected variables. Regularisation is performed building an appropriate number of orthogonal components that both contribute to model Y and capture relevant structural information in X. To estimate the model, we propose to maximise a criterion specific to the Supervised Componentâ€“based Generalised Linear Regression (SCGLR) within an adaptation of Schallâ€™s algorithm. This extension of SCGLR is tested on both simulated and real grouped data, and compared to ridge and LASSO regularisations. Supplementary material for this article is available online.",2019,
Rapid compositional analysis of sawdust using sparse method and near infrared spectroscopy,"This paper proposes to measure the components of sawdust by combining a new sparse method with near infrared (NIR) spectroscopy technology. The spectroscopic data of sawdust samples are acquired by the means of Fourier transform near-infrared (FT-NIR) spectrometer. Wavelet filter is used to remove undesired noises from the spectroscopic data, and multivariate statistical methods, such as principal component regression (PCR), partial least squares regression (PLS) and least absolute shrinkage and selection operator (LASSO) are used to model the relationship between the spectroscopic data and sawdust composition. The constructed model is then tested on a set of new samples. Compared with PCR and PLS, it is shown that LASSO, a sparse method, is capable of constructing a sparse model with stronger ability in interpretation while retaining good modeling accuracy.",2014,The 26th Chinese Control and Decision Conference (2014 CCDC)
Linear Convergence of SVRG in Statistical Estimation,"The last several years has witness the huge success on the stochastic variance reduction method in the finite sum problem. However assumption on strong convexity to have linear rate limits its applicability. In particular, it does not include several important formulations such as Lasso, group Lasso, logistic regression, and some nonconvex models including corrected Lasso and SCAD. In this paper, we prove that, for a class of statistical M-estimators covering examples mentioned above, SVRG solves the formulation with a linear convergence rate without strong convexity or even convexity. Our analysis makes use of restricted strong convexity, under which we show that SVRG converges linearly to the fundamental statistical precision of the model, i.e., the difference between true unknown parameter Î¸âˆ— and the optimal solution Î¸Ì‚ of the model.",2016,ArXiv
Cirrus: An Automated Mammography-Based Measure of Breast Cancer Risk Based on Textural Features,"Background
We applied machine learning to find a novel breast cancer predictor based on information in a mammogram.


Methods
Using image-processing techniques, we automatically processed 46Â 158 analog mammograms for 1345 cases and 4235 controls from a cohort and case-control study of Australian women, and a cohort study of Japanese American women, extracting 20 textural features not based on pixel brightness threshold. We used Bayesian lasso regression to create individual- and mammogram-specific measures of breast cancer risk, Cirrus. We trained and tested measures across studies. We fitted Cirrus with conventional mammographic density measures using logistic regression, and computed odds ratios (OR) per standard deviation adjusted for age and body mass index.


Results
Combining studies, almost all textural features were associated with case-control status. The ORs for Cirrus measures trained on one study and tested on another study ranged from 1.56 to 1.78 (all Pâ€‰<â€‰10-6). For the Cirrus measure derived from combining studies, the OR was 1.90 (95% confidence interval [CI] = 1.73 to 2.09), equivalent to a fourfold interquartile risk ratio, and was little attenuated after adjusting for conventional measures. In contrast, the OR for the conventional measure was 1.34 (95% CI = 1.25 to 1.43), and after adjusting for Cirrus it became 1.16 (95% CI = 1.08 to 1.24; Pâ€‰=â€‰4 Ã— 10-5).


Conclusions
A fully automated personal risk measure created from combining textural image features performs better at predicting breast cancer risk than conventional mammographic density risk measures, capturing half the risk-predicting ability of the latter measures. In terms of differentiating affected and unaffected women on a population basis, Cirrus could be one of the strongest known risk factors for breast cancer.",2018,JNCI Cancer Spectrum
