title,abstract,year,journal
Biomaker patterns of fatty acids and other fat-soluble biocompounds in blood to indicate nuts intake in the European Prospective Investigation into Cancer and Nutrition (EPIC) study,"Summary Introduction Nuts are nutrient dense foods, rich in unsaturated fatty acids and other fat-soluble biocompounds. Epidemiological and intervention studies have shown that a high intake of nuts is associated with a reduced risk of coronary heart disease; however, inaccurate estimation of nut intake using self-reported methods might limit detection of other health benefits such as reduced risk of cancer, where potential strengths of associations are likely smaller. This study aimed to identify biomarker patterns including fatty acids (FAs) and other fat-soluble compounds (carotenoids and tocopherols) in blood to indicate nut intake by applying a statistical algorithm combining dimension reduction and variable selection methods. Methods The study included 2324 subjects (44% men) aged 35â€“70 years from 8 European countries in EPIC cross-sectional study. Recent and habitual nut intakes were assessed with 24-h dietary recalls (24-HDR) and dietary questionnaire (DQ), respectively. Potential biomarkers related to nut intake included 22 plasma FAs and serum fat-soluble compounds (7 carotenoids and 2 tocopherols). They were measured by gas chromatography and high-performance liquid chromatography, respectively. In order to identify patterns of these biomarkers, maximizing the explained variability in nut intake, reduced rank regression (RRR) models were used with optimal subsets of biomarkers selected by two different variable selection methods; RRR-based variable importance in projection (RRR-VIP) and least absolute shrinkage and selection operator (LASSO). Prior to the main analysis, nut intake and biomarker levels were log-transformed and adjusted for energy intake (nut intake only) and country taking residuals in linear models. The performance of RRR models was evaluated by Pearson correlation coefficients of biomarker pattern scores with recent and habitual nut intakes through internal two-fold cross-validation. Results Higher performance was observed in biomarker patterns on habitual nut intake reported in the DQ. The selected subsets of biomarkers slightly differed depending on which selection method was used, but arachidic acid, linoleic acid and tocopherols, known as abundant compounds in nuts, were commonly selected as biomarkers to explain habitual nut intake in both methods. Pearson correlation coefficients of biomarker pattern scores with habitual nut intake (rÂ =Â 0.27) were two to three times stronger than those of single biomarkers (linoleic acid rÂ =Â 0.08; arachidic acid rÂ =Â 0.11). Neither biomarker patterns nor single biomarkers performed well in explaining recent nut intake reported in the 24-HDR. Conclusions Biomarker patterns consisting of fatty acids or fat-soluble biocompounds better indicated nut intakes compared to any of these single biomarkers evaluated, especially for habitual nut intake. Whether these identified biomarker patterns improve assessment of nut intake in diet-disease studies needs to be evaluated in future studies.",2018,Revue D Epidemiologie Et De Sante Publique
A Sparse Regression Method for Group-Wise Feature Selection with False Discovery Rate Control,"The method of Sorted L-One Penalized Estimation, or SLOPE, is a sparse regression method recently introduced by Bogdan et. al. [1] . It can be used to identify significant predictor variables in a linear model that may have more unknown parameters than observations. When the correlations between predictor variables are small, the SLOPE method is shown to successfully control the false discovery rate (the expected proportion of the irrelevant among all selected predictors) at a user specified level. However, the requirement for nearly uncorrelated predictors is too restrictive for genomic data, as demonstrated in our recent study [2] by an application of SLOPE to realistic simulated DNA sequence data. A possible solution is to divide the predictor variables into nearly uncorrelated groups, and to modify the procedure to select entire groups with an overall significant group effect, rather than individual predictors. Following this motivation, we extend SLOPE in the spirit of Group LASSO to Group SLOPE, a method that can handle group structures between the predictor variables, which are ubiquitous in real genomic data. Our theoretical results show that Group SLOPE controls the group-wise false discovery rate (gFDR), when groups are orthogonal to each other. For use in non-orthogonal settings, we propose two types of Monte Carlo based heuristics, which lead to gFDR control with Group SLOPE in simulations based on real SNP data. As an illustration of the merits of this method, an application of Group SLOPE to a dataset from the Framingham Heart Study results in the identification of some known DNA sequence regions associated with bone health, as well as some new candidate regions. The novel methods are implemented in the R package grpSLOPEMC , which is publicly available at https://github.com/agisga/grpSLOPEMC.",2018,IEEE/ACM Transactions on Computational Biology and Bioinformatics
Persistent severe acute respiratory distress syndrome for the prognostic enrichment of trials,"BACKGROUND
Acute respiratory distress syndrome (ARDS) is heterogeneous. As an indication of the heterogeneity of ARDS, there are patients whose syndrome improves rapidly (i.e., within 24 hours), others whose hypoxemia improves gradually and still others whose severe hypoxemia persists for several days. The latter group of patients with persistent severe ARDS poses challenges to clinicians. We attempted to assess the baseline characteristics and outcomes of persistent severe ARDS and to identify which variables are useful to predict it.


METHODS
A secondary analysis of patient-level data from the ALTA, EDEN and SAILS ARDSNet clinical trials was conducted. We defined persistent severe ARDS as a partial pressure of arterial oxygen to fraction of inspired oxygen ratio (PaO2:FiO2) of equal to or less than 100 mmHg on the second study day following enrollment. Regularized logistic regression with an L1 penalty [Least Absolute Shrinkage and Selection Operator (LASSO)] techniques were used to identify predictive variables of persistent severe ARDS.


RESULTS
Of the 1531 individuals with ARDS alive on the second study day after enrollment, 232 (15%) had persistent severe ARDS. Of the latter, 100 (43%) individuals had mild or moderate hypoxemia at baseline. Usage of vasopressors was greater [144/232 (62%) versus 623/1299 (48%); p<0.001] and baseline severity of illness was higher in patients with versus without persistent severe ARDS. Mortality at 60 days [95/232 (41%) versus 233/1299 (18%); p<0.001] was higher, and ventilator-free (p<0.001), intensive care unit-free [0 (0-14) versus 19 (7-23); p<0.001] and non-pulmonary organ failure-free [3 (0-21) versus 20 (1-26); p<0.001] days were fewer in patients with versus without persistent severe ARDS. PaO2:FiO2, FiO2, hepatic failure and positive end-expiratory pressure at enrollment were useful predictive variables.


CONCLUSIONS
Patients with persistent severe ARDS have distinct baseline characteristics and poor prognosis. Identifying such patients at enrollment may be useful for the prognostic enrichment of trials.",2020,PLoS ONE
Efficient sparse Hessian based algorithms for the clustered lasso problem,"We focus on solving the clustered lasso problem, which is a least squares problem with the $\ell_1$-type penalties imposed on both the coefficients and their pairwise differences to learn the group structure of the regression parameters. Here we first reformulate the clustered lasso regularizer as a weighted ordered-lasso regularizer, which is essential in reducing the computational cost from $O(n^2)$ to $O(n\log (n))$. We then propose an inexact semismooth Newton augmented Lagrangian (SSNAL) algorithm to solve the clustered lasso problem or its dual via this equivalent formulation, depending on whether the sample size is larger than the dimension of the features. An essential component of the SSNAL algorithm is the computation of the generalized Jacobian of the proximal mapping of the clustered lasso regularizer. Based on the new formulation, we derive an efficient procedure for its computation. Comprehensive results on the global convergence and local linear convergence of the SSNAL algorithm are established. For the purpose of exposition and comparison, we also summarize/design several first-order methods that can be used to solve the problem under consideration, but with the key improvement from the new formulation of the clustered lasso regularizer. As a demonstration of the applicability of our algorithms, numerical experiments on the clustered lasso problem are performed. The experiments show that the SSNAL algorithm substantially outperforms the best alternative algorithm for the clustered lasso problem.",2018,arXiv: Optimization and Control
On Ising models and algorithms for the construction of symptom networks in psychopathological research.,"During the past 5 to 10 years, an estimation method known as eLasso has been used extensively to produce symptom networks (or, more precisely, symptom dependence graphs) from binary data in psychopathological research. The eLasso method is based on a particular type of Ising model that corresponds to binary pairwise Markov random fields, and its popularity is due, in part, to an efficient estimation process that is based on a series of lâ‚-regularized logistic regressions. In this article, we offer an unprecedented critique of the Ising model and eLasso. We provide a careful assessment of the conditions that underlie the Ising model as well as specific limitations associated with the eLasso estimation algorithm. This assessment leads to serious concerns regarding the implementation of eLasso in psychopathological research. Some potential strategies for eliminating or, at least, mitigating these concerns include (a) the use of partitioning or mixture modeling to account for unobserved heterogeneity in the sample of respondents, and (b) the use of co-occurrence measures for symptom similarity to either replace or supplement the covariance/correlation measure associated with eLasso. Two psychopathological data sets are used to highlight the concerns that are raised in the critique. (PsycINFO Database Record (c) 2019 APA, all rights reserved).",2019,Psychological methods
Behavior of Lasso and Lasso-based inference under limited variability,"We study the nonasymptotic behavior of Lasso and Lasso-based inference when the covariates exhibit limited variability, which does not appear to have been considered in the literature, despite its prevalence in applied research. In settings that are generally considered favorable to Lasso, we show that, if the absolute value of a nonzero regression coefficient is smaller or equal to a threshold, Lasso fails to select the corresponding covariate with high probability (approaching to 1 asymptotically). In particular, limited variability can render Lasso unable to select even those covariates with coefficients that are well-separated from zero. Moreover, based on simple theoretical examples, we show that post double Lasso and debiased Lasso can exhibit size distortions under limited variability. Monte Carlo simulations corroborate our theoretical results and further demonstrate that, under limited variability, the performance of Lasso and Lasso-based inference methods is very sensitive to the choice of the penalty parameter. This begs the question of how to make statistical inference (e.g., constructing confidence intervals) under limited variability. In moderately high-dimensional problems, where the number of covariates is large but still smaller than the sample size, OLS constitutes a natural alternative to Lasso-based inference methods. In empirically relevant settings, our simulation results show that, under limited variability, OLS with recently developed standard errors, which are proven robust to many covariates, demonstrates a superior finite sample performance relative to Lasso-based inference methods.",2019,arXiv: Statistics Theory
Sub-region based radiomics analysis for survival prediction in oesophageal tumours treated by definitive concurrent chemoradiotherapy,"BACKGROUND
Evaluating clinical outcome prior to concurrent chemoradiotherapy remains challenging for oesophageal squamous cell carcinoma (OSCC) as traditional prognostic markers are assessed at the completion of treatment. Herein, we investigated the potential of using sub-region radiomics as a novel tumour biomarker in predicting overall survival of OSCC patients treated by concurrent chemoradiotherapy.


METHODS
Independent patient cohorts from two hospitals were included for training (nâ€¯=â€¯87) and validation (n =â€¯46). Radiomics features were extracted from sub-regions clustered from patients' tumour regions using K-means method. The LASSO regression for 'Cox' method was used for feature selection. The survival prediction model was constructed based on the sub-region radiomics features using the Cox proportional hazards model. The clinical and biological significance of radiomics features were assessed by correlation analysis of clinical characteristics and copy number alterations(CNAs) in the validation dataset.


FINDINGS
The overall survival prediction model combining with seven sub-regional radiomics features was constructed. The C-indexes of the proposed model were 0.729 (0.656-0.801, 95% CI) and 0.705 (0.628-0.782, 95%CI) in the training and validation cohorts, respectively. The 3-year survival receiver operating characteristic (ROC) curve showed an area under the ROC curve of 0.811 (0.670-0.952, 95%CI) in training and 0.805 (0.638-0.973, 95%CI) in validation. The correlation analysis showed a significant correlation between radiomics features and CNAs.


INTERPRETATION
The proposed sub-regional radiomics model could predict the overall survival risk for patients with OSCC treated by definitive concurrent chemoradiotherapy. FUND: This work was supported by the Zhejiang Provincial Foundation for Natural Sciences, National Natural Science Foundation of China.",2019,EBioMedicine
Motor Imagery ECoG Signal Classification Using Sparse Representation with Elastic Net Constraint,"In recent years, the brain-computer interface (BCI) technology based on the motor imagery has provided a new method for people to communicate with the outside world. How to effectively extract features and improve the recognition rate of EEG signals is one of the hot problems in this field. This study is based on the motor imagery ECoG signals, in which the common spatial pattern (CSP) algorithm is used for feature extraction, and then the extracted energy features are classified by the classification algorithms. In order to improve the classification accuracy of the ECoG signals, this study introduces the sparse representation-based classification (SRC) algorithm with the elastic network constraint. Then the accelerated proximal gradient (APG) algorithm and the least angle regression (LARS) algorithm are respectively applied to sparse coding for the ECoG signals. The elastic network which combines the L1 norm and the L2 norm not only avoids the over-fitting problem, but also has a higher prediction ability than the Lasso algorithm. The experimental results demonstrate that the proposed method can achieve better classification performance than other algorithms, such as the sparse representation algorithms with L1 minimization, SVM, KNN, Adaboost, and Naive Bayes.",2018,2018 IEEE 7th Data Driven Control and Learning Systems Conference (DDCLS)
Abstract 2738: Early detection of colorectal cancer applying a combination of serum markers,"Background: Fecal occult blood testing (FOBT) is the recommended first line screening for the detection of colorectal cancer (CRC). To improve the detection of CRC we evaluated serum markers and combinations of serum markers as an alternative approach. Methods: Applying Lasso Regression, a specialized form of penalized logistic regression, we selected six markers for an evaluation in a collective of 857 patients including 301 CRC patients, 143 patients with adenoma, 266 healthy controls and 147 disease controls. For each marker and marker combination the performance was assessed. Results: We tested a total of 22 biomarkers for the detection of CRC from serum. Of these six markers were selected for a marker combination by Lasso Regression. Included were the well-known tumor markers CEA and CYFRA21-1 as well as novel markers or markers that are less routinely used for the detection of CRC: ferritin, osteopontin, anti-p53 and seprase. CEA showed the best sensitivity of all markers with 43.9 % at 95% specificity, followed by seprase (42.4%), CYFRA21-1 (35.5%), osteopontin (30.2%), ferritin (23.9%) and anti-p53 (20.0%). When these markers were combined a sensitivity of 72.3% was reached at a corresponding specificity of 95% and of 62.1% at 98% specificity. Focusing on more screening relevant stages, UICC stages 0-III, reduced the sensitivity slightly to 68.0% and 53.3%, respectively. In a sub-collective where matched stool samples were available (75 CRC cases and 234 controls) the sensitivity of the marker combination was comparable to fecal immunochemical testing (FIT) with 82.4% and 68.9% vs. 81.8% and 72.7% at 95% and 98% specificity, respectively. Conclusion: When six markers were combined to detect CRC from serum, the combination reached a performance that was comparable to FIT. This provides a novel tool for CRC screening to trigger a follow-up colonoscopy for a final diagnosis. Citation Format: {Authors}. {Abstract title} [abstract]. In: Proceedings of the 101st Annual Meeting of the American Association for Cancer Research; 2010 Apr 17-21; Washington, DC. Philadelphia (PA): AACR; Cancer Res 2010;70(8 Suppl):Abstract nr 2738.",2010,Cancer Research
Study of model evaluation method and of selection method of tuning parameter in Lasso,"High-dimensional data sets have been used extensively in recent years. However, their use is computationally expensive, and model features are difficult to capture. Thus, it is necessary to construct a simple and appropriate model. The least absolute shrinkage and selection operator (Lasso) can estimate several regression coefficients as exactly zero, making it possible to estimate a model and select variables at the same time. However, several problems exist. The decision procedure for the tuning parameter, which is the coefficient of the penalty term, is not established, and it is difficult to determine the value of the estimated model. In this paper, we consider a model evaluation method and a selection method for the tuning parameter. We investigate selection methods for the most appropriate tuning parameter and model evaluation methods using the model evaluation indexes RSS, AIC, BIC, and Mallowsâ€™s Cp. Let several regression coefficients be zero and vary the number of zeroes. Then, we observe the performances of the evaluation indexes. Furthermore, we observe their performances when the values of the regression coefficients are close to zero and confirm them by simulation.",2016,
Evaluating Variable Selection Techniques for Multivariate Linear Regression,"The purpose of variable selection techniques is to select a subset of relevant variables for a particular learning algorithm in order to improve the accuracy of prediction model and improve the efficiency of the model. We conduct an empirical analysis to evaluate and compare seven well-known variable selection techniques for multiple linear regression model, which is one of the most commonly used regression model in practice. The variable selection techniques we apply are forward selection, backward elimination, stepwise selection, genetic algorithm (GA), ridge regression, lasso (Least Absolute Shrinkage and Selection Operator) and elastic net. Based on the experiment with 49 regression data sets, it is found that GA resulted in the lowest error rates while lasso most significantly reduces the number of variables. In terms of computational efficiency, forward/backward elimination and lasso requires less time than the other techniques.",2016,
A Comparison of Penalized Regressions for Estimating Directed Acyclic Networks,"Network models can be classified into two large groups: undirected and directed. Directed network graphs that can represent causal relationships are likely more appropriate in bio-medical data. There have been many studies to estimate DAGs(Directed Acyclic Graphs), of which the two-stage approach using lasso effectively. Find the edges between the nodes in the first step and find the direction in the second step. In this paper, we try to compare which penalized regression is better to find neighborhoods through simulations. We present the result of the simulations that shows which penalized regression is the best.",2018,2018 Tenth International Conference on Ubiquitous and Future Networks (ICUFN)
SÃ©lection de variables pour la classification non supervisÃ©e en grande dimension,"Il existe des situations de modelisation statistique pour lesquelles le probleme classique de classification non supervisee (c'est-a-dire sans information a priori sur la nature ou le nombre de classes a constituer) se double d'un probleme d'identification des variables reellement pertinentes pour determiner la classification. Cette problematique est d'autant plus essentielle que les donnees dites de grande dimension, comportant bien plus de variables que d'observations, se multiplient ces dernieres annees : donnees d'expression de genes, classification de courbes... Nous proposons une procedure de selection de variables pour la classification non supervisee adaptee aux problemes de grande dimension. Nous envisageons une approche par modeles de melange gaussien, ce qui nous permet de reformuler le probleme de selection des variables et du choix du nombre de classes en un probleme global de selection de modele. Nous exploitons les proprietes de selection de variables de la regularisation l1 pour construire efficacement, a partir des donnees, une collection de modeles qui reste de taille raisonnable meme en grande dimension. Nous nous demarquons des procedures classiques de selection de variables par regularisation l1 en ce qui concerne l'estimation des parametres : dans chaque modele, au lieu de considerer l'estimateur Lasso, nous calculons l'estimateur du maximum de vraisemblance. Ensuite, nous selectionnons l'un des ces estimateurs du maximum de vraisemblance par un critere penalise non asymptotique base sur l'heuristique de pente introduite par Birge et Massart. D'un point de vue theorique, nous etablissons un theoreme de selection de modele pour l'estimation d'une densite par maximum de vraisemblance pour une collection aleatoire de modeles. Nous l'appliquons dans notre contexte pour trouver une forme de penalite minimale pour notre critere penalise. D'un point de vue pratique, des simulations sont effectuees pour valider notre procedure, en particulier dans le cadre de la classification non supervisee de courbes. L'idee cle de notre procedure est de n'utiliser la regularisation l1 que pour constituer une collection restreinte de modeles et non pas aussi pour estimer les parametres des modeles. Cette etape d'estimation est realisee par maximum de vraisemblance. Cette procedure hybride nous est inspiree par une etude theorique menee dans une premiere partie dans laquelle nous etablissons des inegalites oracle l1 pour le Lasso dans les cadres de regression gaussienne et de melange de regressions gaussiennes, qui se demarquent des inegalites oracle l0 traditionnellement etablies par leur absence totale d'hypothese.",2012,
Penalized methods in genome-wide association studies,"Penalized regression methods are becoming increasingly popular in genomewide association studies (GWAS) for identifying genetic markers associated with disease. However, standard penalized methods such as the LASSO do not take into account the possible linkage disequilibrium between adjacent markers. We propose a novel penalized approach for GWAS using a dense set of single nucleotide polymorphisms (SNPs). The proposed method uses the minimax concave penalty (MCP) for marker selection and incorporates linkage disequilibrium (LD) information by penalizing the difference of the genetic effects at adjacent SNPs with high correlation. A coordinate descent algorithm is derived to implement the proposed method. This algorithm is efficient and stable in dealing with a large number of SNPs. A multi-split method is used to calculate the p-values of the selected SNPs for assessing their significance. We refer to the proposed penalty function as the smoothed minimax concave penalty (SMCP) and the proposed approach as the SMCP method. Performance of the proposed SMCP method and its comparison with a LASSO approach are evaluated through simulation studies, which demonstrate that the proposed method is more accurate in selecting associated SNPs. Its applicability to real data is illustrated using data from a GWAS on rheumatoid arthritis. Based on the idea of SMCP, we propose a new penalized method for group variable selection in GWAS with respect to the correlation between adjacent groups. The proposed method uses the group LASSO for encouraging group sparsity and a",2011,
