title,abstract,year,journal
Exploiting High-order Phase-shift Keying Modulation and Direct-detection in Silicon Photonic Systems,"A computational approach to evaluate the bit-error ratio (BER) in silicon photonic systems employing high-order phase-shift keying (PSK) modulation formats is presented. Specifically, the investigated systems contain a silicon based optical interconnect, namely a strip silicon photonic waveguide or a silicon photonic crystal waveguide, and direct-detection receivers suitable to detect PSK and amplitude-shaped PSK signals. The superposition of a PSK signal and complex additive white Gaussian noise passes through the optical interconnect and subsequently through two detection-branch receivers. To model the signal propagation in the silicon optical interconnects we used a modified nonlinear SchrÃ¶dinger equation, which incorporates all relevant linear and nonlinear optical effects and the mutual interaction between free-carriers and the optical field. Finally, the BER is calculated by applying a frequency-domain approach based on the Karhunen-LoÃ¨ve series expansion method. Our computational studies of the BER reveal that the optical power, type of PSK modulation, waveguide length, and group-velocity are key factors characterizing the system BER, their influence on BER being more significant in a photonic system with larger nonlinearity. In particular, our analysis shows that the system performance is affected to a much larger extent when the signal propagates in the slow-light regime, despite the fact that this regime allows for a significantly reduced length of optical interconnects. Â© 2017 Optical Society of America OCIS codes: (200.4650) Optical interconnects; (070.4340) Nonlinear optical signal processing; (130.3120) Integrated optics devices; (230.7370) Waveguides; (130.5296) Photonic crystal waveguides; (060.4510) Optical communications. References and links 1. F. Benner, M. Ignatowski, J. A. Kash, D. M. Kuchta, and M. B. Ritter, â€œExploitation of optical interconnects in future server architectures,â€ IBM J. Res. Dev. 49, 755â€“775 (2005). 2. K. Shacham,K.Bergman, andL. P. Carloni, â€œPhotonic networks-on-chip for future generations of chipmultiprocessors,â€ IEEE Trans. Comput. 57, 1246â€“1260 (2008). 3. J. A. Kash, A. F. Benner, F. E. Doany, D. M. Kuchta, B. G. Lee, P. K. Pepeljugoski, L. Schares, C. L. Schow, and M. Taubenblatt, â€œOptical Interconnects in Exascale Supercomputers,â€ 23rd Annual Meeting of the IEEE Photonics Society, 483â€“484 (2010). 4. R. Ho, K. W. Mai, and M. A. Horowitz, â€œThe future of wires,â€ Proc. IEEE 89, 490â€“504 (2001). 5. C. Gunn, â€œCMOS Photonics for High-Speed Interconnects,â€ IEEE Micro 26, 58â€“66 (2006). 6. Y. A. Vlasov, â€œSi CMOS-Integrated Nano-Photonics for Computer and Data Communications Beyond 100G,â€ IEEE. Commun. Mag. 50, S67â€“S72 (2012). 7. W. Bogaerts, R. Baets, P. Dumon, V. Wiaux, S. Beckx, D. Taillaert, B. Luyssaert, J. van Campenhout, P. Bienstman, and D. van Thourhout, â€œNanophotonic waveguides in silicon-on-insulator fabricated with CMOS technology,â€ J. Lightwave Technol. 23, 401â€“412 (2005). 8. T. Barwicz, H. Byun, and F. Gan, C. W. Holzwarth, M. A. Popovic, P. T. Rakich, M. R. Watts, E. P. Ippen, F. X. Kartner, H. I. Smith, J. S. Orcutt, R. J. Ram, V. Stojanovic, O. O. Olubuyide, J. L. Hoyt, S. Spector, M. Geis, M. Grein, T. Lyszczarz, and J. U. Yoon, â€œSilicon photonics for compact, energy-efficient interconnects,â€ J. Opt. Netw. 6, 63â€“73 (2007). 9. K. K. Lee, D. R. Lim, H. C. Luan, A. Agarwal, J. Foresi, and L. C. Kimerling, â€œEffect of size and roughness on light transmission in a Si/SiO2 waveguide: Experiments and model,â€ Appl. Phys. Lett. 77, 1617â€“1619 (2000). 10. R. U. Ahmad, F. Pizzuto, G. S. Camarda, R. L. Espinola, H. Rao, and R. M. Osgood, â€œUltracompact corner-mirrors and T-branches in silicon-on-insulator,â€ IEEE Photon. Technol. Lett. 14, 65â€“67 (2002). 11. X. Chen, N. C. Panoiu, and R. M. Osgood, â€œTheory of Raman-mediated pulsed amplification in silicon-wire waveguides,â€ IEEE J. Quantum Electron. 42, 160â€“170 (2006). 12. A. C. Turner, C. Manolatou, B. S. Schmidt, M. Lipson, M. A. Foster, J. E. Sharping, and A. L. Gaeta, â€œTailored anomalous group-velocity dispersion in silicon channel waveguides,â€ Opt. Express 14, 4357â€“4362 (2006). 13. R. A. Soref and B. R. Bennett, â€œElectrooptical effects in silicon,â€ IEEE J. Quantum Electron. 23, 123â€“129 (1987). 14. A. Liu, R. Jones, L. Liao, D. Samara-Rubio, D. Rubin, O. Cohen, R. Nicolaescu, and M. Paniccia, â€œA high-speed silicon optical modulator based on a metal-oxide-semiconductor capacitor,â€ Nature 427, 615-618 (2004). 15. Q. Xu, B. Shmidt, S. Pradhan, and M. Lipson, â€œMicrometre-scale silicon electro-optic modulator,â€ Nature 435, 325â€“327 (2005). 16. R. Claps, D. Dimitropoulos, V. Raghunathan, Y. Han, and B. Jalali, â€œObservation of stimulated Raman amplification in silicon waveguides,â€ Opt. Express 11, 1731â€“1739 (2003). 17. H. S. Rong, R. Jones, A. S. Liu, O. Cohen, D. Hak, A. Fang, and M. Paniccia, â€œA continuous-wave Raman silicon laser,â€ Nature 433, 725â€“728 (2005). 18. O. Boyraz, P. Koonath, V. Raghunathan, and B. Jalali, â€œAll optical switching and continuum generation in silicon waveguides,â€ Opt. Express 12, 4094â€“4102 (2004). 19. H. Fukuda, K. Yamada, T. Shoji, M. Takahashi, t. Tsuchizawa, T. Watanabe, J. Takahashi, and S. Itabashi, â€œFour-wave mixing in silicon wire waveguides,â€ Opt. Express 13, 4629â€“4637 (2005). 20. M. A. Foster, A. C. Turner, J. E. Sharping, B. S. Schmidt, M. Lipson, and A. L. Gaeta, â€œBroad-band optical parametric gain on a silicon photonic chip,â€ Nature 441, 960â€“963 (2006). 21. E. Dulkeith, Y. A. Vlasov, X. Chen, N. C. Panoiu, and R. M. Osgood, â€œSelf-phase-modulation in submicron silicon-on-insulator photonic wires,â€ Opt. Express 14, 5524â€“5534 (2006). 22. N. C. Panoiu, X. Chen, and R. M. Osgood, â€œModulation instability in silicon photonic nanowires,â€ Opt. Lett. 31, 3609â€“3611 (2006). 23. I-W. Hsieh, X. Chen, J. I. Dadap, N. C. Panoiu, R. M. Osgood, S. J. McNab, and Y. A. Vlasov, â€œCrossphase modulation-induced spectral and temporal effects on co-propagating femtosecond pulses in silicon photonic wires,â€œ Opt. Express 15, 1135â€“1146 (2007). 24. R. Dekker, A. Driessen, T. Wahlbrink, C. Moormann, J. Niehusmann, and M. Forst, â€œUltrafast Kerr-induced alloptical wavelength conversion in silicon waveguides using 1.5 Î¼m femtosecond pulses,â€ Opt. Express 14, 8336â€“8346 (2006). 25. S. Assefa, F. Xia, W. M. J. Green, C. L. Schow, A. V. Rylyakov, and Y. A. Vlasov, â€œCMOS-Integrated Optical Receivers for On-Chip Interconnects,â€ IEEE J. Sel. Top. Quantum Electron. 16, 1376â€“1385 (2010). 26. N. C. Panoiu, X. Liu, and R. M. Osgood, â€œSelf-steepening of ultrashort pulses in silicon photonic nanowires,â€ Opt. Lett. 34, 947â€“949 (2009). 27. R. A. Soref, â€œThe past, present, and future of silicon photonics,â€ IEEE J. Sel. Top. Quantum Electron. 12, 1678â€“1687 (2006). 28. Q. Lin, O. J. Painter, and G. P. Agrawal, â€œNonlinear optical phenomena in silicon waveguides: Modeling and applications,â€ Opt. Express 15, 16604â€“16644 (2007). 29. J. I. Dadap, N. C. Panoiu, X. G. Chen, I. W. Hsieh, X. P. Liu, C. Y. Chou, E., Dulkeith, S. J., McNab, F. N. Xia, W. M. J. Green, L. Sekaric, Y. A. Vlasov, and R. M. Osgood, â€œNonlinear-optical phase modification in dispersion-engineered Si photonic wires,â€ Opt. Express 16, 1280â€“1299 (2008). 30. R. M. Osgood, N. C. Panoiu, J. I. Dadap, X. Liu, X. Chen, I-W. Hsieh, E. Dulkeith, W. M. J. Green, and Y. A. Vlassov, â€œEngineering nonlinearities in nanoscale optical systems: physics and applications in dispersion-engineered silicon nanophotonic wires,â€ Adv. Opt. Photon. 1, 162â€“235 (2009). 31. J. P. Winzer and R. J. Essiambre, â€œAdvanced optical modulation formats,â€ Proc. IEEE 94, 952â€“985 (2006). 32. M. Rohde, C. Caspar, N. Heimes, M. Konitzer, E. J. Bachus, and N. Hanik, â€œRobustness of DPSK direct detection transmission format in standard fibre WDM systems,â€ Electron. Lett. 36, 1483â€“1484 (2000). 33. J. Wang and J. M. Kahn, â€œImpact of Chromatic and Polarization-Mode Dispersions on DPSK Systems Using Interferometric Demodulation and Direct Detection,â€ J. Lightwave Technol. 22, 362â€“371 (2004). 34. M. Seimetz, M. Nolle, and E. Patzak, â€œOptical System With High-Order Optical DPSK and Star QAM Modulation Based on Interferometric Direct Detection,â€ J. Lightwave Technol. 25, 1515â€“1530 (2007). 35. M. Nolle, M. Seimetz, and E. Patzak, â€œSystem Performance of High-Order Optical DPSK and Star QAMModulation for Direct Detection Analyzed by Semi-Analytical BER Estimation,â€ J. Lightwave Technol. 27, 4319â€“4329 (2009). 36. N. C. Panoiu, J. F. McMillan, and C. W. Wong, â€œTheoretical Analysis of Pulse Dynamics in Silicon Photonic Crystal Wire Waveguides,â€ IEEE J. Sel. Top. Quantum Electron. 16, 257â€“266 (2010). 37. S. Lavdas and N. C. Panoiu, â€œTheory of pulsed four-wave mixing in one-dimensional silicon photonic crystal slab waveguides,â€ Phys. Rev. B 93, 115435 (2016). 38. C. Koos, L. Jacome, C. Poulton, J. Leuthold, W. Freude, â€œNonlinear silicon-on-insulator waveguides for all-optical signal processing,â€ Opt. Express 15, 5976â€“5990 (2007). 39. A. Mafi and S. Raghavan, â€œNonlinear phase noise in optical communication systems using eigenfunction expansion method,â€ Opt. Eng. 50, 055003 (2011). 40. E. Forestieri andM.Secondini, â€œOn theError Probability Evaluation inLightwaveSystemsWithOpticalAmplification,â€ J. Lightwave Technol. 27, 706â€“717 (2009). 41. J. You, S. Lavdas, and N. C. Panoiu, â€œTheoretical Comparative Analysis of BER in Multi-Channel Systems With Strip and Photonic Crystal Silicon Waveguides,â€ IEEE J. Sel. Top. Quantum Electron. 22, 4400810 (2016). 42. J. You and N. C. Panoiu, â€œCalculation of Bit Error Rates in Optical Systems with Silicon Photonic Wires,â€ IEEE J. Quantum Electron. 51, 8400108 (2015). 43. P. E. Barclay, K. Srinivasan, and O. Painter, â€œNonlinear response of silicon photonic crystal microresonators excited via an integrated waveguide and fiber taper,â€ Opt. Express 13, 801â€“820 (2005). 44. H. Yoon, D. Lee, and N. Park, â€œPerformance comparison of optical 8-ary differential phase-shift keying systems with different decision scheme",2017,
Impact of node dynamical parameters on structures identification of complex networks based on the Lasso method,"Complex networks are ubiquitous in nature and society. The functions and features of complex networks are various when these networks have different nodal dynamics and network topologies. Reconstructing networks with high-order nodal dynamics or different system parameter vectors from limited measurable information is a fundamental problem for using and controlling these networks. Based on the Lasso method, we present an efficient and feasible, completely data-driven approach to predict the structures of complex networks in the presence or absence of noise when the systemic parameter is uncertain, that is, the node dynamical parameter vector of network can vary. The numerical simulations indicate that, networks structures can be fully reconstructed even only few information available under the conditions of the systemic parameter vector is varying and in the presence or absence of noise, this method is effective and robust.",2017,IECON 2017 - 43rd Annual Conference of the IEEE Industrial Electronics Society
Study of the brain functional network using synthetic data,"The brain functional connectivity is usually assessed with the correlation coefficients of certain signals. The partial correlation matrix can reveal direct interactions between brain regions. However, computing this matrix is usually challenging due to the availability of only a limited number of samples. As an alternative, thresholding the sample correlation matrix is a common technique for the identification of the direct interactions. In this work, we investigate the performance of this method in addition to some other well-known techniques, namely graphical lasso and Chow-Liu algorithm. Our analysis is performed on some synthetic data produced by an electrical circuit model with certain structural properties. We show that the simple method of thresholding the correlation matrix and the graphical lasso algorithm would both create false positives and negatives that wrongly imply some network properties such as small-worldness. We also apply these techniques to some resting-state functional MRI (fMRI) data and show that similar observations can be made.",2014,"2014 52nd Annual Allerton Conference on Communication, Control, and Computing (Allerton)"
Condition-adaptive fused graphical lasso (CFGL): An adaptive procedure for inferring condition-specific gene co-expression network,"Co-expression network analysis provides useful information for studying gene regulation in biological processes. Examining condition-specific patterns of co-expression can provide insights into the underlying cellular processes activated in a particular condition. One challenge in this type of analysis is that the sample sizes in each condition are usually small, making the statistical inference of co-expression patterns highly underpowered. A joint network construction that borrows information from related structures across conditions has the potential to improve the power of the analysis. One possible approach to constructing the co-expression network is to use the Gaussian graphical model. Though several methods are available for joint estimation of multiple graphical models, they do not fully account for the heterogeneity between samples and between co-expression patterns introduced by condition specificity. Here we develop the condition-adaptive fused graphical lasso (CFGL), a data-driven approach to incorporate condition specificity in the estimation of co-expression networks. We show that this method improves the accuracy with which networks are learned. The application of this method on a rat multi-tissue dataset and The Cancer Genome Atlas (TCGA) breast cancer dataset provides interesting biological insights. In both analyses, we identify numerous modules enriched for Gene Ontology functions and observe that the modules that are upregulated in a particular condition are often involved in condition-specific activities. Interestingly, we observe that the genes strongly associated with survival time in the TCGA dataset are less likely to be network hubs, suggesting that genes associated with cancer progression are likely to govern specific functions or execute final biological functions in pathways, rather than regulating a large number of biological processes. Additionally, we observed that the tumor-specific hub genes tend to have few shared edges with normal tissue, revealing tumor-specific regulatory mechanism.",2018,PLoS Computational Biology
Identification of biomarkers for Mycobacterium tuberculosis infection and disease in BCG-vaccinated young children in Southern India,"Pediatric tuberculosis (TB) often goes undiagnosed because of the lack of reliable diagnostic methods. With the aim of assessing biomarker(s) that can aid in the diagnosis of TB infection and disease, we investigated 746 Indian children with suspected TB. Whole-blood mRNA from 210 children was examined by dual-color Reverse-Transcriptase Multiple Ligation-dependent Probe-Amplification for the expression of 45 genes and a Bio-Plex assay for the expression of cytokines/chemokines in QuantiFERON supernatants. The study shows that transcription of SEC14L1, GUSB, BPI, CCR7 and TGFÎ²-1 (all Pâ©½0.05) was downregulated in TB disease compared with uninfected controls, while transcription of RAB33A was downregulated in TB disease compared with both latent TB (P<0.05) and controls (P<0.01). The transcription of CD4, TGFÎ²-1 (P<0.01) and the expression of IL-2 (P<0.01) and IL-13 (P<0.05) was upregulated in latent TB compared with that in controls. Using the Least Absolute Shrinkage and Selection Operator (lasso) model, RAB33A alone discriminated between TB disease and latent TB (area under the curve (AUC) 77.5%), whereas a combination of RAB33A, CXCL10, SEC14L1, FOXP3 and TNFRSF1A was effective in discriminating between TB disease and controls (AUC 91.7%). A combination of 11 biomarkers predicted latent TB with moderate discriminatory power (AUC 72.2%). In conclusion, RAB33A is a potential biomarker for TB disease, whereas CD4, TGFÎ²-1 and IL-2, IL-13 may identify latent TB in children.",2013,Genes and Immunity
Development and validation of a model for temporal lobe necrosis for nasopharyngeal carcinoma patients with intensity modulated radiation therapy,"PurposeTo develop and validate a quantitative complication model of temporal lobe necrosis (TLN). To analyze the effect of clinical and dosimetric factors on TLN.Patients and methodsIn this study the prediction model was developed in a training cohort that consisted of 256 nasopharyngeal carcinoma (NPC) patients from January 2009 to December 2009. Dosimetric and clinical factors were extracted for model building. Dosimetric factors including the maximum dose, minimum dose, mean dose, dose covering specific volume and dose of percentage volume. Clinical factors include age, gender, T/N-stage, overall stage, diabetes and hypertension. LASSO (least absolute shrinkage and selection operator) regression model was used for feature selection, and prediction model building. A testing cohort containing 493 consecutive patients from January 2010 to December 2010 was used for model validation. The performance of the prediction model was assessed with respect to its calibration, discrimination.ResultsThe prediction model, which consisted of two dosimetric features (D0.5cc and D10), is significantly associated with LN status (PÂ <â€‰.001 for both training and testing cohorts). None of clinical factors show direct prediction value. The model shows good discrimination, with a C-index of 0.685 (95% CI: 0.6048â€“0.765) on testing set, and a consistent trend in calibration on testing set.ConclusionThis study presents a prediction model can be conveniently used to facilitate the individualized prediction of TLN in patients with NPC. Clinical factors have no direct impact on TLN.",2019,"Radiation Oncology (London, England)"
"Comparison of methods to construct a genetic risk score for prediction of rheumatoid arthritis in the population-based Nord-TrÃ¸ndelag Health Study, Norway.","OBJECTIVES
To evaluate selection methods among published single-nucleotide polymorphisms (SNPs) associated with RA to construct predictive genetic risk scores (GRSs) in a population-based setting.


METHODS
The Nord-TrÃ¸ndelag Health (HUNT) Study is a prospective cohort study among the whole adult population of northern TrÃ¸ndelag, Norway. Participants in HUNT2 (1995-1997) and HUNT3 (2006-2008) were included (489 RA cases, 61Â 584 controls). The initial SNP selection from relevant genome-wide studies included 269 SNPs from 30 studies. Following different selection criteria, SNPs were weighted by published odds ratios. The sum of each person's carriage of all weighted susceptibility variants was calculated for each GRS.


RESULTS
The best-fitting risk score included 27 SNPs [weighted genetic risk score 27 (wGRS27)] and was identified using P-value selection criterion â‰¤5â€‰Ã—â€‰10-8, the largest possible SNP selection without high linkage disequilibrium (r2â€‰<â€‰0.8), and lasso regression to select for positive coefficients. In a logistic regression model adjusted for gender, age and ever smoking, wGRS27 was associated with RA [odds ratio 1.86 (95% CI 1.71, 2.04) for each s.d. increase, Pâ€‰<â€‰0.001]. The AUC was 0.76 (95% CI 0.74, 0.78). The positive and negative predictive values were 1.6% and 99.7%, respectively, and the positive predictive value was not improved in sensitivity analyses subselecting participants to illustrate settings with increased RA prevalences. Other schemes selected more SNPs but resulted in GRSs with lower predictive ability.


CONCLUSION
Constructing a wGRS based on a smaller selection of informative SNPs improved predictive ability. Even with a relatively high AUC, the low PPV illustrates that there was a large overlap in risk variants among RA patients and controls, precluding clinical usefulness.",2020,Rheumatology
Sex determination of Antarctic Petrels Thalassoica antarctica by discriminant analysis of morphometric characters,"We present data on sexual dimorphism in some morphological measurements (wing length, head length, bill depth and bill length) in the Antarctic Petrel Thalassoica antarctica. Males were on average larger than females for all measurements. Sexual dimorphism was on average largest for bill depths whereas wing lengths discriminated least between the sexes. A discriminant function including bill depth, head length and wing length correctly sexed 92% of the sample. Due to between-measurer variation it is recommended that morphometric measurements obtained by others on sexed birds are compared with ours before proceeding with the use of the discriminant function on unsexed individuals.",2004,Polar Biology
Molecular Signatures of Immune Activation and Epithelial Barrier Remodeling Are Enhanced during the Luteal Phase of the Menstrual Cycle: Implications for HIV Susceptibility.,"UNLABELLED
The variable infectivity and transmissibility of HIV/SHIV has been recently associated with the menstrual cycle, with particular susceptibility observed during the luteal phase in nonhuman primate models and ex vivo human explant cultures, but the mechanism is poorly understood. Here, we performed an unbiased, mass spectrometry-based proteomic analysis to better understand the mucosal immunological processes underpinning this observed susceptibility to HIV infection. Cervicovaginal lavage samples (n = 19) were collected, characterized as follicular or luteal phase using days since last menstrual period, and analyzed by tandem mass spectrometry. Biological insights from these data were gained using a spectrum of computational methods, including hierarchical clustering, pathway analysis, gene set enrichment analysis, and partial least-squares discriminant analysis with LASSO feature selection. Of the 384 proteins identified, 43 were differentially abundant between phases (P < 0.05, â‰¥2-fold change). Cell-cell adhesion proteins and antiproteases were reduced, and leukocyte recruitment (interleukin-8 pathway, P = 1.41E-5) and extravasation proteins (P = 5.62E-4) were elevated during the luteal phase. LASSO/PLSDA identified a minimal profile of 18 proteins that best distinguished the luteal phase. This profile included cytoskeletal elements and proteases known to be involved in cellular movement. Gene set enrichment analysis associated CD4(+) T cell and neutrophil gene set signatures with the luteal phase (P < 0.05). Taken together, our findings indicate a strong association between proteins involved in tissue remodeling and leukocyte infiltration with the luteal phase, which may represent potential hormone-associated mechanisms of increased susceptibility to HIV.


IMPORTANCE
Recent studies have discovered an enhanced susceptibility to HIV infection during the progesterone-dominant luteal phase of the menstrual cycle. However, the mechanism responsible for this enhanced susceptibility has not yet been determined. Understanding the source of this vulnerability will be important for designing efficacious HIV prevention technologies for women. Furthermore, these findings may also be extrapolated to better understand the impact of exogenous hormone application, such as the use of hormonal contraceptives, on HIV acquisition risk. Hormonal contraceptives are the most widely used contraceptive method in sub-Saharan Africa, the most HIV-burdened area of the world. For this reason, research conducted to better understand how hormones impact host immunity and susceptibility factors important for HIV infection is a global health priority.",2015,Journal of virology
