title,abstract,year,journal
Etiologies et pronostic des urgences chirurgicales digestives au Centre Hospitalier Universitaire de Bobo-Dioulasso (Burkina Faso),"Objectif: le but de cette etude etait de determiner les etiologies des urgences chirurgicales digestives et dâ€™en evaluer le pronostic. Methode: de facon retrospective, 343 dossiers de patients operes pour une urgence chirurgicale digestive entre le 1 er janvier 2012 et le 31 decembre 2012 ont ete colliges. Resultats: durant la periode de lâ€™etude, 696 patients ont ete admis dans le service de chirurgie generale et digestive, dont 343 patients pour une urgence chirurgicale, soit 49,28%. Des 343 patients de notre serie, 77,25% etaient des hommes, soit un sex- ratio de 3,4. Lâ€™Ã¢ge moyen des patients etait de 29 ans. Les principales etiologies ont ete dominees par les peritonites (148 cas), soit 43,1% ; les occlusions intestinales (94 cas), soit 27,4% ; les appendicites (58 cas), soit 16,9% et les traumatismes abdominaux (29 cas), soit 8,5%. Les complications ont ete dominees par les infections parietales et la mortalite a ete de 8,16%. Conclusion: une sensibilisation des populations pour un recours precoce aux structures sanitaires ameliorerait le pronostic de ces urgences chirurgicales digestives. Mots-cles: Urgences chirurgicales digestives-etiologies-pronostic English Title: Â Etiologies and prognosis of digestive surgical emergencies at Bobo-Dioulassoâ€™s Teaching Hospital (Burkina Faso) English Abstract The purpose of this study was to determine the etiologies of digestive surgical emergencies and to evaluate their prognosis. Patients and method: Retrospectively, 343 patients have been operated for a digestive surgical emergency between January the 1 st of 2012 and December the 31 of 2012. During this period, 343 of 696 (49.28%) patients admitted were suffer of a digestive surgical emergency. The study population was predominantly male (77.25%). The main etiologies were the peritonitis (43.1%), the intestinal obstructions (27.4%), the appendicitis (16.9%) and the abdominal traumatisms (8.5%). The post-operative recovery were complicated in 21, 46%. The rate of mortality was 8.16%. Conclusion: A sensibilisation of populations for a quick admission in the sanitary centers could change the fatal prognosis of these digestive surgical emergencies. Keywords: digestive surgical emergencies-etiologies-prognosis",2017,
"Athalassotoga saccharophila gen. nov., sp. nov., isolated from an acidic terrestrial hot spring, and proposal of Mesoaciditogales ord. nov. and Mesoaciditogaceae fam. nov. in the phylum Thermotogae.","A novel moderately thermophilic, weakly acidophilic, heterotrophic, anaerobic, short-rod bacterium having an outer sheath-like structure (toga) was isolated from a low-salt acidic terrestrial hot spring in Oku-Shiobara, Tochigi, Japan. The strain, designated NAS-01T, grew between 30 and 60â€‰Â°C (optimum 55â€‰Â°C), and at pHâ€‰4.5 and 7.5 (optimum pHâ€‰5.5 to 6.0) and could not grow in media with â‰¥â€‰1â€‰% NaCl (optimum 0â€‰% NaCl). It utilized Fe(III), thiosulfate or l-cystine as electron acceptor for growth, and yeast extract, peptone or a variety of sugars as carbon and energy sources. The major cellular fatty acid was C16â€‰:â€‰0, and no lipoquinone was detected. Strain NAS-01T contained phospholipids and glycolipids, but not aminolipids. The DNA G+C content was 41.1â€Šmol%. Phylogenetic analysis based on the 16S rRNA gene sequence revealed that the strain was included in the phylum Thermotogae, and was closely related to Mesoaciditoga lauensis. The 16S rRNA gene sequence similarity between them was 90â€‰%, and they were deeply branched off the rest of the known Thermotogae species. On the basis of the phylogenetic and ecophysiological properties, strain NAS-01T represents a novel species of a new genus in the phylum Thermotogae, for which we propose the name Athalassotoga saccharophila gen. nov., sp. nov. The type strain of the type species is NAS-01T (â€‰=â€‰JCM 19762Tâ€‰=â€‰DSM 28954T). In addition, we propose a new order and family, Mesoaciditogales ord. nov. and Mesoaciditogaceae fam. nov., respectively, to accommodate the novel genus and the closely related genus Mesoaciditoga.",2016,International journal of systematic and evolutionary microbiology
Impact of non-cardiovascular disease burden on thirty-day hospital readmission in heart failure patients.,"BACKGROUND
Little is known about the impact of non-cardiovascular disease (CVD) burden on 30- -day readmission in heart failure (HF) patients. The aim of the study was to assess the role of non-CVD burden on 30-day readmission in HF patients. \ METHODS: We analyzed the effect of non-CVD burden by frequency of ICD-9 code categories on readmis-sions of patients discharged with a primary diagnosis of HF. We first modeled the probability of readmis-sion within 30 days as a function of demographic and clinical covariates in a randomly selected training dataset of the total cohort. Variable selection was carried out using a bootstrap LASSO procedure with 1000 bootstrap samples, the final model was tested on a validation dataset. Adjusted odds ratios and confidence intervals were reported in the validation dataset.


RESULTS
There were a total of 6228 HF hospitalizations, 1523 (24%) with readmission within 30 days of discharge. The strongest predictor for 30-day readmissions was any hospital admission in the prior year (p < 0.001). Cardiovascular risk factors did not enter the final model. However, digestive system diseases increased the risk for readmission by 17% for each diagnosis (p = 0.046), while respiratory diseases and genitourinary diseases showed a trend toward a higher risk of readmission (p = 0.07 and p = 0.09, respectively). Non-CVDs out-competed cardiovascular covariates previously reported to predict readmission.


CONCLUSIONS
In patients with HF hospitalization, prior admissions predicted 30-day readmission. Diseases of the digestive system also increase 30-day readmission rates. Assessment of non-CVD burden in HF patients could serve as an important risk marker for 30-day readmissions.",2018,Cardiology journal
PCR analysis and spatial repartition of trypanosomes infecting tsetse flies in SidÃ©radougou area of Burkina Faso.,"A parasitological and entomological survey was conducted in the Sideradougou area (south of Bobo Dioulasso, Burkina Faso) in order to identify transmission factors of African trypanosomosis. A total of 3600 tsetse flies (Glossina tachinoides, Glossina palpalis gambiensis) were captured along 120 km of linear gallery forest and half of them were dissected. PCR analysis was undertaken on parasitologically positive flies (161 G. tachinoides, 92 G. palpalis gambiensis) to characterize the different trypanosomes. All the results were integrated in a GIS (Geographical Information System). Spatial repartition of the characterized trypanosomes enabled to recognize different areas with specific patterns of infection. Relations with environmental factors are discussed.",1998,Annals of the New York Academy of Sciences
Creating Political Nation: Vyacheslav Lypynsky and His Conservative Theory of 1920s,"The paper analyses the worldviews of Vyacheslav (Vaclav) Lypynsky, (1882-1931), who was an outstanding intellectual of Ukrainian conservative thought of the 1900-1930â€™s. Particular attention is paid to his views of the 1920â€™s when he completed the construction of his theory, and revised his earlier writings. Under the influence of the early sociological writings of Vilfredo Parto and Robert Michels, he developed a typology of the origins of aristocracy and corresponding types of state and society, these being classocratic, ochlocratic, and democratic. The paper looks at the similarities of Lypynskyâ€™s views compared with some approaches typical of â€œconservative revolutionâ€. Lypynskyâ€™s argument is transitional, and comes from the necessity to reflect upon and respond to the core transformations of European societies as a result of, and post World War One. He completely rejected borrowing methods and attitudes of â€œmass politicsâ€ and use them in conservatism. In defining the term â€œnationâ€, Lypynsky consistently kept the framework of its political interpretation. At the same time, he understood that the Ukrainian national project was feasible only as political and anti-colonial (as in the USA). Thus, he tried to fit his understanding of â€˜nationâ€™ within monarchism and legitimism. Overall, Lypynskyâ€™s ideas are far removed from any restorative intentions. It was a question of how to â€œrestore the pastâ€, since he was critical of the pre-World War One and pre-revolutionary status quo. He remained critical of this status quo when it was destroyed, and did not idealize it. The question is, however, if a new political action is possible, and if a new political order based on conservative ideas can be achieved.",2014,The Russian Sociological Review
Normalization by realizability also evaluates,"For those of us that generally live in the world of syntax, semantic 
proof methods such as realizability or logical relations / 
parametricity sometimes feel like magic. Why do they work? At which 
point in the proof is ""the real work"" done? 
 
Bernardy and Lasson express realizability and parametricity models as 
syntactic model -- but the abstraction/adequacy theorems are still 
explained as meta-level proofs. Hoping to better understand the proof 
technique, we look at those theorems as programs themselves. How does 
a normalization proof using realizability actually computes those 
normal forms? 
 
This detective work is an early stage and we propose a first attempt 
in a simple setting. Instead of arbitrary Pure Type Systems, we use 
the minimal negative propositional logic (arrows only). Instead of 
starting from the simply-typed lambda-calculus, we work on 
sequent-style terms in a simple subset of the Curien-Herbelin 
L calculus.",2015,
Network-Based Inference Framework for Identifying Cancer Genes from Gene Expression Data,"Great efforts have been devoted to alleviate uncertainty of detected cancer genes as accurate identification of oncogenes is of tremendous significance and helps unravel the biological behavior of tumors. In this paper, we present a differential network-based framework to detect biologically meaningful cancer-related genes. Firstly, a gene regulatory network construction algorithm is proposed, in which a boosting regression based on likelihood score and informative prior is employed for improving accuracy of identification. Secondly, with the algorithm, two gene regulatory networks are constructed from case and control samples independently. Thirdly, by subtracting the two networks, a differential-network model is obtained and then used to rank differentially expressed hub genes for identification of cancer biomarkers. Compared with two existing gene-based methods (t-test and lasso), the method has a significant improvement in accuracy both on synthetic datasets and two real breast cancer datasets. Furthermore, identified six genes (TSPYL5, CD55, CCNE2, DCK, BBC3, and MUC1) susceptible to breast cancer were verified through the literature mining, GO analysis, and pathway functional enrichment analysis. Among these oncogenes, TSPYL5 and CCNE2 have been already known as prognostic biomarkers in breast cancer, CD55 has been suspected of playing an important role in breast cancer prognosis from literature evidence, and other three genes are newly discovered breast cancer biomarkers. More generally, the differential-network schema can be extended to other complex diseases for detection of disease associated-genes.",2013,BioMed Research International
regsem: Regularized Structural Equation Modeling,"The regsem package in R, an implementation of regularized structural equation modeling (RegSEM; Jacobucci, Grimm, and McArdle 2016), was recently developed with the goal of incorporating various forms of penalized likelihood estimation in a broad array of structural equations models. The forms of regularization include both the ridge (Hoerl and Kennard 1970) and the least absolute shrinkage and selection operator (lasso; Tibshirani 1996), along with sparser extensions. RegSEM is particularly useful for structural equation models that have a small parameter to sample size ratio, as the addition of penalties can reduce the complexity, thus reducing the bias of the parameter estimates. The paper covers the algorithmic details and an overview of the use of regsem with the application of both factor analysis and latent growth curve models.",2017,arXiv: Methodology
"Wide-Area Video Understanding: Tracking, Video Summarization and Algorithm-Platform Co-Design","Author(s): Zhang, Shu | Advisor(s): Roy-Chowdhury, Amit | Abstract: Analyzing scenes captured in video over wide areas, either in a single view or in multiple views, is the focus of this thesis. The thesis considers three inter-related problems in this domain - tracking in a network of cameras, summarization of the collected videos, and algorithm design that is robust to the physical conditions of the environment and the hardware platforms on which they are implemented. The inter-relationships between various objects in the scene (termed as context) are explored in the developed solution strategies.In this thesis, we explore the problems of multi-target tracking in a wide-area scene, where the context information is shown to effectively improve the results because of the target interactions. We present a context-aware multi-target tracking algorithm in an overlapping camera network. The proposed algorithm is able to track multiple interacting targets in a wide-area camera network. From observations that both individuals and groups of targets interact with each other in natural scenes, we develop a Switching Network Tracker (SNT) that tracks both individuals and groups. In addition, due to the lack of the availability of public non-overlapping camera network datasets, we propose a new camera network tracking dataset (CamNeT) with multiple challenges. A baseline algorithm where the context information is considered is provided along with the dataset.We also explore the video summarization problem. In a wide-area scene, most of the data is redundant. Therefore, we develop an algorithm, Context-Aware Video Summarization (CAVS) algorithm, that can capture the important video portions through information about individual local motion regions, as well as the interactions between these motion regions (context information). The summarization problem is then solved as the methodology of sparse coding with generalized sparse group lasso. Moreover, although complex algorithms have been developed, there are few methods considering the real applications when there is a performance constraint. We study this fundamental problem in computer vision, which is to co-design the algorithm-platform for an unknown dataset under certain performance constraints. Our algorithm calculates a similarity between a test video and each unique training scenario. Similarity between training and test dataset indicates the same algorithm-platform can be applied to both of them. We test our algorithm on two applications: pedestrian detection and tracking.We conclude the thesis by highlighting future research directions.",2015,
"Berechnung der Kosten
alkoholassoziierter Krankheiten","Zusammenfassung
Bei knapper werdenden finanziellen Ressourcen
ist es besonders wichtig zu wissen,welche
gesellschaftlichen Lasten durch Sucht zu tragen
sind. Mittels Humankapitalansatz wurden
die direkten und indirekten Kosten alkoholbezogener
Krankheiten in Deutschland fÃ¼r die
Mitte der 90er-Jahre berechnet. Danach wird
die Volkswirtschaft jÃ¤hrlich mit 40 Mrd.DM
durch alkoholassoziierte Krankheiten belastet.
Im Jahr 1995 sind dies 1,13% des Bruttosozialprodukts.
Von den indirekten Kosten mit
24 Mrd. DM entsteht der grÃ¶ÃŸte Ressourcenverlust
mit 14 Mrd. DM durch vorzeitige MortalitÃ¤t.
FrÃ¼hberentungen machen den zweithÃ¶chsten
Ressourcenverlust aus; es folgt die
ArbeitsunfÃ¤higkeit. Die direkten Kosten,
also der Ressourcenverbrauch,verursachen
15 Mrd. DM,fast 40% der Gesamtkosten.
Von diesen sind die Krankenhausbehandlung,
die vorbeugenden und betreuenden MaÃŸnahmen
und die ambulante Behandlung die
Hauptpositionen. MÃ¤nner sind fÃ¼r den erheblichen
Teil der Kosten verantwortlich,da sie
nicht nur hÃ¤ufiger ein riskantes und gefÃ¤hrliches
Trinkverhalten zeigen,sondern auch
Ã¼ber ein durchschnittlich hÃ¶heres Einkommen
verfÃ¼gen. Sogar fÃ¼r die direkten Kosten wie
bei der Rehabilitation werden fÃ¼r MÃ¤nner pro
stationÃ¤rer Rehabilitationsleistung mehr Mittel
eingesetzt als fÃ¼r Frauen. Altersgruppenspezifische
Auswertungen zu MortalitÃ¤t und
MorbiditÃ¤t zeigen auf, dass der Schwerpunkt
bei Konsumenten im mittleren Lebensalter
liegt. Schon fÃ¼r die jÃ¼ngere BevÃ¶lkerung muss
mit gravierenden gesundheitlichen und wirtschaftlichen
Folgen gerechnet werden.Abstract
In view of limited financial resources, it is
highly important to know the economic impact
of addiction. The direct and indirect
costs of alcohol-related diseases in Germany
during the mid-1990s have been calculated
using the human capital approach. The national
economy is burdened with 40 billion
Deutsch Marks (DM) due to alcohol-related
diseases. In 1995, this represented 1.13% of
the gross national product. Of the total indirect
costs, amounting to 24 billion DM, the
greatest loss of resources, i.e. 14 billion DM,
arises from the 42,000 premature deaths due
to alcohol-related diseases. Early retirement
account for the second highest loss of resources,
followed by inability to work. Direct
costs, i.e. the consumption of resources,
account for 15 billion DM of the overall costs
(40%). Hospital treatment, preventive and
assisting measures, and outpatient treatment
are the main sources of direct costs.
The major part of the costs is incurred by
men, because they not only have a more risky
and more dangerous drinking behaviour,
but usually have a higher income than
women. Even for direct costs, such as costs of
rehabilitation, more money per case has also
been spent for men than for women. Agespecific
analyses have shown that middleaged
consumers have the highest mortality
and morbidity risk, but severe health and
economic consequences have also been
demonstrated for younger members of the
population.",2003,Bundesgesundheitsblatt - Gesundheitsforschung - Gesundheitsschutz
Diagnosing Problems of Distribution-Free Multivariate Control Chart,"In order to solve the problem of only have a few historical data that can be used in multivariate process monitoring, a new distribution-free multivariate control chart has been proposed. And in the control chart structure the control limits are determined on-line with the future observations and the historical data. Therefore, the proposed control chart has very important application in practice. However, the research doesnâ€™t study the problem of the fault diagnosis after the control chart alarms. So we use LASSO-based diagnostic framework to identify when a detected shift has occurred and to isolate the shifted components.",2014,Advanced Materials Research
A robust â„“1 penalized DOA estimator,"The SPS-LASSO has recently been introduced as a solution to the problem of regularization parameter selection in the complex-valued LASSO problem. Still, the dependence on the grid size and the polynomial time of performing convex optimization technique in each iteration, in addition to the deficiencies in the low noise regime, confines its performance for Direction of Arrival (DOA) estimation. This work presents methods to apply LASSO without grid size limitation and with less complexity. As we show by simulations, the proposed methods loose a negligible performance compared to the Maximum Likelihood (ML) estimator, which needs a combinatorial search We also show by simulations that compared to practical implementations of ML, the proposed techniques are less sensitive to the source power difference.",2012,"2012 Conference Record of the Forty Sixth Asilomar Conference on Signals, Systems and Computers (ASILOMAR)"
Graphon estimation via nearest neighbor algorithm and 2D fused lasso denoising,"We propose a class of methods for graphon estimation based on exploiting connections with nonparametric regression. The idea is to construct an ordering of the nodes in the network, similar in spirit to Chan and Airoldi (2014). However, rather than only considering orderings based on the empirical degree as in Chan and Airoldi (2014), we use the nearest neighbor algorithm which is an approximating solution to the traveling salesman problem. This in turn can handle general distances $\hat{d}$ between the nodes, something that allows us to incorporate rich information of the network. Once an ordering is constructed, we formulate a 2D grid graph denoising problem that we solve through fused lasso regularization. For particular choices of the metric $\hat{d}$, we show that the corresponding two-step estimator can attain competitive rates when the true model is the stochastic block model, and when the underlying graphon is piecewise H\""{o}lder or it has bounded variation.",2018,arXiv: Methodology
Coupled Biasâ€“Variance Tradeoff for Cross-Pose Face Recognition,"Subspace-based face representation can be looked as a regression problem. From this viewpoint, we first revisited the problem of recognizing faces across pose differences, which is a bottleneck in face recognition. Then, we propose a new approach for cross-pose face recognition using a regressor with a coupled bias-variance tradeoff. We found that striking a coupled balance between bias and variance in regression for different poses could improve the regressor-based cross-pose face representation, i.e., the regressor can be more stable against a pose difference. With the basic idea, ridge regression and lasso regression are explored. Experimental results on CMU PIE, the FERET, and the Multi-PIE face databases show that the proposed bias-variance tradeoff can achieve considerable reinforcement in recognition performance.",2012,IEEE Transactions on Image Processing
