title,abstract,year,journal
Variable selection in monotone single-index models via the adaptive LASSO.,"We consider the problem of variable selection for monotone single-index models. A single-index model assumes that the expectation of the outcome is an unknown function of a linear combination of covariates. Assuming monotonicity of the unknown function is often reasonable and allows for more straightforward inference. We present an adaptive LASSO penalized least squares approach to estimating the index parameter and the unknown function in these models for continuous outcome. Monotone function estimates are achieved using the pooled adjacent violators algorithm, followed by kernel regression. In the iterative estimation process, a linear approximation to the unknown function is used, therefore reducing the situation to that of linear regression and allowing for the use of standard LASSO algorithms, such as coordinate descent. Results of a simulation study indicate that the proposed methods perform well under a variety of circumstances and that an assumption of monotonicity, when appropriate, noticeably improves performance. The proposed methods are applied to data from a randomized clinical trial for the treatment of a critical illness in the intensive care unit.",2013,Statistics in medicine
37 Evidence-based medicine course as part of an international medical education curriculum in a russian medical school,"Objectives Russian medical schools are currently incorporating evidence-based medicine (EBM) principles into their curricula. However, many medical schools still lack ancillary courses on research methods, epidemiology, biostatistics, etc., that result in reportedly poor quality of medical research in Russia. 1 2 Many reasons for the difficulties have been identified, including linguistic barriers, lack of expertise, limited international collaboration, and inadequate allocation of resources. We hypothesized that the addition of an elective EBM curriculum to students in a Russian medical school would develop skills in searching, interpreting and evaluating medical literature, essential components of EBM. As part of an international collaborative education program between two departments of anesthesiology, the EBM elective curriculum was created and introduced to all medical students (years 1-6). We then assessed the value of the course, studentsâ€™ attitude towards EBM, the extent to which they are engaged with evidence-based methodology, and the ability to incorporate EBM principles into future practice. Method The collaborative education program was created between the Department of Anesthesiology, Keck School of Medicine at the University of Southern California (KSOM, USA) and the Department of Anesthesiology, School of Medicine and Psychology at the Novosibirsk State University (NSU, Russia). The EBM course included 18 seminars and journal clubs on biostatistics, clinical epidemiology, research methodology and other aspects of EBM. Classes were transmitted through video chat from KSOM to NSU, were voluntary and held in English. The course evaluation took place at the conclusion of the first year and consisted of two questionnaires. The first (Qs#1) was for the course participants and a second (Qs#2) was generally distributed among all students to learn about the potential course benefits and their understanding of EBM principles and importance. The questionnaires were distributed online as a GoogleForm (all questions were mandatory, one response per IP) and responses were anonymous. Results Twenty-five students participated in the course. From 152 responses on Qs#1, only 76% agreed that clinical decision-making should be based on scientific evidence. A median frequency of reading medical literature was reported as once a week in their native language and once a month in English. On a scale from 1 to 10, respondents ranked their understanding of scientific manuscripts as 6.3 Â± 1.8, their confidence in assessing the quality of research as 5.5 Â± 2.1. Respondents rated their interest in staying current with literature as 9.0 Â± 1.5, and a potential benefit from learning critical thinking as 8.8 Â± 1.6. In a set of matched questions in Qs#2, course participants reported that the course was valuable, helped build confidence in assessing research articles, and improved critical thinking. Participants vs. non-participants are more familiar with EBM (8.2 Â± 2.2 vs. 6.6 Â± 2.8, p-value=0.002) and read medical literature more frequently (native language p-value=0.039, English p-value=0.003). Conclusions Based on prior publications, 1 2 some Russian medical schools lack an EBM curriculum. By surveying a general medical student population, we found a discrepancy between the current and desired level of understanding of EBM indicating an unmet need. Currently, students feel insecure in applying EBM principles and have a deficiency in reading medical literature, especially in English. The EBM course, one component of an international education program, was established to create a scientific-centered learning environment, to provide expertise in EBM, and to help students overcome linguistic barrier. The participant evaluations showed that the course addressed positively the demonstrated needs of students and improved their reading and understanding of medical literature. We present evidence that reflects need for and benefits of including EBM in the medical curriculum. These findings indicate that international collaboration enhanced the medical studentsâ€™ educational experience by augmenting previously unavailable curricular content and should be continued. References Telen, Marilyn J. 2014. â€œTeaching Evidence-Based Medicine in the Former Soviet Union: Lessons Learned.â€ Transactions of the American Clinical and Climatological Association 125: 88â€“102; discussion 102â€“3. https://www.ncbi.nlm.nih.gov/pubmed/25125721. Vlassov, Vasiliy V. 2017. â€œRussian Medicine: Trying to Catch up on Scientific Evidence and Human Values.â€ The Lancet 390 (10102): 1619â€“20. https://doi.org/10.1016/S0140- 6736(17)32382-6.",2019,
Underdetermined DOA Estimation Using MVDR-Weighted LASSO,"The direction of arrival (DOA) estimation problem is formulated in a compressive sensing (CS) framework, and an extended array aperture is presented to increase the number of degrees of freedom of the array. The ordinary least square adaptable least absolute shrinkage and selection operator (OLS A-LASSO) is applied for the first time for DOA estimation. Furthermore, a new LASSO algorithm, the minimum variance distortionless response (MVDR) A-LASSO, which solves the DOA problem in the CS framework, is presented. The proposed algorithm does not depend on the singular value decomposition nor on the orthogonality of the signal and the noise subspaces. Hence, the DOA estimation can be done without a priori knowledge of the number of sources. The proposed algorithm can estimate up to ( ( M 2 - 2 ) / 2 + M - 1 ) / 2 sources using M sensors without any constraints or assumptions about the nature of the signal sources. Furthermore, the proposed algorithm exhibits performance that is superior compared to that of the classical DOA estimation methods, especially for low signal to noise ratios (SNR), spatially-closed sources and coherent scenarios.",2016,"Sensors (Basel, Switzerland)"
Hyperspectral Band Selection for Face Recognition Based on a Structurally Sparsified Deep Convolutional Neural Networks,"Hyperspectral imaging systems collect and process information from specific wavelengths across the electromagnetic spectrum. The fusion of multi-spectral bands in the visible spectrum has been exploited to improve face recognition performance over conventional broad band face images. In this paper, we propose a new Convolutional Neural Network (CNN) framework which adopts a structural sparsity learning technique to select the optimal spectral bands to obtain the best face recognition performance over all of the spectral bands. Specifically, in this method, all the bands are fed to a CNN and the convolutional filters in the first layer of the CNN are then regularized by employing a group Lasso algorithm to zero out the redundant bands during the training of the network. Contrary to other methods which usually select the bands manually or in a greedy fashion, our method selects the optimal spectral bands automatically to achieve the best face recognition performance over all the spectral bands. Moreover, experimental results demonstrate that our method outperforms state of the art band selection methods for face recognition on several publicly-available hyperspectral face image datasets.",2019,2019 International Conference on Biometrics (ICB)
Farmed Salmon And Artificial Color Additives | Verlasso,Farmed salmon's meat would be grey without the use of dyes. Read more about this process here and see why Verlasso is different.,2012,
Catheter ablation of atrial fibrillation in patients with valvular heart disease: long-term follow-up results.,"UNLABELLED
AF Ablation in Patients With Valvular Heart Disease.


BACKGROUND
The purpose of this study is to evaluate the efficacy of atrial fibrillation (AF) ablation in patients with moderate valvular heart disease (VHD).


METHODS
In total, 534 consecutive patients who underwent AF ablation were enrolled. Patients with a history of valve surgery or other structural heart disease were excluded. Patients with clinically moderate VHD (group-1, n = 45) were compared with those without VHD (control group-2, n = 436). Ipsilateral pulmonary vein antrum isolation (PVAI) was performed with a double Lasso technique in all the patients. Left atrial (LA) linear ablation was undertaken in persistent AF patients, if AF was inducible after PVAI.


RESULTS
Patients in group-1 were significantly older and had a larger LA. PVAI was successfully achieved in all the patients. Patients in group-1 received LA linear ablation more frequently during the index procedure. After a median of 26 months from the index procedure, the freedom from AF was significantly lower in group-1 than group-2 off antiarrhythmic drugs (AADs) (47% vs 69%, P = 0.002). Although there were more number of total procedures in group-1 than group-2, the freedom from AF was lower at median 24 months after the last procedure (78% vs 87%, P = 0.038). There was no significant difference in the freedom from AF on AADs (91% vs 95%, P = 0.356) or complication rate between the 2 groups. Atrial tachycardia following the index procedure was observed more frequently in group-1 (P = 0.001).


CONCLUSION
The patients with VHD undergoing AF ablation are less likely to remain in sinus rhythm at long term without AADs than those without VHD.",2010,Journal of cardiovascular electrophysiology
Lasso Meets Horseshoe,"The goal of our paper is to survey and contrast the major advances in two of the most commonly used high-dimensional techniques, namely, the Lasso and horseshoe regularization methodologies. Lasso is a gold standard for best subset selection of predictors while the horseshoe is a state-of-the-art Bayesian estimator for sparse signals. Lasso is scalable and fast using convex optimization whilst the horseshoe is a non-convex penalty. Our novel perspective focuses on three aspects, (i) efficiency and scalability of computation and (ii) methodological development and performance and (iii) theoretical optimality in high dimensional inference for the Gaussian sparse model and beyond.",2017,
Common Substructure Learning of Multiple Graphical Gaussian Models,"Learning underlying mechanisms of data generation is of great interest in the scientific and engineering fields amongst others. Finding dependency structures among variables in the data is one possible approach for the purpose, and is an important task in data mining. In this paper, we focus on learning dependency substructures shared by multiple datasets. In many scenarios, the nature of data varies due to a change in the surrounding conditions or non-stationary mechanisms over the multiple datasets. However, we can also assume that the change occurs only partially and some relations between variables remain unchanged. Moreover, we can expect that such commonness over the multiple datasets is closely related to the invariance of the underlying mechanism. For example, errors in engineering systems are usually caused by faults in the sub-systems with the other parts remaining healthy. In such situations, though anomalies are observed in sensor values, the underlying invariance of the healthy sub-systems is still captured by some steady dependency structures before and after the onset of the error. We propose a structure learning algorithm to find such invariances in the case of Graphical Gaussian Models (GGM). The proposed method is based on a block coordinate descent optimization, where subproblems can be solved efficiently by existing algorithms for Lasso and the continuous quadratic knapsack problem. We confirm the validity of our approach through numerical simulations and also in applications with real world datasets extracted from the analysis of city-cycle fuel consumption and anomaly detection in car sensors.",2011,
Comment on article by Polson and Scott,"We congratulate the authors for a very interesting article. The key contribution of this paper, as we see it and as suggested in the title, is the introduction of latent parameters to carry out Bayesian analysis with support vector machines. The basic identities (4) and (6) are particularly useful in this regard, which enable one to overcome much of the complexities of a non smooth loss resulting in a non smooth likelihood. As an anecdote, from a Bayesian angle, it is extremely convenient to view the loss as the negative of the loglikelihood (for example associating squared error loss with the normal likelihood) and the penalty part with the prior. This is the approach taken in this paper, and also earlier in Mallick et al. (2005). Based on a loss function, we can obtain the normalized or the non-normalized (or pseudo) likelihood. The authors considered the non-normalized likelihood and that way obtained the pseudo posterior distribution. This pseudo posterior distribution may not be suitable to make probabilistic inference. Mallick et al. (2005) considered both the normalized and the non-normalized likelihoods and the classiflcation performances were compatible. It will be interesting to see how the proposed method can be adapted for the model with the normalized likelihood. The introduction of latent parameters facilitates Bayesian variable selection with LASSO (Park and Casella (2008); Bae and Mallick (2007)) and its generalizations such as grouped LASSO, fused LASSO and elastic net (Kyung et al., 2010; Chakraborty and Guo, 2010). Not surprisingly, this helps also in classiflcation problems with a penalty function which is the same as in LASSO. One interesting feature in this paper is the consideration of a general fi in (6) rather than the conventional fi = 1 or 2. Corollary 4 in this paper seems to be an interesting result, especially because of its importance in developing the necessary algorithm.",2011,Bayesian Analysis
Graph estimation for Gaussian data zero-inflated by double truncation,"We consider the problem of graph estimation in a zero-inflated Gaussian model. In this model, zero-inflation is obtained by double truncation (right and left) of a Gaussian vector. The goal is to recover the latent graph structure of the Gaussian vector with observations of the zero-inflated truncated vector. We propose a two step estimation procedure. The first step consists in estimating each term of the covariance matrix by maximising the corresponding bivariate marginal log-likelihood of the truncated vector. The second one uses the graphical lasso procedure to estimate the precision matrix sparsity, which encodes the graph structure. We then state some theoretical convergence results about the convergence rate of the covariance matrix and precision matrix estimators. These results allow us to establish consistency of our procedure with respect to graph structure recovery. We also present some simulation studies to corroborate the efficiency of our procedure.",2019,
Dependent relevance determination for smooth and structured sparse regression,"In many problem settings, parameter vectors are not merely sparse, but dependent in such a way that non-zero coefficients tend to cluster together. We refer to this form of dependency as ""region sparsity"". Classical sparse regression methods, such as the lasso and automatic relevance determination (ARD), which model parameters as independent a priori, and therefore do not exploit such dependencies. Here we introduce a hierarchical model for smooth, region-sparse weight vectors and tensors in a linear regression setting. Our approach represents a hierarchical extension of the relevance determination framework, where we add a transformed Gaussian process to model the dependencies between the prior variances of regression weights. We combine this with a structured model of the prior variances of Fourier coefficients, which eliminates unnecessary high frequencies. The resulting prior encourages weights to be region-sparse in two different bases simultaneously. We develop Laplace approximation and Monte Carlo Markov Chain (MCMC) sampling to provide efficient inference for the posterior. Furthermore, a two-stage convex relaxation of the Laplace approximation approach is also provided to relax the inevitable non-convexity during the optimization. We finally show substantial improvements over comparable methods for both simulated and real datasets from brain imaging.",2019,J. Mach. Learn. Res.
Multisnapshot Sparse Bayesian Learning for DOA,"The directions of arrival (DOA) of plane waves are estimated from multisnapshot sensor array data using sparse Bayesian learning (SBL). The prior for the source amplitudes is assumed independent zero-mean complex Gaussian distributed with hyperparameters, the unknown variances (i.e., the source powers). For a complex Gaussian likelihood with hyperparameter, the unknown noise variance, the corresponding Gaussian posterior distribution is derived. The hyperparameters are automatically selected by maximizing the evidence and promoting sparse DOA estimates. The SBL scheme for DOA estimation is discussed and evaluated competitively against LASSO (â„“1-regularization), conventional beamforming, and MUSIC.",2016,IEEE Signal Processing Letters
The flare package for high dimensional linear regression and precision matrix estimation in R,"This paper describes an R package named flare, which implements a family of new high dimensional regression methods (LAD Lasso, SQRT Lasso, â„“ q Lasso, and Dantzig selector) and their extensions to sparse precision matrix estimation (TIGER and CLIME). These methods exploit different nonsmooth loss functions to gain modeling exibility, estimation robustness, and tuning insensitiveness. The developed solver is based on the alternating direction method of multipliers (ADMM), which is further accelerated by the multistage screening approach. The package flare is coded in double precision C, and called from R by a user-friendly interface. The memory usage is optimized by using the sparse matrix output. The experiments show that flare is efficient and can scale up to large problems.",2015,Journal of machine learning research : JMLR
Isolation and characterization of algicidal bacteria from Cochlodinium polykrikoides culture,"In this study, we analyzed a bacterial community closely associated with Cochlodinium polykrikoides that caused harmful algal blooming in the sea. Filtration using a plankton mesh and percoll gradient centrifugation were performed to eliminate free-living bacteria. Attached bacteria were analyzed by culture-dependent and culture-independent methods. Five culturable bacterial strains were isolated and identified from the C. polykrikoides mixed bacterial community. The isolates belonged to Î±-Proteobacteria (Nautella sp., Sagittula sp., and Thalassobius sp.) and Î³-Proteobacteria (Alteromonas sp. and Pseudoalteromonas sp.). All of the 5 isolates showed algicidal activity against C. polykrikoides and produced extracellular compounds responsible for algicidal properties after entering the stationary phase. The algicidal compounds produced by the 5 isolates were heat-stable and had molecular masses of less than 10,000 Da. Furthermore, the algicidal compounds were relatively specific for C. polykrikoides in terms of their algicidal activities. Culture-independent analysis of the bacterial community in association with C. polykrikoides was performed using polymerase chain reaction-denaturing gradient gel electrophoresis (PCR-DGGE). On the basis of the PCR-DGGE profile, Sagittula sp. was identified as a dominant species in the bacterial community of C. polykrikoides.",2011,Biotechnology and Bioprocess Engineering
"Sparse Bayesian dynamic network models, with genomics applications","Network models have become an important topic in modern statistics, and the evolution of network structure over time is an important new area of study, relevant to a range of applications. An important application of statistical network modelling is in genomics: network models are a natural way to describe and analyse patterns of interactions between genes and their products. However, whilst network models are well established in genomics, historically these models have mostly been static network models, ignoring the dynamic nature of genomic processes. 
In this work, we propose a model to infer dynamic genomic network structure, based on single-cell measurements of gene-expression counts. Our model draws on ideas from the Bayesian lasso and from copula modelling, and is implemented efficiently by combining Gibbs- and slice-sampling techniques. We apply the modelling to data from neural development, and infer changes in network structure which match current biological knowledge, as well as discovering novel network structures which identify potential targets for further experimental investigation by neuro-biologists.",2018,arXiv: Methodology
"More powerful post-selection inference, with application to the Lasso","Investigators often use the data to generate interesting hypotheses and then perform inference for the generated hypotheses. P-values and confidence intervals must account for this explorative data analysis. A fruitful method for doing so is to condition any inferences on the components of the data used to generate the hypotheses, thus preventing information in those components from being used again. Some currently popular methods ""over-condition"", leading to wide intervals. We show how to perform the minimal conditioning in a computationally tractable way. In high dimensions, even this minimal conditioning can lead to intervals that are too wide to be useful, suggesting that up to now the cost of hypothesis generation has been underestimated. We show how to generate hypotheses in a strategic manner that sharply reduces the cost of data exploration and results in useful confidence intervals. Our discussion focuses on the problem of post-selection inference after fitting a lasso regression model, but we also outline its extension to a much more general setting.",2018,arXiv: Methodology
"Nouvelles espÃ¨ces du genre Mausoleopsis Lansberge [Coleoptera, Cetoniidae]","Three new species are described in the genus Mausoleopsis Lansberge : M. dechambrei from Somalia, M. lizleri and M. werneri from Ethiopia. Two new synonymies are proposed : Elassochiton variabilis Moser, 1913, with Mausoleopsis quadrimaculata Kraatz, 1899, and Elassochiton confusus Muller, 1941, with Mausoleopsis fallaciosa Bourgoin, 1923. Lectotypes are designated for Mausoleopsis albomarginata Lansberge, Elassochiton variabilis Moser, M. fallaciosa Bourgoin and E. parvulus Muller.",1999,
